Index,Title,DOI,Abstract,Authors,A_Decision,A_Reason,A_P,A_I,A_C,A_O,A_S,B_Decision,B_Reason,B_P,B_I,B_C,B_O,B_S,C_Decision,C_Reason,Final_Decision
121,Cost-effectiveness of selective internal radiation therapy with Y-90 resin microspheres for intermediate- and advanced-stage hepatocellular carcinoma in Brazil,10.1080/13696998.2023.2210475,"Aims Hepatocellular carcinoma (HCC) is a severe condition with poor prognosis that places a significant burden on patients, caregivers, and healthcare systems. Selective internal radiation therapy (SIRT) is a treatment available to patients with HCC which addresses some of the limitations of alternative treatment options. A cost-effectiveness analysis was undertaken into the use of SIRT using Y-90 resin microspheres for the treatment of unresectable intermediate- and late-stage HCC in Brazil. Materials and methods A partitioned-survival model was developed, including a tunnel state for patients downstaged to receive treatments with curative intent. Sorafenib was the selected comparator, a common systemic treatment in Brazil and for which comparative evidence exists. Clinical data were extracted from published sources of pivotal trials, and effectiveness was measured in quality-adjusted life-years (QALYs) and life-years (LYs). The analysis was conducted from the Brazilian private payer perspective and a lifetime horizon was implemented. Comprehensive sensitivity analyses were conducted. Results LYs and QALYs were higher for SIRT with Y-90 resin microspheres versus sorafenib (0.27 and 0.20 incremental LYs and QALYs, respectively) and costs were slightly higher for SIRT (R$15,864). The base case incremental cost-effectiveness ratio (ICER) was R$77,602 per QALY. The ICER was mostly influenced by parameters defining the sorafenib overall survival curve and SIRT had a 73% probability of being cost-effective at a willingness-to-pay threshold of R$135,761 per QALY (3-times the per-capita gross domestic product in Brazil). Overall, sensitivity analyses confirmed the robustness of the results indicating that SIRT with Y-90 resin microspheres is cost-effective compared with sorafenib. Limitations A rapidly evolving treatment landscape in Brazil and worldwide, and the lack of local data for some variables were the main limitations. Conclusions SIRT with Y-90 resin microspheres is a cost-effective option compared with sorafenib in Brazil.","Agirrezabal, I; Grillo, LSP; Nasser, F; Brennan, VK; Bugano, D; Galastri, FL; de Azeredo-da-Silva, ALF; Shergill, S; da Motta-Leal, JM",False,not a randomized controlled trial,patients with unresectable intermediate- and late-stage HCC,SIRT using Y-90 resin microspheres,sorafenib,LYs and QALYs,not a randomized controlled trial,,,,,,,,,,
122,Downstaging Hepatocellular Carcinoma before Transplantation Role of Immunotherapy Versus Locoregional Approaches,10.1016/j.soc.2023.07.001,"HCC continues to be a leading cause of cancer-related death in the United States. With advances in locoregional therapy for unresectable HCC during the last 2 decades and the recent expansion of transplant criteria for HCC, as well as ongoing organ shortages, patients are spending more time on the waitlist, which has resulted in increased usage of locoregional therapies. This changing landscape is well displayedin Fig. 1, which demonstrates the number of treatments per patient by year of listing (A) and the proportion of locoregional therapy type by year of treatment (B).91 Less than half of liver transplant candidates on the waiting list underwent locoregional therapy before listing in 2003, whereas 92.4% underwent some form of locoregional therapy in 2018.91 Although TACE is the current preferred modality for liver-directed therapy as a bridge to transplant in patients with HCC, recent evidence suggests that radioembolization may prolong time to progression when compared with chemoembolization. In just the last 5 years, the proportion of radioembolization performed for HCC has increased significantly, from less than 5% in 2013 to 19% in 2018.91 Expanding on the proven value of locoregional therapies, the plethora of molecularly targeted therapies and ICIs under investigation represent the new horizon of treatment of HCC not only in advanced stages but also potentially at every stage of diagnosis and management. Although data remain sparse in the pretransplantation population, the possibility of downstaging patients previously considered unresectable or initially outside of transplant criteria is an extremely alluring strategy, which may prove vital in establishing transplant candidacy for an expanded host of patients. Combination therapies have already begun to show promise in maintaining disease control and may ultimately prove lifesaving in patients who are able to undergo liver transplant. Although it will be critical in the coming years to determine timing of therapy and appropriate postoperative immunosuppression strategies, both locoregional techniques and immunomodulation will change the history of liver transplant for HCC as we currently know it.","Lindemann, J; Yu, J; Doyle, MBM",False,does not specify a comparison or study design,patients with hepatocellular carcinoma,locoregional therapies and immune checkpoint inhibitors,not specified,not specified,not specified,,,,,,,,,,
123,Conversion therapy for unresectable intrahepatic cholangiocarcinoma using gemcitabine plus S-1 combined with PD-1 inhibitors: a case report,10.3389/fonc.2024.1476593,"Intrahepatic cholangiocarcinoma (iCCA) is a highly malignant tumor of the liver and gallbladder, which is usually diagnosed at an advanced stage and the opportunity for surgery is lost. Therefore, conversion therapy is important to convert the iCCA into a resectable state. In recent years, the conversion protocol of immuno-chemotherapy has been applied for advanced liver cancer. However, little has been reported about iCCA conversion therapy. The aim of this report is to present the results of conversion therapy with Gemcitabine plus S-1 (GS) combined with PD-1 inhibitors (Zimberelimab) in a 74-year-old female IIIB iCCA patient. After 6 cycles of conversion therapy, enhanced CT showed that the patient's tumor had shrunk to nearly half its original size, making radical resection possible. Postoperative pathology showed a complete pathological response. This provides a new way to convert advanced iCCA into resectable state.","Zhao, SY; Zhang, XD; Luo, JL; Yan, HJ; Zhang, JL; Lin, RF; Zhu, KL",False,not focused on hepatocellular carcinoma,not specified,immuno-chemotherapy with PD-1 inhibitors,not specified,not specified,not specified,,,,,,,,,,
124,"Nivolumab after selective internal radiation therapy for the treatment of hepatocellular carcinoma: a phase 2, single-arm study",10.1136/jitc-2022-005457,"Purpose To evaluate the safety and efficacy of selective internal radiation therapy (SIRT) in combination with a PD-1 inhibitor in patients with unresectable hepatocellular carcinoma (uHCC) and liver-only disease ineligible for chemoembolization.Patients and methods NASIR-HCC is a single-arm, multicenter, open-label, phase 2 trial that recruited from 2017 to 2019 patients who were naive to immunotherapy and had tumors in the BCLC B2 substage (single or multiple tumors beyond the up-to-7 rule), or unilobar tumors with segmental or lobar portal vein invasion (PVI); no extrahepatic spread; and preserved liver function. Patients received SIRT followed 3 weeks later by nivolumab (240 mg every 2 weeks) for up to 24 doses or until disease progression or unacceptable toxicity. Safety was the primary endpoint. Secondary objectives included objective response rate (ORR), time to progression (TTP), and overall survival (OS).Results 42 patients received SIRT (31 BCLC-B2, 11 with PVI) and were followed for a median of 22.2 months. 27 patients discontinued and 1 never received Nivolumab. 41 patients had any-grade adverse events (AE) and 21 had serious AEs (SAE). Treatment-related AEs and SAEs grade 3-4 occurred in 8 and 5 patients, respectively. Using RECIST 1.1 criteria, ORR reported by investigators was 41.5% (95% CI 26.3% to 57.9%). Four patients were downstaged to partial hepatectomy. Median TTP was 8.8 months (95% CI 7.0 to 10.5) and median OS was 20.9 months (95% CI 17.7 to 24.1).Conclusions The combination of SIRT and nivolumab has shown an acceptable safety profile and signs of antitumor activity in the treatment of patients with uHCC that were fit for SIRT.","de la Torre-Alez, M; Matilla, A; Varela, M; Iarrairaegui, M; Reig, M; Lled, JL; Arenas, JI; Lorente, S; Testillano, M; Mrquez, L; Da Fonseca, L; Argem, J; Gmez-Martin, C; Rodriguez-Fraile, M; Bilbao, J; Sangro, B",False,not a randomized controlled trial,patients with unresectable hepatocellular carcinoma,SIRT followed by nivolumab,not specified,OS and ORR,single-arm phase 2 trial,,,,,,,,,,
125,Novel implications in the treatment of hepatocellular carcinoma,10.20524/aog.2016.0092,"Worldwide hepatocellular carcinoma remains one of the leading causes of cancer-related death, associated with a poor prognosis due to late diagnosis in the majority of cases. Physicians at care are frequently confronted with patients who are ineligible for curative treatment such as liver resection, transplantation or radiofrequency ablation. Besides established palliative locoregional therapies, such as ablation or chemoembolization, new treatment options, such as microwave ablation, drug-eluting bead transarterial chemoembolization or selective internal radiation therapy, are emerging; however, data from randomized controlled trials are still lacking. In order to achieve optimal tumor control, patients should receive tailored treatment concepts, considering their tumor burden, liver function and performance status, instead of strictly assigning patients to treatment modalities following algorithms that may be partly very restrictive. Palliative locoregional pretreatment might facilitate downstaging to ensure later curative resection or transplantation. In addition, the combined utilization of different locoregional treatment options or systemic co-treatment has been the subject of several trials. In cases where local tumor control cannot be achieved, or in the scenario of extrahepatic spread, sorafenib remains the only approved systemic therapy option. Alternative targeted therapies, such as immune checkpoint inhibitors have shown encouraging preliminary results, while data from phase III studies are pending.","Best, J; Schotten, C; Theysohn, JM; Wetter, A; Mller, S; Radnz, S; Schulze, M; Canbay, A; Dechne, A; Gerken, G",False,"does not specify intervention, comparison, or outcomes",patients with hepatocellular carcinoma,not specified,not specified,not specified,not specified,,,,,,,,,,
126,Liver transplantation and resection in patients with hepatocellular cancer and portal vein tumor thrombosis: Feasible and effective?,10.1016/j.hbpd.2023.10.002,"Patients with locally advanced hepatocellular cancer (HCC) and portal vein tumor thrombosis (PVTT) have a dismal prognosis since limited treatment options are available for them. In recent years, effective systemic therapy, and advances in the understanding of technicalities and effectiveness of ablative therapies especially radiotherapy, have given some hope to prolong survival in them. This review summarized recent evidence in literature regarding the possible role of liver resection (LR) and liver transplantation (LT) in patients with locally advanced HCC and PVTT with no extrahepatic disease. Downstaging therapies have helped make curative resection or LT a reality in selected patients. This review emphasizes on the key points to focus on when considering surgery in these patients, who are usually relegated to palliative systemic therapy alone. Meticulous patient selection based on tumor biology, documented downstaging based on imaging and decrease in tumor marker levels, and an adequate waiting period to demonstrate stable disease, may help obtain satisfactory long-term outcomes post LR or LT in an intention to treat strategy in patients with HCC and PVTT. (c) 2023 First Affiliated Hospital, Zhejiang University School of Medicine in China. Published by Elsevier B.V. All rights reserved.","Bhangui, P",False,"does not specify intervention, comparison, or outcomes",patients with locally advanced hepatocellular cancer with portal vein tumor thrombosis,not specified,not specified,not specified,not specified,,,,,,,,,,
127,Safety and Efficacy of Drug-Eluting Bead Transarterial Chemoembolization Combined with Lenvatinib and Anti-PD-1 Antibodies for Unresectable Hepatocellular Carcinoma: A Retrospective Analysis,10.2147/JHC.S408819,"Background: Drug-eluting bead transarterial chemoembolization (DEB-TACE) has good efficacy in the treatment of unresectable hepatocellular carcinoma (uHCC), with a relatively high objective response rate (ORR) compared to conventional transarterial chemoembolization (cTACE). This study aimed to evaluate the safety and medium-term clinical efficacy of DEB-TACE combined with lenvatinib (LEN) plus PD-1 inhibitors as a triple therapy for the treatment of uHCC.Methods: Data of patients with uHCC who received triple therapy of DEB-TACE combined with LEN plus PD-1 inhibitors from January 2019 to June 2021 were analyzed retrospectively. The study endpoints were ORR, progression-free survival (PFS), and treatment-related adverse events based on the modified Response Evaluation Criteria in Solid Tumors (mRECIST).Results: Thirty-five patients were included in this study, with a median follow-up period of 15 months. The median cycle of DEB-TACE was 1, while that of all forms of TACE procedures per patient was 2. The median administration time of LEN was 7 months, and the median number of PD-1 inhibitor treatment was 4 cycles. The ORR based on mRECIST was 82.9%, disease control rate was 91.4%, and the median time to response was 7 weeks. Among these, the ORR of Barcelona Clinic Liver Cancer (BCLC) stage A reached 100%, while that of BCLC stages B and C reached 84.6% and 78.9%, respectively. The median PFS was 9 months; the mOS was not reached. Fourteen patients (40%) successfully underwent downstaging conversion and surgical resection, 32 patients (91.4%) experienced treatment-related adverse events, and no grade 5-related adverse reactions occurred.Conclusion: DEB-TACE combined with LEN and PD-1 inhibitors has a high ORR and surgical conversion rate in the treatment of uHCC tumors, and the toxicity and side effects were tolerable.","Wu, SJ; Ruan, DD; Wu, QY; Tang, Y; Zhang, JH; Cai, SL; Zhou, YF; Luo, JW; Fang, ZT",False,not a randomized controlled trial,patients with unresectable hepatocellular carcinoma,DEB-TACE combined with lenvatinib and PD-1 inhibitors,not specified,"objective response rate, progression-free survival","retrospective analysis, not RCT",,,,,,,,,,
128,Finding Nivo: A Case Report of 2 Forms of Nivolumab-Induced Liver Injury in an Allograft Liver in the Immediate Post-Transplant Period,10.1016/j.transproceed.2022.07.018,"Recent reports have emerged regarding the utilization of checkpoint inhibitors for downstaging hepatocellular carcinoma before liver transplantation. Early post-transplant acute cellular rejec-tion has rarely led to graft loss. We report the first case of 2 forms of nivolumab-associated liver injury on biopsy of the allograft organ in a single patient who received nivolumab for cancer downstaging before liver transplantation: 1. mild acute cellular rejection according to Risk Anal-ysis Index scoring and 2. zone 3 inflammation and apoptosis consistent with a more classic drug -induced liver injury pattern. This case not only adds further evidence about the risk for rejection post-transplant, but sheds light on other injuries checkpoint inhibitors can cause to the allograft.","Tow, CY; Castrodad-Rodrguez, CA; Panarelli, N; Massoumi, H",False,not a randomized controlled trial and lacks comparison and outcomes,not specified,nivolumab for downstaging hepatocellular carcinoma,not specified,not specified,"case report, not RCT",,,,,,,,,,
129,Focal Update on Immunotherapy and Liver Transplantation in the Era of Transplant Oncology,10.3390/curroncol31090371,"Transplant oncology is an expanding area of cancer therapy that specifically emphasizes the use of liver transplantation (LT) as the preferred treatment for patients with manageable, but unresectable, tumors. The management and optimization of overall survival strategies, accompanied by an arguably decent quality of life, have been at the forefront of liver oncology treatment, as a plurality of all primary liver cancers are identified as either hepatocellular carcinoma (HCC) or cholangiocarcinoma (CCA), which are classified as highly aggressive malignancies and frequently remain asymptomatic until they progress to advanced stages, rendering curative procedures, such as resection, impractical. This has led to an increase in utilization of neoadjuvant interventions conducted prior to surgery, which has yielded favorable outcomes. Though this treatment modality has prompted further investigations into the efficacy of immune checkpoint inhibitors (ICPIs) as standalone treatments and in combination with locoregional treatments (LRTs) to bridge more patients into curative eligibility. This multidisciplinary methodology and treatment planning has seen multiple successful trials of immunotherapy regimes and combinate treatments, setting the groundwork for increasing eligibility through downstaging and ""bridging"" previously ineligible patients within stringent LT criteria. Surveillance after LT is a crucial component of transplant oncology. The emergence of circulating tumor DNA (ctDNA) has provided a novel approach to identifying the recurrence of cancer in its early stages. Recent research has focused on liquid biopsy, a technique that effectively identifies the dynamics of cancer. This is another innovation to demonstrate the rate at which transplant oncology is rapidly advancing, making the focus of care feel disorienting. Modalities of care are constantly evolving, but when a field is changing as rapidly as this one, it is imperative to reorient to the data and the needs of the patients. In this commentary, we reflect on the update's utilization of ICPIs in neoadjuvant settings as well as the updates on the utilization of liquid biopsy in post-LT follow-up surveillance.","Abdelrahim, M; Esmail, A; Hibi, T; Mazzaferro, V",False,not a randomized controlled trial and lacks specific outcomes,patients with hepatocellular carcinoma,immune checkpoint inhibitors in neoadjuvant settings,not specified,not specified,"commentary, not RCT",,,,,,,,,,
130,Breakthroughs in Hepatocellular Carcinoma Therapies.,10.1016/j.cgh.2023.01.039,"Several breakthroughs in hepatocellular carcinoma (HCC) therapy across tumor stages provide hope to improve its dismal prognosis. Although surgical and local ablative therapies have few significant changes in technique, an improved understanding of tumor biology has facilitated increase numbers of patients who are now eligible to undergo curative-intent procedures. Most notably, acceptable post-transplant outcomes can be achieved in well selected patients whose tumors are downstaged into Milan Criteria. Adjuvant therapy in patients at high risk of recurrence also significantly improves recurrence-free survival after resection or ablation. For patients with liver-localized disease who are not eligible for curative-intent procedures, transarterial chemoembolization (TACE) was historically the treatment modality of choice, regardless of tumor burden; however, there is now increased recognition of patients who are ""TACE unsuitable"" and may be better treated with systemic therapy. The greatest evolution in HCC treatment options has occurred with systemic therapy, where several new agents are now available in the first- and second-line setting, including immune checkpoint inhibitor combinations. Objective responses are observed in approximately 30% of patients and median survival is approaching 2 years. The availability of immune checkpoint inhibitors has renewed interest in combination therapies for earlier tumor stages, with several phase III trials ongoing. Considering increasing complexities of HCC care, requiring decisions between therapies delivered by different providers, multidisciplinary care is critical and is associated with improved clinical outcomes. In this review, we detail major breakthroughs in HCC therapy, how these breakthroughs can be applied in clinical practice, and remaining areas in need of further research.",Singal AG; Kudo M; Bruix J,False,does not specify a comparison or study design,patients with hepatocellular carcinoma,immune checkpoint inhibitors combinations,not specified,not specified,not specified,,,,,,,,,,
131,Portal Vein Tumor Thrombosis and Hepatocellular Carcinoma - The Changing Tides.,10.2147/JHC.S318070,"Portal vein involvement is considered one of the most fearful complications of hepatocellular carcinoma (HCC). Portal vein tumor thrombosis (PVTT) is associated with aggressive tumor biology (high grade), high tumor burden (number and size of lesions), high levels of serum markers (AFP), poor liver function (deranged LFT), and poor performance status of patients. The Barcelona Clinic Liver Cancer staging system places HCC patients with PVTT in advanced stage (BCLC Stage-C). This group contains a fairly heterogeneous patient population, previously considered candidates for palliative systemic therapy with sorafenib. However, this provided modest overall survival (OS) benefit. The results of a recent Phase III (IMbrave150) trial favor the combination of atezolizumab and bevacizumab over sorafenib as a standard of care in advanced unresectable HCC. While only lenvatinib proved to be non-inferior against sorafenib in a phase III (REFLECT trial), regorafenib (RESORCE trial), ramucirumab (REACH-2), and cabozantinib (CELESTIAL) have been approved second-line therapy in phase III clinical trials. Recently, the data on the prospect of other modalities in the management of HCC with PVTT is mounting with favorable results. Targeting multiple pathways in the HCC cascade using a combination of drugs and other modalities such as RT, TACE, TARE, and HAIC appear effective for systemic and loco-regional control. The quest for the ideal combination therapy and the sequence set is still widely unanswered and prospective trials are lacking. With the armament of available therapeutic options and the advances and refinements in the delivery system, down-staging patients to make them eligible for curative resection has been reported. In a rapidly evolving treatment landscape, performing surgery when appropriate, in the form of LR and even LT to achieve cure does not seem farfetched. Likewise, adjuvant therapy and prompt management of the recurrences holds the key to prolong OS and DFS. This review discusses the management options of HCC patients with PVTT.",Khan AR; Wei X; Xu X,True,matches all PICOS criteria,patients with hepatocellular carcinoma and portal vein thrombosis,atezolizumab and bevacizumab,sorafenib,overall survival,phase III trial,,,,,,,,,,
