Index,Title,DOI,Abstract,Authors,A_Decision,A_P,A_I,A_C,A_O,A_S,A_Reasoning,B_Decision,B_P,B_I,B_C,B_O,B_S,B_Reasoning,C_Decision,C_Reasoning,Final_Decision
65,"Sintilimab combined with apatinib plus capecitabine in the treatment of unresectable hepatocellular carcinoma: A prospective, open-label, single-arm, phase II clinical study.",10.3389/fimmu.2022.944062,"OBJECTIVE: To evaluate the efficacy and safety of sintilimab combined with apatinib plus capecitabine in the treatment of unresectable hepatocellular carcinoma (HCC) to provide a more effective first-line treatment for patients with advanced HCC. METHODS: This open-label, prospective, phase II study included patients with unresectable HCC who did not receive systematic treatment. The patients were treated with sintilimab (200 mg, intravenous drip, once every 3 weeks) combined with apatinib (250 mg, oral administration, once a day) plus capecitabine (1000 mg/m(2), twice a day; after 2 weeks of oral administration, the drug was stopped for 1 week; course of treatment, 3 weeks). The primary endpoint was the objective response rate (ORR). The secondary endpoints included disease control rate (DCR), progression-free survival (PFS), duration of response (DoR), overall survival (OS), and safety. RESULTS: Forty-seven patients (1 lost to follow-up) were enrolled in the study. As of March 1, 2022, the ORR and DCR were 50.0% (95% CI: 34.9-65.1%) and 91.3% (95% CI: 79.2-97.6%), respectively, after blind, independent imaging evaluation. The median follow-up time was 18.7 months (95% CI: 17.2-20.2 months). The median PFS was 9.0 months (95% CI: 7.1-10.9 months). The median DoR was 10.8 months (95% CI: 4.8-16.8 months). The median OS was not reached, and the 1-year OS rate was 71.7% (95% CI: 56.5-84.0%). Only 28.3% (13/46) of patients had grade 3/4 treatment-related adverse events. CONCLUSION: Sintilimab combined with apatinib plus capecitabine has good safety and anti-tumor activity as a first-line treatment for unresectable HCC. This is worthy of further multi-center, prospective, randomized, large-sample clinical studies. CLINICAL TRIAL REGISTRATION: https://ClinicalTrials.gov, identifier NCT04411706. Shi, Pang, Liu and Xu.",Li D; Xu L; Ji J; Bao D; Hu J; Qian Y; Zhou Y; Chen Z; Li D; Li X; Zhang X; Wang H; Yi C; Shi M; Pang Y; Liu S; Xu X,False,patients with unresectable hepatocellular carcinoma,sintilimab combined with apatinib plus capecitabine,not specified,"objective response rate, disease control rate, progression-free survival, duration of response, overall survival","open-label, prospective, phase II study",No comparison to standard therapy or placebo specified; study design not matching criteria.,False,-,-,-,-,-,"The study lacks a comparison group and focuses on an open-label, single-arm design. However, it provides detailed efficacy and safety data.",,,False
66,A Non-interventional Clinical Trial Assessing Immune Responses After Radiofrequency Ablation of Liver Metastases From Colorectal Cancer.,10.3389/fimmu.2019.02526,"Background: Radiofrequency ablation (RFA) is an established treatment option for malignancies located in the liver. RFA-induced irreversible coagulation necrosis leads to the release of danger signals and cellular content. Hence, RFA may constitute an endogenous in situ tumor vaccination, stimulating innate and adaptive immune responses, including tumor-antigen specific T cells. This may explain a phenomenon termed abscopal effect, namely tumor regression in untreated lesions evidenced after distant thermal ablation or irradiation. In this study, we therefore assessed systemic and local immune responses in individual patients treated with RFA. Methods: For this prospective clinical trial, patients with liver metastasis from colorectal carcinoma (mCRC) receiving RFA and undergoing metachronous liver surgery for another lesion were recruited (n = 9) during a 5-year period. Tumor and non-malignant liver tissue samples from six patients were investigated by whole transcriptome sequencing and tandem-mass spectrometry, characterizing naturally presented HLA ligands. Tumor antigen-derived HLA-restricted peptides were selected by different predefined approaches. Further, candidate HLA ligands were manually curated. Peripheral blood mononuclear cells were stimulated in vitro with epitope candidate peptides, and functional T cell responses were assessed by intracellular cytokine staining. Immunohistochemical markers were additionally investigated in surgically resected mCRC from patients treated with (n = 9) or without RFA (n = 7). Results: In all six investigated patients, either induced immune responses and/or pre-existing T cell immunity against the selected targets were observed. Multi-cytokine responses were inter alia directed against known tumor antigens such as cyclin D1 but also against a (predicted) mutation contained in ERBB3. Immunohistochemistry did not show a relevant influx of immune cells into distant malignant lesions after RFA treatment (n = 9) as compared to the surgery only mCRC group (n = 7). Conclusions: Using an individualized approach for target selection, RFA induced and/or boosted T cell responses specific for individual tumor antigens were more frequently detectable as compared to previously published observations with well-characterized tumor antigens. However, the witnessed modest RFA-induced immunological effects alone may not be sufficient for the rejection of established tumors. Therefore, these findings warrant further clinical investigation including the assessment of RFA combination therapies e.g., with immune stimulatory agents, cancer vaccination, and/or immune checkpoint inhibitors. Kowalewski, Mühlenbruch, Königsrainer, Beckert, Ladurner, Wagner, Bullinger, Gross, Schroeder, Sipos, Königsrainer, Stevanović, Denkert, Rammensee, Gouttefangeas and Haen.",Löffler MW; Nussbaum B; Jäger G; Jurmeister PS; Budczies J; Pereira PL; Clasen S; Kowalewski DJ; Mühlenbruch L; Königsrainer I; Beckert S; Ladurner R; Wagner S; Bullinger F; Gross TH; Schroeder C; Sipos B; Königsrainer A; Stevanović S; Denkert C; Rammensee HG; Gouttefangeas C; Haen SP,False,patients with liver metastasis from colorectal carcinoma,radiofrequency ablation,not specified,systemic and local immune responses,prospective clinical trial,Population not matching; no comparison to standard therapy or placebo specified; outcomes not matching criteria.,False,patients with liver metastasis from colorectal carcinoma,-,-,-,-,The study population does not match the focus on hepatocellular carcinoma. It lacks a comparison group and focuses on immune responses rather than survival or response rates.,,,False
67,Nivolumab in advanced hepatocellular carcinoma: Sorafenib-experienced Asian cohort analysis.,10.1016/j.jhep.2019.05.014,"BACKGROUND & AIMS: Nivolumab, an immune checkpoint inhibitor, is approved in several countries to treat sorafenib-experienced patients with HCC, based on results from the CheckMate 040 study (NCT01658878). Marked differences exist in HCC clinical presentation, aetiology, treatment patterns and outcomes across regions. This analysis assessed the safety and efficacy of nivolumab in the Asian cohort of CheckMate 040. METHODS: CheckMate 040 is an international, multicentre, open-label, phase I/II study of nivolumab in adults with advanced HCC, regardless of aetiology, not amenable to curative resection or local treatment and with/without previous sorafenib treatment. This analysis included all sorafenib-experienced patients in the intent-to-treat (ITT) overall population and Asian cohort. The analysis cut-off date was March 2018. RESULTS: There were 182 and 85 patients in the ITT population and Asian cohort, respectively. In both populations, most patients were older than 60 years, had BCLC (Barcelona Clinic Liver Cancer) Stage C disease, and had received previous systemic therapy. A higher percentage of Asian patients had HBV infections, extrahepatic metastases and prior therapies. Median follow-up was 31.6 and 31.3 months for the ITT and Asian patients, respectively. Objective response rates were 14% and 15% in the ITT population and Asian cohort, respectively. In the Asian cohort, patients with HBV, HCV or those who were uninfected had objective response rates of 13%, 14% and 21%, respectively. The median duration of response was longer in the ITT (19.4 months) vs. Asian patients (9.7 months). Median overall survival was similar between the ITT (15.1 months) and Asian patients (14.9 months), and unaffected by aetiology in Asian patients. The nivolumab safety profile was similar and manageable across both populations. CONCLUSION: Nivolumab safety and efficacy are comparable between sorafenib-experienced ITT and Asian patients. LAY SUMMARY: The CheckMate 040 study evaluated the safety and efficacy of nivolumab in patients with advanced hepatocellular carcinoma who were refractory to previous sorafenib treatment or chemotherapy. This subanalysis of the data showed that treatment responses and safety in patients in Asia were similar to those of the overall treatment population, providing support for nivolumab as a treatment option for these patients. Clinical trial number: NCT01658878. Elsevier B.V. All rights reserved.",Yau T; Hsu C; Kim TY; Choo SP; Kang YK; Hou MM; Numata K; Yeo W; Chopra A; Ikeda M; Kuromatsu R; Moriguchi M; Chao Y; Zhao H; Anderson J; Cruz CD; Kudo M,False,sorafenib-experienced patients with HCC,nivolumab,not specified,safety and efficacy,phase I/II study,No comparison to standard therapy or placebo specified; outcomes not focused on survival or response rate.,True,-,-,-,-,-,"The study includes a relevant population, intervention, and outcomes (safety and efficacy). It provides a subanalysis of the Asian cohort with detailed response and survival data.",False,"The study is a phase I/II trial without a comparison to standard therapy or placebo, and the outcomes focus on safety and efficacy rather than survival or response rate.",False
68,A Phase 1a/1b Dose Escalation/Expansion Study of the Anti-PD-1 Monoclonal Antibody Nofazinlimab in Chinese Patients with Solid Tumors or Lymphoma.,10.1007/s11523-024-01091-8,"BACKGROUND: Immune checkpoint blockade with anti-programmed cell death 1 (PD-1) antibodies has demonstrated efficacy in multiple tumor types. Nofazinlimab is a humanized rat antibody targeting PD-1. A first-in-human study of nofazinlimab conducted in Australia found no dose-limiting toxicities (DLTs) and the maximum tolerated dose (MTD) was not reached in the range of 1-10 mg/kg. OBJECTIVE: We evaluated nofazinlimab for multiple advanced malignancies in Chinese patients. PATIENTS AND METHODS: This was a phase 1a/1b, open-label, multicenter, dose-escalation/expansion trial. In phase 1a, patients received an abbreviated dose escalation of nofazinlimab at 60 mg and 200 mg every 3 weeks (Q3W) to determine DLTs and the recommended phase 2 dose (RP2D). In phase 1b, patients received the RP2D (monotherapy/combination) in six arms by tumor type; DLTs were evaluated for nofazinlimab plus lenvatinib in the unresectable hepatocellular carcinoma (uHCC) arm. Safety (continuously monitored in patients who received nofazinlimab) and efficacy (patients with measurable baseline disease) were assessed. RESULTS: Overall, 107 patients were eligible and received nofazinlimab. In phase 1a, no DLTs were observed; the RP2D was 200mg Q3W. In phase 1b, no DLTs were observed with nofazinlimab plus lenvatinib. The safety profile was consistent with that observed in the first-in-human study (NCT03475251). In phase 1b, 21/88 (23.9%) patients achieved confirmed objective responses, 26 (29.5%) had stable disease, and 9/20 (45.0%) patients with uHCC achieved confirmed objective responses to nofazinlimab plus lenvatinib. CONCLUSIONS: Nofazinlimab was well tolerated in Chinese patients. Preliminary efficacy was encouraging, particularly for nofazinlimab plus lenvatinib in uHCC, which is being studied in an ongoing phase 3 trial. CLINICAL TRIAL REGISTRATION: NCT03809767; registered 18 January 2019.",Gong J; Guo Y; Zhang Y; Ba Y; Chen T; Li W; Zhou C; Wang M; Yang H; Zhou Y; Cai Q; Wang Z; Huang G; Zhang W; Su R; Cai Z; Yue Z; Dou J; Li P; Wu R; Tse AN; Shen L,False,patients with multiple advanced malignancies including unresectable hepatocellular carcinoma,nofazinlimab,not specified,safety and efficacy,"phase 1a/1b, open-label, multicenter, dose-escalation/expansion trial",No comparison to standard therapy or placebo specified; outcomes not focused on survival or response rate.,False,-,-,-,-,-,The study lacks a comparison group and focuses on safety and preliminary efficacy rather than survival or response rates.,,,False
69,Phase I Study of Lenalidomide and Sorafenib in Patients With Advanced Hepatocellular Carcinoma.,10.1634/theoncologist.2016-0071,"LESSONS LEARNED: Combination therapies in patients with hepatocellular carcinoma can be associated with overlapping toxicity and are therefore poorly tolerated.Using sorafenib at the maximum tolerated dose can lead to a higher incidence of toxicities. Consequently, combination studies might evaluate sorafenib at alternative schedules or doses to improve tolerance, recognizing this could affect sorafenib efficacy.Although this combination was poorly tolerated, it does not exclude further evaluation of new-generation immunomodulator drugs or immune checkpoint inhibitors in the hope of optimizing tolerance and safety. BACKGROUND: Sorafenib is the standard treatment for advanced hepatocellular carcinoma (HCC), and to date, no combination therapy has demonstrated superior survival compared with sorafenib alone. The immunosuppressive microenvironment in HCC is a negative predictor for survival. Lenalidomide is an immunomodulator and antiangiogenic agent, with limited single-agent efficacy in HCC. Based on these data, we designed a phase I study of sorafenib plus lenalidomide to determine the safety and preliminary antitumor activity of this combination. METHODS: This was an open-label, phase I study with a 3+3 dose escalation/de-escalation design. The starting dose of sorafenib was 400 mg p.o. b.i.d. and of lenalidomide was 15 mg p.o. daily with a planned dose escalation by 5 mg per cohort up to 25 mg daily. Dose de-escalation was planned to a sorafenib dose of 400 mg p.o. daily combined with two doses of lenalidomide: 10 mg p.o. daily for a 28-day cycle (cohort 1) and 10 mg p.o. daily for a 21- or 28-day cycle (cohort 2). Patients with cirrhosis, a Child-Pugh score of A-B7, and no previous systemic therapy were eligible. RESULTS: Five patients were enrolled. Their median age was 56 years (range 39-61), and the ECOG status was 0-2. Four patients were treated at dose level (DL) 1. Because of the poor tolerance to the combination associated with grade 2 toxicities, one more patient was treated at DL -1. No dose-limiting toxicity was observed as specified per protocol. The most common toxicities were nausea, anorexia, pruritus, elevated liver enzymes, and elevated bilirubin. Three patients experienced one or more of the following grade 3 toxicities: fatigue (DL 1), increased bilirubin (DL 1), skin desquamation (DL -1), and elevated transaminase levels (DL 1). The median duration of therapy was 1 cycle (range 1-3). All patients discontinued the study, 4 because of progressive disease and 1 by patient preference. The best confirmed response was progressive disease. The median progression-free survival was 1.0 month (95% confidence interval 0.9-2.8), and the median overall survival was 5.9 months (95% confidence interval 3.68-23.4). CONCLUSION: In our small study, the combination of lenalidomide and sorafenib was poorly tolerated and showed no clinical activity. Although the study was closed early because of toxicity concerns, future studies assessing combinations of sorafenib with new-generation immunomodulator drugs or other immunomodulatory agents, should consider lower starting doses of sorafenib to avoid excessive toxicity. property of the authors.",Shahda S; Loehrer PJ; Clark RS; Spittler AJ; Althouse SK; Chiorean EG,False,patients with advanced hepatocellular carcinoma,sorafenib plus lenalidomide,not specified,safety and preliminary antitumor activity,"open-label, phase I study",No comparison to standard therapy or placebo specified; outcomes not focused on survival or response rate.,False,-,-,-,-,-,The study lacks a comparison group and focuses on safety and preliminary antitumor activity rather than survival or response rates.,,,False
70,Protocol of notable-HCC: a phase Ib study of neoadjuvant tislelizumab with stereotactic body radiotherapy in patients with resectable hepatocellular carcinoma.,10.1136/bmjopen-2022-060955,"INTRODUCTION: Liver resection is the mainstay of curative-intent treatment for hepatocellular carcinoma (HCC), but the postoperative 5-year recurrence rate reaches 70%, and there are no adjuvant or neoadjuvant therapies recommended by major HCC guidelines that can reduce the risk of recurrence. In the recent decade, significant progress has been achieved in the systemic treatment of HCC, mainly from immune checkpoint inhibitors (ICIs) and targeted therapy. In other malignancies, ICIs in the neoadjuvant setting have shown better outcomes than in the adjuvant setting. On the other hand, the addition of radiation to ICIs incrementally improves the systemic response to ICIs. Neoadjuvant therapy of ICIs plus stereotactic body radiotherapy (SBRT) has shown promising results in several types of solid tumours but not HCC. METHODS AND ANALYSIS: Here, we describe a phase Ib clinical trial of neoadjuvant SBRT plus PD-1 (tislelizumab) prior to hepatic resection in HCC patients. Prior to resection, eligible HCC patients will receive 8 Gy×3 fractions of SBRT together with two cycles of tislelizumab with an interval of 3 weeks. HCC resection is scheduled 4 weeks after the second dose of tislelizumab, followed by adjuvant tislelizumab for 1 year. We plan to enrol 20 participants in this trial. The primary study endpoints include the delay of surgery, tumour response and safety and tolerability of the sequential SBRT/tislelizumab. Other endpoints are the disease-free survival and overall survival rates every 3 or 6 months after the surgery. ETHICS AND DISSEMINATION: This trial was approved by the Ethics Committee of Shandong Cancer Hospital and Institute (SDZLEC2022-021-01). The final results of this trial will be published in a peer-reviewed journal after completion. TRIAL REGISTRATION NUMBER: NCT05185531. commercial re-use. See rights and permissions. Published by BMJ.",Zhang B; Yue J; Shi X; Cui K; Li L; Zhang C; Sun P; Zhong J; Li Z; Zhao L,False,patients with hepatocellular carcinoma,neoadjuvant SBRT plus PD-1 (tislelizumab),not specified,"tumour response, safety, tolerability, disease-free survival, overall survival",phase Ib clinical trial,"No comparison group specified, not a randomized controlled trial",False,-,-,-,-,-,No comparison group specified and not a randomized controlled trial. The study is a phase Ib clinical trial focusing on safety and feasibility.,,,False
71,PRIME-HCC: phase Ib study of neoadjuvant ipilimumab and nivolumab prior to liver resection for hepatocellular carcinoma.,10.1186/s12885-021-08033-x,"BACKGROUND: After liver resection (LR), patients with hepatocellular cancer (HCC) are at high risk of recurrence. There are no approved anti-cancer therapies known to affect such risk, highlighting the acute need for novel systemic therapies to control the probability of disease relapse. Immunotherapy is expanding as a novel treatment option for HCC. Emerging data from cohort 4 of the CA209-040 study, which investigated the safety and preliminary efficacy of nivolumab/ipilimumab co-administration in advanced HCC, suggest that the combination can be delivered safely with an acceptable proportion of reversible grade 3-4 toxicities (27.1%) and a low discontinuation rate (2%) in patients with HCC. Here, we describe the design and rationale of PRIME-HCC, a two-part, multi-centre, phase Ib study to assess safety and bioactivity of the nivolumab/ipilimumab combination prior to LR in early-stage HCC. METHODS: The study involves an initial safety run-in phase (Part 1) to allow for preliminary safety characterisation within the first 6 patients enrolled and a subsequent expansion (Part 2). Ipilimumab will be administered once only on Day 1. Nivolumab will be administered on Day 1 and Day 22 (± 3 days) for a total of two 21-day cycles (i.e. 6 weeks of treatment). The primary objective of the study is to determine the safety and tolerability of the nivolumab/ipilimumab combination prior to LR. The secondary objective is to preliminarily characterize the efficacy of the combination prior to LR, including objective response rate (ORR) and pathologic response rates. Additional exploratory objectives include preliminary evidence of long-term disease control and to identify predictive correlates of response to the nivolumab/ipilimumab combination in HCC. DISCUSSION: The results of this study will help define the positioning of neoadjuvant nivolumab/ipilimumab combination in the perioperative management of HCC, with potential to improve survival outcomes in this patient population. TRIAL REGISTRATION: EudraCT Number: 2018-000987-27 Clinical trial registry & ID: ClinicalTrials.gov : NCT03682276 .",Pinato DJ; Cortellini A; Sukumaran A; Cole T; Pai M; Habib N; Spalding D; Sodergren MH; Martinez M; Dhillon T; Tait P; Thomas R; Ward C; Kocher H; Yip V; Slater S; Sharma R,False,patients with early-stage hepatocellular cancer,nivolumab/ipilimumab combination,not specified,"safety, tolerability, objective response rate, pathologic response rates",phase Ib study,"No comparison group specified, not a randomized controlled trial",False,-,-,-,-,-,No comparison group specified and not a randomized controlled trial. The study is a phase Ib trial assessing safety and bioactivity.,,,False
72,Phase I study of the antiprogrammed cell death-1 Ab spartalizumab (PDR001) in Japanese patients with advanced malignancies.,10.1111/cas.14678,"Spartalizumab is a humanized IgG4/κ mAb directed against human programmed cell death-1 (PD-1). In this phase I study, we investigated safety, pharmacokinetics, preliminary antitumor activity, and toxicity of spartalizumab in patients with advanced malignancies. Patients (n = 18) with a range of tumor types received spartalizumab i.v. at doses of 1, 3, and 10 mg/kg every 2 weeks until disease progression, unacceptable toxicity, or discontinuation at the discretion of the investigator or patient. Most patients (61%) had received five or more prior lines of therapy. No dose-limiting toxicities were reported and, hence, the maximum tolerated dose was 10 mg/kg or more. Pharmacokinetics in Japanese patients aligned with those reported in a global dose-escalation study. The safety profile was consistent with other approved anti-PD-1 mAbs; the most common drug-related adverse events were maculopapular rash (22%), followed by malaise and increased blood alkaline phosphatase (11% each). Partial responses were reported in two patients (11%), one with transitional cell carcinoma and the other with hepatocellular carcinoma. In conclusion, this study confirmed the safety of spartalizumab given at a dose of up to 10 mg/kg every 2 weeks in Japanese patients with cancers. on behalf of Japanese Cancer Association.",Minami H; Doi T; Toyoda M; Imamura Y; Kiyota N; Mitsuma A; Shimokata T; Naito Y; Matsubara N; Tajima T; Tokushige K; Ishihara K; Cameron S; Ando Y,False,patients with advanced malignancies including hepatocellular carcinoma,spartalizumab,not specified,"safety, pharmacokinetics, preliminary antitumor activity",phase I study,"No comparison group specified, not a randomized controlled trial",False,-,-,-,-,-,No comparison group specified and not a randomized controlled trial. The study is a phase I trial focusing on safety and pharmacokinetics.,,,False
