Index,Title,DOI,Abstract,Authors,A_Decision,A_Reason,A_P,A_I,A_C,A_O,A_S,B_Decision,B_Reason,B_P,B_I,B_C,B_O,B_S,C_Decision,C_Reason,Final_Decision
118,Management of hepatocellular carcinoma patients with portal vein tumor thrombosis: A narrative review,10.1016/j.hbpd.2021.12.004,"Background: Hepatocellular carcinoma (HCC) is one of the main reasons for malignancy-related death. Portal vein tumor thrombosis (PVTT) is the most common form of macrovascular invasion related to HCC occurring in 10%-60% of patients. HCC with PVTT is usually characterized by worsening liver function, vulnerability to blood metastasis, higher incidence of complications associated with portal hypertension, and intolerance to treatment when compared with that without PVTT. If only treated with supportive care, the median survival of HCC with PVTT is about 2.7 months. In the past, sorafenib was the only recommended therapy by guidelines with limited effectiveness. This narrative review aimed to describe the current management options for HCC with PVTT. Data sources: We have reviewed literature from PubMed on the treatment of HCC with PVTT and compiled evidence-based facts on effective therapies available for different types of PVTT. Results: Sorafenib monotherapy is not much effective, but combining it with other methods can improve survival. Each type of PVTT can benefit from the combination of transarterial chemoembolization and sorafenib than sorafenib monotherapy. The tumor downstaging can be realized possibly after transarterial chemoembolization, but tumor invasion into the main trunk of the portal vein greatly impairs efficacy. Although surgery is a curative approach, it is often not recommended for Vp4 PVTT. Some new methods can broaden the indication, but further explorations are needed. Radiotherapy can decrease the possibility of Vp3 progression to Vp4, but building a forecast model of best radiation dose and response is necessary. Systemic chemotherapy, hepatic arterial infusion chemotherapy, radiofrequency ablation, portal stenting, and traditional Chinese medicine are also beneficial in Vp3-4 PVTT. The accurate diagnosis of PVTT can be made by radiomics, and prognostic classification models can be used to design personalized treatments. The application of new treatment methods such as the atezolizumab plus bevacizumab scheme may increase survival. Conclusions: HCC with PVTT is still a thorny problem, and effective therapeutics need to be explored. (c) 2021 First Affiliated Hospital, Zhejiang University School of Medicine in China. Published by Elsevier B.V. All rights reserved.","Tao, ZW; Cheng, BQ; Zhou, T; Gao, YJ",False,not a randomized controlled trial and primarily a review article,patients with HCC and PVTT,not specified,"sorafenib monotherapy, TACE",survival improvement with combinations,narrative review,False,"This is a narrative review summarizing various treatments for HCC with portal vein tumor thrombosis (PVTT). It does not describe a specific randomized controlled trial, nor does it provide detailed information on interventions, comparisons, or outcomes relevant to immune checkpoint inhibitors.",patients with HCC and PVTT,"various treatments including sorafenib, TACE, and other modalities",sorafenib monotherapy and supportive care,survival improvement with combination therapies,narrative review,False,No disagreement between Model A and B,False
119,In the Era of Systemic Therapy for Hepatocellular Carcinoma Is Transarterial Chemoembolization Still a Card to Play?,10.3390/cancers13205129,"Simple Summary: Hepatocellular carcinoma (HCC) is a growing healthcare problem, with most of the cases occurring in patients with an underlying chronic liver disease. Transarterial chemoembolization (TACE) is recommended for unresectable tumors, mostly in a palliative setting. Several developments have seen the day during the last few years, with technique improvements in terms of efficacy and safety due to more selective therapies and better patient selection. Nevertheless, this is the era of systemic treatment for HCC, where immunotherapy and combination systemic treatments are taking the lead. As such, we have to ask ourselves, where does TACE stand today and is there a tomorrow? Conventional transarterial embolization (cTACE) has been proven to be effective for intermediate stage hepatocellular carcinoma (HCC), with a recent systematic review showing an overall survival (OS) of 19.4 months. Nevertheless, due to the rapid development of the systemic therapeutic landscape, the place of TACE is becoming questionable. Is there still a niche for TACE in the era of immunotherapy and combination treatments such as atezolizumab-bevacizumab, which has shown an OS of 19.2 months with excellent tolerance? The development of drug-eluting microspheres (DEMs) has led to the standardization of the technique, and along with adequate selection, it showed an OS of 48 months in a retrospective study. In order to increase treatment selectivity, new catheters have also been added to the TACE arsenal as well as the use of cone-beam CT (CBCT), which provides three-dimensional volumetric images and guidance during procedures. Moreover, the TACE indications have also widened. It may serve as a ""bridging therapy "" for liver transplantation candidates while they are on the waiting list, and it represents a valuable downstaging tool to transplantation criteria. The aim of this review is to explore the current data on the advancements of TACE and its future place amongst the growing panel of treatments.","Bucalau, AM; Tancredi, I; Verset, G",False,not a randomized controlled trial and focuses on TACE,patients with intermediate stage HCC,TACE,not specified,overall survival rates,systematic review,False,"This systematic review focuses on advancements in transarterial chemoembolization (TACE) rather than immune checkpoint inhibitors. It does not include a randomized controlled trial design or specify comparisons relevant to ICIs, thus failing to meet the PICOS criteria.",patients with intermediate-stage HCC,transarterial chemoembolization (TACE),not specified in the abstract,overall survival rates with TACE,-,False,No disagreement between Model A and B,False
120,Hepatocellular carcinoma downstaging for liver transplantation in the era of systemic combined therapy with anti-VEGF/TKI and immunotherapy,10.1002/hep.32613,"Hepatocellular carcinoma remains a global health challenge affecting close to 1 million cases yearly. Liver transplantation provides the best long-term outcomes for those meeting strict criteria. Efforts have been made to expand these criteria, whereas others have attempted downstaging approaches. Although locoregional approaches to downstaging are appealing and have demonstrated efficacy, limitations and challenges exists including poor imaging modality to assess response and appropriate endpoints along the process. Recent advances in systemic treatments including immune checkpoint inhibitors alone or in combination with tyrosine kinase inhibitors have prompted the discussion regarding their role for downstaging disease prior to transplantation. Here, we provide a review of prior locoregional approaches for downstaging, new systemic agents and their role for downstaging, and finally, key and critical considerations of the assessment, endpoints, and optimal designs in clinical trials to address this key question.","Tran, NH; Muoz, S; Thompson, S; Hallemeier, CL; Bruix, J",False,does not mention a randomized controlled trial or specific outcomes,patients with hepatocellular carcinoma,immune checkpoint inhibitors and tyrosine kinase inhibitors,not specified,not specified,not specified,False,The abstract does not describe a randomized controlled trial or provide specific outcomes such as survival or response rates. It is a review article discussing various treatments and their potential roles but lacks the required study design and outcome focus.,-,-,-,-,-,False,No disagreement between Model A and B,False
121,Cost-effectiveness of selective internal radiation therapy with Y-90 resin microspheres for intermediate- and advanced-stage hepatocellular carcinoma in Brazil,10.1080/13696998.2023.2210475,"Aims Hepatocellular carcinoma (HCC) is a severe condition with poor prognosis that places a significant burden on patients, caregivers, and healthcare systems. Selective internal radiation therapy (SIRT) is a treatment available to patients with HCC which addresses some of the limitations of alternative treatment options. A cost-effectiveness analysis was undertaken into the use of SIRT using Y-90 resin microspheres for the treatment of unresectable intermediate- and late-stage HCC in Brazil. Materials and methods A partitioned-survival model was developed, including a tunnel state for patients downstaged to receive treatments with curative intent. Sorafenib was the selected comparator, a common systemic treatment in Brazil and for which comparative evidence exists. Clinical data were extracted from published sources of pivotal trials, and effectiveness was measured in quality-adjusted life-years (QALYs) and life-years (LYs). The analysis was conducted from the Brazilian private payer perspective and a lifetime horizon was implemented. Comprehensive sensitivity analyses were conducted. Results LYs and QALYs were higher for SIRT with Y-90 resin microspheres versus sorafenib (0.27 and 0.20 incremental LYs and QALYs, respectively) and costs were slightly higher for SIRT (R$15,864). The base case incremental cost-effectiveness ratio (ICER) was R$77,602 per QALY. The ICER was mostly influenced by parameters defining the sorafenib overall survival curve and SIRT had a 73% probability of being cost-effective at a willingness-to-pay threshold of R$135,761 per QALY (3-times the per-capita gross domestic product in Brazil). Overall, sensitivity analyses confirmed the robustness of the results indicating that SIRT with Y-90 resin microspheres is cost-effective compared with sorafenib. Limitations A rapidly evolving treatment landscape in Brazil and worldwide, and the lack of local data for some variables were the main limitations. Conclusions SIRT with Y-90 resin microspheres is a cost-effective option compared with sorafenib in Brazil.","Agirrezabal, I; Grillo, LSP; Nasser, F; Brennan, VK; Bugano, D; Galastri, FL; de Azeredo-da-Silva, ALF; Shergill, S; da Motta-Leal, JM",False,not a randomized controlled trial,patients with unresectable intermediate- and late-stage HCC,selective internal radiation therapy (SIRT),sorafenib,quality-adjusted life-years and life-years,cost-effectiveness analysis,False,"The study is a cost-effectiveness analysis rather than a randomized controlled trial. While it compares SIRT with sorafenib, it focuses on economic outcomes like quality-adjusted life-years and costs rather than survival or response rates as primary endpoints.",-,-,-,-,-,False,No disagreement between Model A and B,False
122,Downstaging Hepatocellular Carcinoma before Transplantation Role of Immunotherapy Versus Locoregional Approaches,10.1016/j.soc.2023.07.001,"HCC continues to be a leading cause of cancer-related death in the United States. With advances in locoregional therapy for unresectable HCC during the last 2 decades and the recent expansion of transplant criteria for HCC, as well as ongoing organ shortages, patients are spending more time on the waitlist, which has resulted in increased usage of locoregional therapies. This changing landscape is well displayedin Fig. 1, which demonstrates the number of treatments per patient by year of listing (A) and the proportion of locoregional therapy type by year of treatment (B).91 Less than half of liver transplant candidates on the waiting list underwent locoregional therapy before listing in 2003, whereas 92.4% underwent some form of locoregional therapy in 2018.91 Although TACE is the current preferred modality for liver-directed therapy as a bridge to transplant in patients with HCC, recent evidence suggests that radioembolization may prolong time to progression when compared with chemoembolization. In just the last 5 years, the proportion of radioembolization performed for HCC has increased significantly, from less than 5% in 2013 to 19% in 2018.91 Expanding on the proven value of locoregional therapies, the plethora of molecularly targeted therapies and ICIs under investigation represent the new horizon of treatment of HCC not only in advanced stages but also potentially at every stage of diagnosis and management. Although data remain sparse in the pretransplantation population, the possibility of downstaging patients previously considered unresectable or initially outside of transplant criteria is an extremely alluring strategy, which may prove vital in establishing transplant candidacy for an expanded host of patients. Combination therapies have already begun to show promise in maintaining disease control and may ultimately prove lifesaving in patients who are able to undergo liver transplant. Although it will be critical in the coming years to determine timing of therapy and appropriate postoperative immunosuppression strategies, both locoregional techniques and immunomodulation will change the history of liver transplant for HCC as we currently know it.","Lindemann, J; Yu, J; Doyle, MBM",False,not a randomized controlled trial and lacks specific details,not specified,locoregional therapies and ICIs,not specified,not specified,not specified,False,This abstract provides a narrative review of locoregional therapies and ICIs without specifying a randomized controlled trial or detailing comparison groups and outcomes. The lack of structured data makes it unsuitable for inclusion under the PICOS framework.,-,-,-,-,-,False,No disagreement between Model A and B,False
123,Conversion therapy for unresectable intrahepatic cholangiocarcinoma using gemcitabine plus S-1 combined with PD-1 inhibitors: a case report,10.3389/fonc.2024.1476593,"Intrahepatic cholangiocarcinoma (iCCA) is a highly malignant tumor of the liver and gallbladder, which is usually diagnosed at an advanced stage and the opportunity for surgery is lost. Therefore, conversion therapy is important to convert the iCCA into a resectable state. In recent years, the conversion protocol of immuno-chemotherapy has been applied for advanced liver cancer. However, little has been reported about iCCA conversion therapy. The aim of this report is to present the results of conversion therapy with Gemcitabine plus S-1 (GS) combined with PD-1 inhibitors (Zimberelimab) in a 74-year-old female IIIB iCCA patient. After 6 cycles of conversion therapy, enhanced CT showed that the patient's tumor had shrunk to nearly half its original size, making radical resection possible. Postoperative pathology showed a complete pathological response. This provides a new way to convert advanced iCCA into resectable state.","Zhao, SY; Zhang, XD; Luo, JL; Yan, HJ; Zhang, JL; Lin, RF; Zhu, KL",False,not related to hepatocellular carcinoma and not a randomized controlled trial,a patient with intrahepatic cholangiocarcinoma,immuno-chemotherapy with PD-1 inhibitors,not specified,tumor shrinkage and resectability,case report,False,"The article focuses on intrahepatic cholangiocarcinoma (iCCA), not hepatocellular carcinoma, and presents a single case report rather than a randomized controlled trial. Both the population and study design fail to meet the inclusion criteria.",patients with intrahepatic cholangiocarcinoma,-,-,-,case report,False,No disagreement between Model A and B,False
124,"Nivolumab after selective internal radiation therapy for the treatment of hepatocellular carcinoma: a phase 2, single-arm study",10.1136/jitc-2022-005457,"Purpose To evaluate the safety and efficacy of selective internal radiation therapy (SIRT) in combination with a PD-1 inhibitor in patients with unresectable hepatocellular carcinoma (uHCC) and liver-only disease ineligible for chemoembolization.Patients and methods NASIR-HCC is a single-arm, multicenter, open-label, phase 2 trial that recruited from 2017 to 2019 patients who were naive to immunotherapy and had tumors in the BCLC B2 substage (single or multiple tumors beyond the up-to-7 rule), or unilobar tumors with segmental or lobar portal vein invasion (PVI); no extrahepatic spread; and preserved liver function. Patients received SIRT followed 3 weeks later by nivolumab (240 mg every 2 weeks) for up to 24 doses or until disease progression or unacceptable toxicity. Safety was the primary endpoint. Secondary objectives included objective response rate (ORR), time to progression (TTP), and overall survival (OS).Results 42 patients received SIRT (31 BCLC-B2, 11 with PVI) and were followed for a median of 22.2 months. 27 patients discontinued and 1 never received Nivolumab. 41 patients had any-grade adverse events (AE) and 21 had serious AEs (SAE). Treatment-related AEs and SAEs grade 3-4 occurred in 8 and 5 patients, respectively. Using RECIST 1.1 criteria, ORR reported by investigators was 41.5% (95% CI 26.3% to 57.9%). Four patients were downstaged to partial hepatectomy. Median TTP was 8.8 months (95% CI 7.0 to 10.5) and median OS was 20.9 months (95% CI 17.7 to 24.1).Conclusions The combination of SIRT and nivolumab has shown an acceptable safety profile and signs of antitumor activity in the treatment of patients with uHCC that were fit for SIRT.","de la Torre-Alez, M; Matilla, A; Varela, M; Iarrairaegui, M; Reig, M; Lled, JL; Arenas, JI; Lorente, S; Testillano, M; Mrquez, L; Da Fonseca, L; Argem, J; Gmez-Martin, C; Rodriguez-Fraile, M; Bilbao, J; Sangro, B",False,not a randomized controlled trial,patients with unresectable hepatocellular carcinoma,SIRT followed by nivolumab,not specified,"objective response rate, time to progression, overall survival",single-arm phase 2 trial,False,"Although this study evaluates SIRT combined with nivolumab in patients with unresectable HCC, it is a single-arm phase 2 trial, not a randomized controlled trial. The lack of a control group prevents it from meeting the study design criterion.",-,-,no comparison group specified,-,single-arm phase 2 trial,False,No disagreement between Model A and B,False
125,Novel implications in the treatment of hepatocellular carcinoma,10.20524/aog.2016.0092,"Worldwide hepatocellular carcinoma remains one of the leading causes of cancer-related death, associated with a poor prognosis due to late diagnosis in the majority of cases. Physicians at care are frequently confronted with patients who are ineligible for curative treatment such as liver resection, transplantation or radiofrequency ablation. Besides established palliative locoregional therapies, such as ablation or chemoembolization, new treatment options, such as microwave ablation, drug-eluting bead transarterial chemoembolization or selective internal radiation therapy, are emerging; however, data from randomized controlled trials are still lacking. In order to achieve optimal tumor control, patients should receive tailored treatment concepts, considering their tumor burden, liver function and performance status, instead of strictly assigning patients to treatment modalities following algorithms that may be partly very restrictive. Palliative locoregional pretreatment might facilitate downstaging to ensure later curative resection or transplantation. In addition, the combined utilization of different locoregional treatment options or systemic co-treatment has been the subject of several trials. In cases where local tumor control cannot be achieved, or in the scenario of extrahepatic spread, sorafenib remains the only approved systemic therapy option. Alternative targeted therapies, such as immune checkpoint inhibitors have shown encouraging preliminary results, while data from phase III studies are pending.","Best, J; Schotten, C; Theysohn, JM; Wetter, A; Mller, S; Radnz, S; Schulze, M; Canbay, A; Dechne, A; Gerken, G",False,"does not specify intervention, comparison, or outcome details",patients with hepatocellular carcinoma,not specified,not specified,not specified,not specified,False,"The abstract discusses immune checkpoint inhibitors as a potential systemic therapy but does not specify the intervention, comparison, or outcomes in detail. It is a narrative review rather than an RCT, making it unsuitable for inclusion.",-,immune checkpoint inhibitors mentioned as a potential therapy but details are lacking,no explicit comparison group provided,survival or response rate not explicitly stated as outcomes,-,False,No disagreement between Model A and B,False
126,Liver transplantation and resection in patients with hepatocellular cancer and portal vein tumor thrombosis: Feasible and effective?,10.1016/j.hbpd.2023.10.002,"Patients with locally advanced hepatocellular cancer (HCC) and portal vein tumor thrombosis (PVTT) have a dismal prognosis since limited treatment options are available for them. In recent years, effective systemic therapy, and advances in the understanding of technicalities and effectiveness of ablative therapies especially radiotherapy, have given some hope to prolong survival in them. This review summarized recent evidence in literature regarding the possible role of liver resection (LR) and liver transplantation (LT) in patients with locally advanced HCC and PVTT with no extrahepatic disease. Downstaging therapies have helped make curative resection or LT a reality in selected patients. This review emphasizes on the key points to focus on when considering surgery in these patients, who are usually relegated to palliative systemic therapy alone. Meticulous patient selection based on tumor biology, documented downstaging based on imaging and decrease in tumor marker levels, and an adequate waiting period to demonstrate stable disease, may help obtain satisfactory long-term outcomes post LR or LT in an intention to treat strategy in patients with HCC and PVTT. (c) 2023 First Affiliated Hospital, Zhejiang University School of Medicine in China. Published by Elsevier B.V. All rights reserved.","Bhangui, P",False,"does not specify intervention, comparison, or outcome details",patients with locally advanced hepatocellular cancer and portal vein tumor thrombosis,not specified,not specified,not specified,not specified,False,The abstract focuses on surgical options like liver resection and transplantation without specifying ICIs as an intervention. It lacks details on comparison groups and outcomes related to survival or response rates. The study design is not an RCT.,-,no mention of immune checkpoint inhibitors as the intervention,no explicit comparison group provided,survival or response rate not explicitly stated as outcomes,-,False,No disagreement between Model A and B,False
127,Safety and Efficacy of Drug-Eluting Bead Transarterial Chemoembolization Combined with Lenvatinib and Anti-PD-1 Antibodies for Unresectable Hepatocellular Carcinoma: A Retrospective Analysis,10.2147/JHC.S408819,"Background: Drug-eluting bead transarterial chemoembolization (DEB-TACE) has good efficacy in the treatment of unresectable hepatocellular carcinoma (uHCC), with a relatively high objective response rate (ORR) compared to conventional transarterial chemoembolization (cTACE). This study aimed to evaluate the safety and medium-term clinical efficacy of DEB-TACE combined with lenvatinib (LEN) plus PD-1 inhibitors as a triple therapy for the treatment of uHCC.Methods: Data of patients with uHCC who received triple therapy of DEB-TACE combined with LEN plus PD-1 inhibitors from January 2019 to June 2021 were analyzed retrospectively. The study endpoints were ORR, progression-free survival (PFS), and treatment-related adverse events based on the modified Response Evaluation Criteria in Solid Tumors (mRECIST).Results: Thirty-five patients were included in this study, with a median follow-up period of 15 months. The median cycle of DEB-TACE was 1, while that of all forms of TACE procedures per patient was 2. The median administration time of LEN was 7 months, and the median number of PD-1 inhibitor treatment was 4 cycles. The ORR based on mRECIST was 82.9%, disease control rate was 91.4%, and the median time to response was 7 weeks. Among these, the ORR of Barcelona Clinic Liver Cancer (BCLC) stage A reached 100%, while that of BCLC stages B and C reached 84.6% and 78.9%, respectively. The median PFS was 9 months; the mOS was not reached. Fourteen patients (40%) successfully underwent downstaging conversion and surgical resection, 32 patients (91.4%) experienced treatment-related adverse events, and no grade 5-related adverse reactions occurred.Conclusion: DEB-TACE combined with LEN and PD-1 inhibitors has a high ORR and surgical conversion rate in the treatment of uHCC tumors, and the toxicity and side effects were tolerable.","Wu, SJ; Ruan, DD; Wu, QY; Tang, Y; Zhang, JH; Cai, SL; Zhou, YF; Luo, JW; Fang, ZT",False,not a randomized controlled trial,patients with unresectable hepatocellular carcinoma,DEB-TACE combined with lenvatinib and PD-1 inhibitors,not specified,objective response rate and progression-free survival,retrospective study,False,"Although the abstract specifies DEB-TACE combined with lenvatinib and PD-1 inhibitors as the intervention and mentions outcomes like ORR and PFS, it is a retrospective study rather than an RCT. Additionally, no explicit comparison group is provided.",-,-,no explicit comparison group described despite mentioning other treatments like cTACE,-,retrospective observational study,False,No disagreement between Model A and B,False
