Index,Title,DOI,Abstract,Authors,A_Decision,A_P,A_I,A_C,A_O,A_S,A_Reasoning,B_Decision,B_P,B_I,B_C,B_O,B_S,B_Reasoning,C_Decision,C_Reasoning,Final_Decision
47,Bevacizumab and Atezolizumab for Unresectable Hepatocellular Carcinoma: Real-world Data in Taiwan-Tainan Medical Oncology Group H01 Trial.,10.21873/invivo.13099,"BACKGROUND/AIM: The combination of bevacizumab and atezolizumab (Bev-Ate) has been established as a standard first-line systemic treatment option for unresectable hepatocellular carcinoma (HCC) since 2020. This study examined the outcomes of HCC patients who received the combination in southern Taiwan. PATIENTS AND METHODS: All patients were enrolled from four hospitals in Taiwan. They received Bev-Ate therapy for unresectable HCC. RESULTS: Thirty-five patients were included; 28 (80%) had Barcelona Clinic Liver Cancer stage C disease. Hepatitis etiology was chronic hepatitis B and C in 63% and 17% of patients, respectively. Eleven (31%) patients had received prior systemic treatment for unresectable HCC. The response rate was 51%, and the disease control rate was 72% for all patients. The median progression-free survival (PFS) and overall survival (OS) was 5.2 and 22.2 months, respectively. For patients who received prior systemic treatment, the efficacy of Bev-Ate in terms of response rates was similar compared with those without prior systemic treatment. Patients who received lower doses of bevacizumab (<15 mg/kg per dose) had non-inferior PFS and OS compared with those receiving a standard dose of bevacizumab. The incidence of proteinuria of all grades (15.8%) was less common when lower doses of bevacizumab were used. CONCLUSION: Real world data from HCC patients in southern Taiwan disclosed that the efficacy outcomes of Bev-Ate treatment were generally consistent with those of clinical trials in other countries. In patients who were exposed to prior systemic treatment or who received lower doses of bevacizumab, the Bev-Ate regimen retained its clinical efficacy. Delinasios), All rights reserved.",Lee YC; Huang WT; Lee MY; Tsao CJ; Feng YH,False,patients with unresectable HCC,bevacizumab and atezolizumab,not specified,progression-free survival and overall survival,real-world data analysis,"Population and intervention match, but comparison is not specified and study design is not RCT.",False,-,-,not specified,-,real-world data analysis,"The population and intervention match, but the comparison is not specified, and the study design is a real-world data analysis, not an RCT.",,,False
48,Progression patterns and therapeutic sequencing following immune checkpoint inhibition for hepatocellular carcinoma: An international observational study.,10.1111/liv.15502,"BACKGROUND AND AIMS: Different approaches are available after the progression of disease (PD) to immune checkpoint inhibitors (ICIs) for hepatocellular carcinoma (HCC), including the continuation of ICI, treatment switching to tyrosine kinase inhibitors (TKIs) and cessation of anticancer therapy. We sought to characterise the relationship between radiological patterns of progression and survival post-ICI, also appraising treatment strategies. METHODS: We screened 604 HCC patients treated with ICIs, including only those who experienced PD by data cut-off. We evaluated post-progression survival (PPS) according to the treatment strategy at PD and verified its relationship with radiological patterns of progression: intrahepatic growth (IHG), new intrahepatic lesion (NIH), extrahepatic growth (EHG), new extrahepatic lesion (NEH) and new vascular invasion (nVI). RESULTS: Of 604 patients, 364 (60.3%) experienced PD during observation. Median PPS was 5.3 months (95% CI: 4.4-6.9; 271 events). At the data cut-off, 165 patients (45%) received no post-progression anticancer therapy; 64 patients (17.6%) continued ICI beyond PD. IHG (HR 1.64 [95% CI: 1.21-2.22]; p = .0013) and nVI (HR 2.15 [95% CI: 1.38-3.35]; p = .0007) were associated with shorter PPS. Multivariate models adjusted for progression patterns, treatment line and albumin-bilirubin grade and Eastern Cooperative Oncology Group performance status at PD confirmed receipt of ICI beyond PD with (HR 0.17, 95% CI: 0.09-0.32; p < .0001) or without subsequent TKI (HR 0.39, 95% CI: 0.26-0.58; p < .0001) as predictors of prolonged PPS versus no anticancer therapy. CONCLUSIONS: ICI-TKI sequencing is a consolidated option in advanced HCC. nVI and IHG predict a poorer prognosis. Despite lack of recommendation, the continuation of ICI beyond progression in HCC is adopted clinically: future efforts should appraise which patients benefit from this approach.",Talbot T; D'Alessio A; Pinter M; Balcar L; Scheiner B; Marron TU; Jun T; Dharmapuri S; Ang C; Saeed A; Hildebrand H; Muzaffar M; Fulgenzi CAM; Amara S; Naqash AR; Gampa A; Pillai A; Wang Y; Khan U; Lee PC; Huang YH; Bengsch B; Bettinger D; Mohamed YI; Kaseb A; Pressiani T; Personeni N; Rimassa L; Nishida N; Kudo M; Weinmann A; Galle PR; Muhammed A; Cortellini A; Vogel A; Pinato DJ,False,patients with hepatocellular carcinoma,immune checkpoint inhibitors,tyrosine kinase inhibitors,post-progression survival,retrospective analysis,"Population, intervention, and comparison match, but outcome and study design do not meet the criteria.",False,-,-,-,post-progression survival,retrospective analysis,"The population, intervention, and comparison match, but the outcome and study design do not meet the criteria for a systematic review of RCTs.",,,False
49,Impact of Immune Response on Outcomes in Hepatocellular Carcinoma: Association With Vascular Formation.,10.1002/hep.31206,"BACKGROUND AND AIMS: We investigated the prognostic value of programmed death ligand 1 (PD-L1) expression, tumor-infiltrating CD8-positive T-cell status, and their combination in hepatocellular carcinoma (HCC). Their association with PD-L1 expression and vascular formation was further explored. APPROACH AND RESULTS: Using a database of 387 patients who underwent hepatic resection for HCC, immunohistochemical staining of PD-L1, CD8, and CD34 was performed. Additionally, we undertook an enzyme-linked immunosorbent assay for soluble PD-L1. Compared with patients with HCC and PD-L1-negative expression (n = 311), patients with HCC and PD-L1-positive expression (n = 76) showed significantly worse overall survival (OS; multivariate hazard ratio, 2.502; 95% confidence interval [CI], 1.716-3.649; P < 0.0001). The presence of tumor-infiltrating CD8-positive T cells was significantly correlated with longer OS (multivariate hazard ratio, 0.383; 95% CI, 0.274-0.537; P < 0.0001). Stratification based on PD-L1 expression in cancer cells and tumor-infiltrating CD8-positive T-cell status was also significantly associated with OS (log-rank, P < 0.0001). HCC with PD-L1-positive expression was significantly correlated with positivity for vessels that encapsulated tumor clusters. Serum PD-L1 levels were significantly higher in the group of patients who had PD-L1-positive expression than in the group of patients who had PD-L1-negative expression (P = 0.0158). CONCLUSIONS: PD-L1 expression in cancer cells was associated with a poor clinical outcome and vascular formation in patients with HCC. Additionally, the combination of PD-L1 expression with tumor-infiltrating CD8-positive T-cell status enabled further classification of patients based on their clinical outcome. Thus, PD-L1 expression in cancer cells and tumor-infiltrating CD8-positive T-cell status might serve as predictive tissue biomarkers.",Itoh S; Yoshizumi T; Yugawa K; Imai D; Yoshiya S; Takeishi K; Toshima T; Harada N; Ikegami T; Soejima Y; Kohashi K; Oda Y; Mori M,False,patients with hepatocellular carcinoma,not specified,not specified,overall survival,retrospective analysis,"Population and outcome match, but intervention, comparison, and study design do not meet the criteria.",False,-,not specified,not specified,-,retrospective analysis,"The population and outcome match, but the intervention, comparison, and study design do not meet the criteria for a systematic review of RCTs.",,,False
50,Concomitant Medications Alter Clinical Outcomes in Patients with Advanced Digestive Tract Cancer Receiving PD-1 Checkpoint Inhibitors Combined with Antiangiogenetic Agents.,10.1007/s12029-024-01095-7,"PURPOSE: Our study aimed to evaluate the impact of concomitant medications on the response and survival of patients with advanced digestive tract cancer receiving an immunotherapy-antiangiogenesis combination. METHODS: We conducted a three-center observational retrospective study of patients with advanced digestive tract cancer who received programmed death-1 (PD-1) inhibitors plus antiangiogenic agents between March 2019 and July 2022 in China. The patients had one of the three types of primary tumors: hepatocellular carcinoma (HCC), colorectal cancer (CRC), and gastric cancer (GC). RESULTS: The study included 352 patients. The most frequently prescribed co-medications were nonsteroidal anti-inflammatory drugs (NSAIDs) (46.3%), proton pump inhibitors (PPIs) (38.0%), systemic antibiotics (33.8%), and corticosteroids (30.1%). Probiotics had a direct correlation with a higher objective response rate (ORR) (OR 2.4, 95% CI 1.2 to 4.7, p = 0.013). Patients who received PPIs for gastritis/gastroesophageal reflux disease (GERD) (HR 0.7, 95% CI 0.5 to 1.0, p = 0.045), anticoagulants (HR 0.5, 95% CI 0.3 to 0.9, p = 0.009), and probiotics (HR 0.7, 95% CI 0.5 to 1.0, p = 0.034) had longer progression-free survival (PFS). Patients who received PPIs for gastritis/GERD (HR 0.6, 95% CI 0.4 to 0.9; p = 0.009) had longer overall survival (OS), while patients receiving opioids (HR 1.5, 95% CI 1.1 to 2.0, p = 0.010) had a significantly higher risk of death. CONCLUSION: Patients with advanced digestive tract cancer who were administered PPIs for gastritis/GERD indication, anticoagulants, or probiotics in combination with PD-1 inhibitors and antiangiogenic agents experienced improved clinical outcomes. However, opioid administration was linked to reduced OS in patients receiving combined therapy. Media, LLC, part of Springer Nature.",Wang Y; Wu Z; Zhu X; Zheng Y; Yang Y; Tu J; Pan H; Zhong X; Han W; Yao J,False,patients with advanced digestive tract cancer including hepatocellular carcinoma,PD-1 inhibitors plus antiangiogenic agents,not specified,response rate and survival,observational retrospective study,"Population includes other cancers besides hepatocellular carcinoma, no comparison group specified, not a randomized controlled trial",False,patients with advanced digestive tract cancer including hepatocellular carcinoma colorectal cancer and gastric cancer,PD-1 inhibitors plus antiangiogenic agents,-,response rate and survival,observational retrospective study,Population includes other cancers besides hepatocellular carcinoma. No comparison group specified. Not a randomized controlled trial.,,,False
51,"Isolated Hepatic Perfusion With Melphalan for Patients With Isolated Uveal Melanoma Liver Metastases: A Multicenter, Randomized, Open-Label, Phase III Trial (the SCANDIUM Trial).",10.1200/JCO.22.01705,"PURPOSE: About half of patients with metastatic uveal melanoma present with isolated liver metastasis, in whom the median survival is 6-12 months. The few systemic treatment options available only moderately prolong survival. Isolated hepatic perfusion (IHP) with melphalan is a regional treatment option, but prospective efficacy and safety data are lacking. METHODS: In this multicenter, randomized, open-label, phase III trial, patients with previously untreated isolated liver metastases from uveal melanoma were randomly assigned to receive a one-time treatment with IHP with melphalan or best alternative care (control group). The primary end point was overall survival at 24 months. Here, we report the secondary outcomes of response according to RECIST 1.1 criteria, progression-free survival (PFS), hepatic PFS (hPFS), and safety. RESULTS: Ninety-three patients were randomly assigned, and 87 patients were assigned to either IHP (n = 43) or a control group receiving the investigator's choice of treatment (n = 44). In the control group, 49% received chemotherapy, 39% immune checkpoint inhibitors, and 9% locoregional treatment other than IHP. In an intention-to-treat analysis, the overall response rates (ORRs) were 40% versus 4.5% in the IHP and control groups, respectively (P < .0001). The median PFS was 7.4 months versus 3.3 months (P < .0001), with a hazard ratio of 0.21 (95% CI, 0.12 to 0.36), and the median hPFS was 9.1 months versus 3.3 months (P < .0001), both favoring the IHP arm. There were 11 treatment-related serious adverse events in the IHP group compared with seven in the control group. There was one treatment-related death in the IHP group. CONCLUSION: IHP treatment resulted in superior ORR, hPFS, and PFS compared with best alternative care in previously untreated patients with isolated liver metastases from primary uveal melanoma.",Olofsson Bagge R; Nelson A; Shafazand A; All-Eriksson C; Cahlin C; Elander N; Helgadottir H; Kiilgaard JF; Kinhult S; Ljuslinder I; Mattsson J; Rizell M; Sternby Eilard M; Ullenhag GJ; Nilsson JA; Ny L; Lindnér P,False,patients with isolated liver metastases from uveal melanoma,isolated hepatic perfusion with melphalan,best alternative care,"overall survival, response rate, progression-free survival","multicenter, randomized, open-label, phase III trial",Population is not hepatocellular carcinoma patients,False,patients with isolated liver metastases from uveal melanoma,isolated hepatic perfusion with melphalan,best alternative care,overall survival response rate progression-free survival,multicenter randomized open-label phase III trial,Population is not hepatocellular carcinoma patients.,,,False
52,Healthcare costs related to adverse events in hepatocellular carcinoma treatment: A retrospective observational claims study.,10.1002/cnr2.1504,"BACKGROUND: Hepatocellular carcinoma (HCC) is an aggressive form of liver cancer with increasing incidence and mortality worldwide. For metastatic disease, systemic treatment is recommended. In addition to tumor characteristics, adverse events (AEs) may influence regimen choice. AIM: To analyze healthcare burden among patients with advanced HCC, by treatment type and AEs observed. METHODS: Included were adult commercial and Medicare Advantage enrollees with ≥2 non-diagnostic claims coded for HCC (the first setting the index date); ≥1 claim for systemic treatment of advanced/metastatic HCC; and continuous enrollment for a 6-month pre-index baseline period to ≥1 month post-index (follow-up). Patients were excluded by lack of systemic treatment; incomplete demographic information; pregnancy, liver transplant, other cancers during baseline or clinical trial participation. We describe patient characteristics, common AEs, overall survival, and healthcare burden in 2017 USD up to 12 months after initiation of tyrosine kinase inhibitor (TKI) monotherapy; immune checkpoint inhibitor (ICI) monotherapy; or FOLFOX combination therapy. RESULTS: The analytic sample consisted of 322 patients (median age 65.8 years, 76% male) who had 12 months' (unless death occurred prior) available follow-up, with median follow-up of 9 months. Among these, 241 (75%) had TKI monotherapy, 23 (7%) had ICI monotherapy, and 58 had FOLFOX (18%) first-line treatment. Overall, patients had a high burden of AEs (mean 3.2), with the most prevalent being pain (75%), infection (39%), ascites (34%), and bleeding (29%). After adjusting for covariates, infection ($50 374), fever ($47 443), and diarrhea ($29 912) imposed the highest incremental annual costs versus patients without the AE. Up to 90% of costs were attributable to inpatient admissions, with 56% to 60% involving intensive care. Median 1-year survival was 32%. CONCLUSIONS: This real-world study demonstrated AE burden in alignment with previous clinical studies. Regardless of regimen used, AEs are associated with substantial healthcare costs due to inpatient care.",Lal LS; Aly A; Le LB; Peckous S; Seal B; Teitelbaum A,False,patients with advanced HCC,"systemic treatment including TKI monotherapy, ICI monotherapy, or FOLFOX combination therapy",not specified,"overall survival, healthcare burden",retrospective study,"No comparison group specified, not a randomized controlled trial",False,patients with advanced HCC,systemic treatment including TKI monotherapy ICI monotherapy or FOLFOX combination therapy,-,overall survival healthcare burden,retrospective study,No comparison group specified. Not a randomized controlled trial.,,,False
53,Combining stereotactic body radiotherapy with camrelizumab for unresectable hepatocellular carcinoma: a single-arm trial.,10.1007/s12072-022-10396-7,"PURPOSE: Stereotactic body radiotherapy (SBRT) may have significant immunomodulatory effects that enhance tumor response to immune checkpoint inhibitors. This phase 2 clinical trial was conducted to evaluate the safety and efficacy of combining palliative SBRT with camrelizumab (an anti-PD1 monoclonal antibody) in patients with unresectable hepatocellular carcinoma (uHCC). METHODS: Patients with uHCC, Child-Pugh A/B liver function, and at least one measurable lesion were enrolled between April 2020 and August 2022. Patients were administered 200 mg camrelizumab intravenously from the first day of palliative SBRT and then every 3 weeks. Palliative SBRT was delivered daily over five fractions per week, with a dose range of 30-50 Gy. The primary endpoints were objective response rate (ORR) and safety. This trial was registered at ClinicalTrials.gov (NCT04193696). RESULTS: Twenty-one patients were enrolled; the median radiation dose was 40 Gy, and the median number of cycles of camrelizumab was five. The ORR was 52.4%. After a median follow-up of 19.7 months, the median progression-free and overall survival were 5.8 and 14.2 months, respectively. The overall survival probability was 85.7% at 6 months, 76.2% at 9 months, and 59.9% at 12 months. All grade 3 treatment-related adverse events (TRAEs) occurred in five patients (23.8%) and were manageable. No grade 4/5 TRAEs were observed. CONCLUSION: Palliative SBRT plus camrelizumab showed promising antitumor activity against uHCC. Toxicities were manageable with no unexpected safety issues. This study provides evidence of a new therapeutic method for the treatment of uHCC.",Li JX; Su TS; Gong WF; Zhong JH; Yan LY; Zhang J; Li LQ; He ML; Zhang RJ; Du YQ; Wang XT; Liang SX; Xiang BD,False,patients with unresectable hepatocellular carcinoma,palliative SBRT plus camrelizumab,not specified,"objective response rate, safety",phase 2 clinical trial,"No comparison group specified, not a randomized controlled trial",False,patients with unresectable hepatocellular carcinoma,palliative SBRT plus camrelizumab,-,objective response rate safety,phase 2 clinical trial,No comparison group specified. Not a randomized controlled trial.,,,False
54,Ultrasound-Guided High-Intensity Focused Ultrasound Combined With PD-1 Blockade in Patients With Liver Metastases From Lung Cancer: Protocol for a Single-Arm Phase 2 Trial.,10.2196/59152,"BACKGROUND: While immunotherapy has revolutionized oncological management, its efficacy in lung cancer patients with liver metastases remains limited, potentially due to the unique immunosuppressive microenvironment of the liver. Local liver treatment has been shown to enhance the immunotherapy response, and high-intensity focused ultrasound (HIFU), a minimally invasive local treatment, has demonstrated promising results in combination with immunotherapy. However, clinical data regarding HIFU in lung cancer with liver metastases are limited. OBJECTIVE: We designed the HILL (Ultrasound-Guided High-Intensity Focused Ultrasound Combined With PD-1 Blockade in Patients With Liver Metastases From Lung Cancer) study to investigate the effectiveness and safety of HIFU in combination with immunotherapy for lung cancer with liver metastases. METHODS: The HILL study is a single-armed, single-center, phase 2 clinical trial that will enroll 30 patients with lung cancer and liver metastases. The treatment regimen involves administering HIFU to liver metastases 1 week before the first dose of a programmed cell death protein (PD)-1 blockade, which is then administered every 3 weeks. The primary aim is to determine the overall response rate based on immune-related response criteria. Secondary aims include safety, progression-free survival, overall response, overall survival, and quality of life. Exploratory studies will also be conducted using whole blood, plasma, archival cancer tissue, and tumor biopsies during progression or relapse to identify potential biomarkers. RESULTS: The study was funded on March 14, 2022, and received ethical approval on April 27, 2022. Clinical trial registration was completed by June 10, 2022, with participant recruitment beginning on July 10, 2022. Data collection commenced on July 14, 2022, with the enrollment of the first patient. By April 2024, 6 participants had been recruited. The results are expected to be published in December 2026. CONCLUSIONS: This study seeks to improve treatment outcomes for lung cancer patients with liver metastases by combining HIFU and PD-1 inhibition. The study also aims to identify potential biomarkers through exploratory research that can aid in selecting patients for optimized outcomes in the future. TRIAL REGISTRATION: Chinese Clinical Trial Registry ChiCTR2200061076; https://www.chictr.org.cn/showproj.html?proj=170967. INTERNATIONAL REGISTERED REPORT IDENTIFIER (IRRID): DERR1-10.2196/59152. Li Yang, Wen Zhi Chen, Ming Yan Jiang. Originally published in JMIR Research Protocols (https://www.researchprotocols.org), 29.11.2024.",Hu C; Fu Q; Gao FF; Zeng J; Xiao W; Li H; Peng L; Huang X; Yang L; Chen WZ; Jiang MY,False,patients with lung cancer and liver metastases,HIFU combined with PD-1 blockade,not specified,"overall response rate, safety, progression-free survival, overall survival","single-armed, single-center, phase 2 clinical trial","Population is not hepatocellular carcinoma patients, no comparison group specified",False,patients with lung cancer and liver metastases,HIFU combined with PD-1 blockade,-,overall response rate safety progression-free survival overall survival,single-armed single-center phase 2 clinical trial,Population is not hepatocellular carcinoma patients. No comparison group specified.,,,False
55,Prognostic clinical factors in patients affected by non-small-cell lung cancer receiving Nivolumab.,10.1080/14712598.2020.1724953,"Background: Immune-checkpoint inhibitors have radically changed the treatment landscape of Non-Small-Cell Lung Cancer (NSCLC). It is still unclear whether specific clinical characteristics might identify those patients benefiting from immunotherapy more than others. The aim of this study was to identify clinical characteristics associated with disease-specific survival (DSS), time-to-treatment failure (TTF), objective responses (OR) and progressive disease (PD) in NSCLC patients treated with Nivolumab.Methods: This was a multicenter retrospective study conducted on 294 patients treated with Nivolumab for advanced NSCLC.Results: Of the more than 50 variables analyzed, five showed a significant correlation with DSS: ECOG PS, size of the biggest brain metastasis, number of metastatic sites, toxicity, and malignant pleural effusion. Three variables significantly correlated with TTF: malignant pleural effusion, number of metastatic sites, number of liver metastases. Malignant pleural effusion was the only variable showing a significant correlation with OR, as well as the only one correlating with all the endpoints of the study.Conclusions: This study identified clinical characteristics associated with survival and response during treatment with Nivolumab in NSCLC patients. The unfavorable association between malignant pleural effusion and objective response is a novel finding with important translational implications.",Pantano F; Russano M; Berruti A; Mansueto G; Migliorino MR; Adamo V; Aprile G; Gelibter A; Ficorella C; Falcone A; Russo A; Aieta M; Maio M; Martelli O; Barni S; Napolitano A; Roca E; Quadrini S; Iacono D; Russo A; Calvetti L; Occhipinti MA; Cortellini A; Vasile E; Passiglia F; Imperatori M; Calabrò L; Di Giacomo AM; Petrelli F; Pasquini G; Franchina T; Venditti O; Intagliata S; Galvano A; Fioroni I; Vincenzi B; Tonini G; Santini D,False,NSCLC patients treated with Nivolumab,Nivolumab,not specified,"disease-specific survival, time-to-treatment failure, objective responses, progressive disease",multicenter retrospective study,"Population is not hepatocellular carcinoma patients, no comparison group specified, not a randomized controlled trial",False,NSCLC patients treated with Nivolumab,Nivolumab,-,disease-specific survival time-to-treatment failure objective responses progressive disease,multicenter retrospective study,Population is not hepatocellular carcinoma patients. No comparison group specified. Not a randomized controlled trial.,,,False
