Index,Title,DOI,Abstract,Authors,A_Decision,A_Reason,A_P,A_I,A_C,A_O,A_S,B_Decision,B_Reason,B_P,B_I,B_C,B_O,B_S,C_Decision,C_Reason,Final_Decision
79,Salvage Surgery for Initially Unresectable HCC With PVTT Converted by Locoregional Treatment Plus Tyrosine Kinase Inhibitor and Anti-PD-1 Antibody,10.1093/oncolo/oyae032,"Background This study aimed to compare the survival outcomes of patients with initially unresectable hepatocellular carcinoma (HCC) and portal vein tumor thrombus (PVTT) who underwent or did not undergo salvage surgery followed by a triple combination conversion treatment consisted of locoregional treatment (LRT), tyrosine kinase inhibitors (TKIs), and anti-PD-1 antibodies.Methods The data from 93 consecutive patients with initially unresectable HCC and PVTT across 4 medical centers were retrospectively reviewed. They were converted successfully by the triple combination treatment and underwent or did not undergo salvage resection. The baseline characteristics, conversion schemes, conversion treatment-related adverse events (CTRAEs), overall survival (OS), and progression-free survival (PFS) of the salvage surgery and non-surgery groups were compared. Multivariate Cox regression analysis was performed to identify independent risk factors for OS and PFS. Additionally, subgroup survival analysis was conducted by stratification of degree of tumor response and type of PVTT.Results Of the 93 patients, 44 underwent salvage surgery, and 49 did not undergo salvage surgery. The OS and PFS of the salvage surgery and non-surgery groups were not significantly different (P = .370 and .334, respectively). The incidence and severity of CTRAEs of the 2 groups were also comparable. Subgroup analyses revealed that for patients with complete response (CR) or types III-IV PVTT, there was a trend toward better survival in patients who did not undergo salvage surgery. Multivariate analysis showed that baseline alpha-fetoprotein and best tumor response per mRECIST criteria were independent prognostic factors for OS and PFS.Conclusions For patients with initially unresectable HCC and PVTT who were successfully converted by the triple combination therapy, salvage liver resection may not be necessary, especially for the patients with CR or types III-IV PVTT. This article compares survival outcomes of patients with initially unresectable hepatocellular carcinoma and portal vein tumor thrombus who did or did not undergo salvage surgery followed by a triple combination conversion treatment consisting of locoregional treatment, tyrosine kinase inhibitors, and anti-PD-1 antibodies.","Wang, L; Feng, JK; Lu, CD; Wu, JY; Zhou, B; Wang, K; Wei, XB; Liang, C; Zhou, HK; Shi, J; Guo, WX; Lau, WY; Yan, ML; Cheng, SQ",False,not a randomized controlled trial,patients with initially unresectable hepatocellular carcinoma and portal vein tumor thrombus,triple combination treatment including anti-PD-1 antibodies,comparison between salvage surgery and non-surgery groups,overall survival and progression-free survival,retrospective review,False,"Although the study compares salvage surgery with non-surgery groups, the design is retrospective rather than a randomized controlled trial. The intervention involves triple combination therapy including anti-PD-1 antibodies, but the comparison is limited to surgical versus non-surgical approaches rather than placebo or no ICIs. Outcomes include overall survival and progression-free survival but are analyzed retrospectively.",-,-,"The comparison is between salvage surgery and non-surgery groups, not placebo or absence of ICIs.",-,"The study design is a retrospective review, which does not meet the PICOS criterion for randomized controlled trials.",False,No disagreement between Model A and B,False
80,"Editorial: Predictive Factors and Survival Outcome of Conversion Therapy for Unresectable Hepatocellular Carcinoma Patients Receiving Atezolizumab and Bevacizumab: Comparative Analysis of Conversion, Partial Response and Complete Response Patients",10.1111/apt.18296,,"Gorgulho, J; von Felden, J",False,Abstract too short or empty,not applicable,not applicable,not applicable,not applicable,not applicable,False,Abstract too short or empty,-,-,-,-,-,False,Abstract too short or empty,False
81,Comparison of survival benefit between salvage surgery after conversion therapy versus surgery alone for hepatocellular carcinoma with portal vein tumor thrombosis: a propensity score analysis,10.1016/j.hpb.2023.03.004,"Background: Salvage surgery after conversion therapy with a combination of tyrosine kinase inhibitor and anti-programmed death-1 antibody has shown improved survival benefits in patients with hepato-cellular carcinoma (HCC) with portal vein tumor thrombosis (PVTT). We aimed to compare the survival benefits in a retrospective cohort of patients with HCC with PVTT who underwent salvage surgery after conversion therapy and surgery alone. Methods: From January 2015 to October 2021, we selected patients diagnosed with HCC with PVTT who underwent liver resection at Chinese PLA General Hospital. The primary endpoint in the comparison of survival benefits between conversion therapy and surgery-alone groups was recurrence-free survival. Propensity score matching was applied to reduce any potential bias in the study. Results: The 6-, 12-, and 24-month recurrence-free survival rates in the conversion and surgery alone groups were 80.3% vs 36.5%, 65.4% vs 29.4%, and 56% vs 21%, respectively. On multivariable Cox regression analyses, conversion therapy significantly reduced HCC-related mortality and HCC recur-rence rates compared with surgery alone. Conclusions: For patients with HCC with PVTT, surgery after conversion therapy is in relationship with increased survival in comparison with surgery alone.","Cao, YB; Tang, HW; Hu, BY; Zhang, WW; Wan, T; Han, J; Jiao, TY; Li, JF; Li, XR; Yang, ZY; Liu, Z; Hu, MG; Duan, WD; Li, CG; Zhao, ZM; Lu, SC",False,not a randomized controlled trial,patients with hepatocellular carcinoma and portal vein tumor thrombosis,conversion therapy with a tyrosine kinase inhibitor and anti-PD-1 antibody,surgery alone,recurrence-free survival rates,retrospective cohort study,False,"The study design is a retrospective cohort study, which does not meet the PICOS criterion of requiring a randomized controlled trial. Additionally, while Model A correctly identified the lack of randomization, it failed to note that the intervention involves a combination therapy (tyrosine kinase inhibitor and anti-PD-1 antibody), which is broader than just immune checkpoint inhibitors alone. The comparison group is appropriately described as 'surgery alone,' but the outcome focuses on recurrence-free survival rather than overall survival or response rate, which are more aligned with the PICOS criteria.",-,conversion therapy involving a combination of tyrosine kinase inhibitor and anti-PD-1 antibody,-,recurrence-free survival rates instead of survival rate or response rate,-,False,No disagreement between Model A and B,False
82,Recent Advances in Liver Transplantation for Hepatocellular Carcinoma,10.1007/s11864-024-01247-8,"Liver transplantation for hepatocellular carcinoma (HCC) remains an evolving field. Major challenges HCC transplant patients face today include liver organ donor shortages and the need for both better pre-transplant bridging/downstaging therapies and post-transplant HCC recurrence treatment options. The advent of immunotherapy and the demonstrated efficacy of immune checkpoint inhibitors in multiple solid tumors including advanced/unresectable HCC hold promise in expanding both the neoadjuvant and adjuvant HCC transplant treatment regimen, though caution is needed with these immune modulating agents leading up to and following transplant. New options for pre-transplant HCC management will expand access to this curative option as well as ensure patients have adequate control of their HCC prior to transplant to maximize the utility of a liver donor. Machine perfusion has been an active area of investigation in recent years and could expand the organ donor pool, helping address current liver donor shortages. Finally, additional HCC biomarkers such as AFP-L3 and DCP have shown promise in improving risk stratification of HCC patients. Together, these three recent advancements will likely alter HCC transplant guidelines in the coming years.","Li, PJ; Shah, S; Mehta, N",False,"no comparison, outcome, or study design specified",patients with hepatocellular carcinoma,immune checkpoint inhibitors,not specified,not specified,not specified,False,"This article lacks critical elements required by the PICOS framework. There is no specific comparison group, outcome measurement, or study design mentioned in the abstract. While Model A correctly flagged these issues, it failed to clarify that the population includes patients undergoing liver transplantation, which is a distinct subgroup of hepatocellular carcinoma patients. Furthermore, the intervention description should specify that immune checkpoint inhibitors are discussed in the context of neoadjuvant or adjuvant therapy rather than being studied directly.",patients with hepatocellular carcinoma undergoing liver transplantation,immune checkpoint inhibitors in the context of neoadjuvant or adjuvant therapy,not applicable as no comparison group is specified,not applicable as no specific outcome is measured,not applicable as no study design is described,False,No disagreement between Model A and B,False
83,Successful Liver Transplantation of Recurrent Fibrolamellar Carcinoma following Clinical and Pathologic Complete Response to Triple Immunochemotherapy: A Case Report,10.1159/000524872,"Introduction: Fibrolamellar carcinoma (FLC) is a rare liver cancer that predominantly affects younger patients without a history of liver disease. Surgical resection is the cornerstone of therapy and represents the best potentially curative treatment option. Modest objective responses with cytotoxic chemotherapy alone or combined with immune checkpoint inhibitors (ICIs) have been reported; however, there are no established systemic therapy regimens for unresectable or metastatic FLC. Case Presentation: We report a case of a 23-year-old woman with FLC who presented with a 11.5 x 8.3 cm left liver mass and subsequently underwent resection as initial therapy. Molecular analysis of her surgical tissue revealed a DNAJB1-PRKACA fusion gene. The patient developed biopsy-proven recurrent FLC with multiple liver lesions but without any distant metastatic disease only 3 months after initial resection. In light of emerging data, the patient was treated with a novel triple therapy regimen including 5-fluorouracil (5-FU), interferon (IFN) alfa-2b, and nivolumab. Partial radiographic response was achieved after 4 treatments and complete response was achieved after 12 cycles with the combination. The patient received 2 more doses of 5-FU/IFN alfa-2b without nivolumab and underwent orthotopic liver transplantation (OLT) 6 months after the last dose of ICI. Pathological examination of the explanted liver remarkably confirmed pathologic complete response. She remains recurrence-free and is on active surveillance. Discussion/Conclusion: For patients with unresectable/recurrent FLC with no distant disease, the combination of 5-FU, IFN alfa-2b, and nivolumab could be an effective systemic therapy option. The use of this chemoimmunotherapy regimen to downstage FLC prior to OLT may be worth investigating further. (C) 2022 S. Karger AG, Basel","Kang, S; Magliocca, J; Sellers, M; Roccaro, G; Zheng, W; Pectasides, M; Draper, A; Guadagno, J; El-Rayes, B; Akce, M",False,not a randomized controlled trial and does not meet population criteria,a 23-year-old woman with fibrolamellar carcinoma,"5-FU, IFN alfa-2b, and nivolumab",not specified,partial and complete response,case report,False,"The article is a case report, which does not meet the PICOS requirement for a randomized controlled trial. Model A correctly identified this limitation but overlooked that the population specifically involves a patient with fibrolamellar carcinoma, which is a distinct entity from hepatocellular carcinoma. The intervention combines chemotherapy, interferon, and an immune checkpoint inhibitor, which is broader than just ICIs. The comparison group is absent, and the outcomes focus on radiographic and pathological responses, which differ from the survival or response rates specified in the PICOS criteria.","a patient with fibrolamellar carcinoma, which is distinct from hepatocellular carcinoma","a triple therapy regimen including 5-FU, IFN alfa-2b, and nivolumab",not applicable as no comparison group is specified,radiographic and pathological responses rather than survival or response rates,-,False,No disagreement between Model A and B,False
84,"Editorial: Predictive Factors and Survival Outcome of Conversion Therapy for Unresectable Hepatocellular Carcinoma Patients Receiving Atezolizumab and Bevacizumab: Comparative Analysis of Conversion, Partial Response and Complete Response Patients. Authors' Reply",10.1111/apt.18319,,"Hatanaka, T; Kakizaki, S; Hiraoka, A; Tada, T; Kumada, T",False,Abstract too short or empty,not applicable,not applicable,not applicable,not applicable,not applicable,False,Abstract too short or empty,-,-,-,-,-,False,Abstract too short or empty,False
85,"Perioperative safety, oncologic outcome, and risk factors of salvage liver resection for initially unresectable hepatocellular carcinoma converted by transarterial chemoembolization plus tyrosine kinase inhibitor and anti-PD-1 antibody: a retrospective multicenter study of 83 patients",10.1007/s12072-023-10561-6,"BackgroundTo assess the perioperative safety, oncological outcomes, and determinants influencing the oncological outcomes of salvage liver resection for initially unresectable hepatocellular carcinoma (HCC) rendered resectable through transarterial chemoembolization (TACE) combined with tyrosine kinase inhibitors (TKIs) and anti-PD-1 antibodies (& alpha;-PD-1).MethodsWe retrospectively reviewed data from 83 consecutive patients across six tertiary hospitals who underwent salvage liver resection for initially unresectable HCC following conversion by TACE combined with TKIs and & alpha;-PD-1, emphasizing perioperative and oncological outcomes. Multivariate Cox regression analysis was employed to discern independent risk factors for postoperative recurrence-free survival (RFS).ResultsThe median operative duration was 200 min, with a median blood loss of 400 ml. Intraoperative blood transfusions were necessitated for 27 patients. The overall perioperative complication rate was 48.2%, with a major complication rate of 16.9%. One patient died during the perioperative period due to postoperative liver failure. During the median follow-up period of 15.1 months, 24 patients experienced recurrence, with early and intrahepatic recurrence being the most common. Seven patients died during follow-up. Median RFS was 25.4 months, with 1- and 2-year RFS rates of 68.2% and 61.8%, respectively. Median overall survival was not reached, with 1- and 2-year overall survival rates of 92.2% and 87.3%, respectively. Multivariate Cox regression analysis revealed that pathological complete response (pCR) and intraoperative blood transfusion served as independent prognostic determinants for postoperative RFS.ConclusionsOur study provides preliminary evidence suggesting that salvage liver resection may be an effective and feasible treatment option for patients with unresectable HCC who achieve resectability after conversion therapy with TACE, TKIs, and & alpha;-PD-1. The perioperative safety of salvage liver resection for these patients was manageable and acceptable. However, further research, particularly prospective comparative studies, is needed to better evaluate the potential benefits of salvage liver resection in this patient population.","Lin, KY; Lin, ZW; Chen, QJ; Luo, LP; Zhang, JX; Chen, JH; Wang, K; Tai, S; Zhang, ZB; Wang, SF; Zhang, JY; You, WY; Wang, B; You, PH; Lin, KC; Yang, T; Zeng, YY",False,does not meet randomized controlled trial design requirement,patients with unresectable hepatocellular carcinoma (HCC),"salvage liver resection after conversion therapy with TACE, TKIs, and anti-PD-1",not specified,recurrence-free survival and overall survival rates,retrospective study,False,"The study design is retrospective, not a randomized controlled trial as required by the PICOS criteria. Additionally, the comparison group is not specified in the abstract, which further disqualifies it from inclusion.",-,-,not specified (agrees with A_C),-,-,False,No disagreement between Model A and B,False
86,Achieving complete remission in metastatic hepatocellular carcinoma with sintilimab plus sorafenib therapy followed by hepatic resection: a case report,10.3389/fonc.2024.1355798,"Background The synergistic effectiveness of combining immune checkpoint inhibitors with targeted therapies has shown promise in improving the conversion rate for unresectable hepatocellular carcinoma (HCC) patients to a potentially resectable status. However, the efficacy of this approach in the context of HCC with extrahepatic metastasis remains to be conclusively determined.Case presentation We report a rare case of advanced HCC with extrahepatic metastasis who achieved long-term survival by a combination of systemic therapy (sintilimab and sorafenib) followed by laparoscopic hepatectomy. A 63-year-old man presented at our hospital with discomfort on the right side of his waist. An enlarged right hepatic lobe mass was subsequently revealed by CT scan. The patient's medical history, including a prior infection with hepatitis B virus, cirrhosis of the liver and an alpha-fetoprotein (AFP) level measuring 41.28 ng/ml substantiated the clinical diagnosis of HCC. On October 30th, 2019, the patient received 200 mg sintilimab intravenously (q3w) plus 200-400 mg BID sorafenib orally, along with antiviral therapy. After six cycles, his disease achieved partial response (PR). On April 26th, 2021, He underwent a laparoscopic hepatectomy. The patient achieved a sustained period of no evidence of disease for 2.5 years and with drug-free survival for 2 years after the resection. His current overall survival is estimated at approximately 4 years.Conclusions This case highlights the potential of combining sintilimab and sorafenib in transforming HCC with extrahepatic metastasis into a condition amenable to surgical resection, suggesting that this treatment approach, followed by surgery, may lead to complete remission.","Cui, K; Li, ZC; Zhong, JT; Shi, XT; Zhao, L; Li, H; Ma, Y",False,not a clinical trial and lacks comparison group,advanced hepatocellular carcinoma (HCC) with extrahepatic metastasis,combination of sintilimab and sorafenib,not specified,long-term survival,case report,False,"This is a case report, which does not meet the randomized controlled trial requirement. Furthermore, there is no comparison group, making it unsuitable for inclusion under the PICOS framework.",-,-,not specified (agrees with A_C),-,-,False,No disagreement between Model A and B,False
87,Neoadjuvant programmed cell death 1 inhibitor before liver transplantation for HCC is not associated with increased graft loss,10.1097/LVT.0000000000000083,"Immune checkpoint inhibitors (ICIs) may lead to rejection and even graft loss of solid organ transplant recipients, making them not widely used in transplant patients. There is insufficient clinical experience in using ICIs as a bridging or downstaging therapy before transplantation. We performed a retrospective review of patients receiving programmed cell death 1 inhibitor (PD1) before liver transplantation for HCC in our center and analyzed the data of these patients with the purpose of investigating the safety and feasibility of preoperative PD1 inhibitor among liver transplant recipients and exploring the preoperative correlation ICIs and the postoperative risk of rejection and immune-related graft loss. A total of 16 patients enrolled in this study. Acute rejection occurred in 9 patients, with an incidence of 56.3%. The median time of rejection was 7 days after surgery. The median FK506 concentration at the time of rejection was 7.1 mu g/L. All rejection reactions were reversed after adjusting the immunosuppression regimen. The interval between the last PD1 inhibitor and transplantation in the rejection group was shorter than that in the nonrejection group, and there was a statistical difference [21.0 (15.5-27.5) days vs. 60.0 (34.0-167.0) days, p=0.01]. In conclusion, PD1 inhibitor is a safe and feasible method for bridging or downstaging treatment before liver transplantation. Although preoperative PD1 inhibitor may increase the incidence of postoperative rejection, it is not associated with increased immune-related graft loss and patient death.","Wang, TL; Chen, ZT; Liu, Y; Jia, Y; Ju, WQ; Chen, MG; Zhao, Q; Wang, DP; Guo, ZY; Tang, YH; He, XS",False,not a randomized controlled trial and lacks survival rate outcomes,patients receiving PD1 inhibitors before liver transplantation for HCC,PD1 inhibitor as bridging therapy,not specified,safety and feasibility of treatment,retrospective review,False,"The study is a retrospective review and lacks a comparison group, failing to meet the randomized controlled trial requirement. Additionally, survival rate outcomes are not explicitly reported, which is a key criterion for inclusion.",-,-,not specified (agrees with A_C),safety and feasibility of treatment without explicit survival rate data,-,False,No disagreement between Model A and B,False
88,Outcomes of Salvage Surgery for Initially Unresectable Hepatocellular Carcinoma Converted by Transcatheter Arterial Chemoembolization Combined with Lenvatinib Plus Anti-PD-1 Antibodies: A Multicenter Retrospective Study,10.1159/000528356,"Introduction. The actual rate of conversion surgery and its prognostic advantages remain unclear. This study aimed to assess the outcomes of salvage surgery after conversion therapy with triple therapy (transcatheter arterial chemoembolization (TACE) combined with lenvatinib plus anti-PD-1 antibodies) in patients with initially unresectable hepatocellular carcinoma (uHCC).Methods. Patients with initially uHCC who received at least one cycle of first-line triple therapy and salvage surgery at five major cancer centers in China were included. The primary endpoints were overall survival (OS) and recurrence-free survival (RFS) rates after salvage surgery. The secondary endpoints were perioperative complications, 90-day mortality, and pathological tumor response.Results. Between June 2018 and December 2021, 70 patients diagnosed with uHCC who underwent triple therapy and salvage surgery were analyzed: 39 with Barcelona Clinic Liver Cancer (BCLC) stage C, 22 with BCLC stage B, and 9 with BCLC stage A disease. The median interval between the start of triple therapy and salvage surgery was 4.3 months (range, 1.7-14.2 months). Pathological complete response and major pathological response were observed in 29 (41.4%) and 59 (84.3%) patients, respectively. There were two cases of perioperative mortality (4.3%) and five cases of severe perioperative complications (7.1%). With a median follow-up of 12.9 months after surgery (range, 0.3-36.8 months), the median OS and RFS were not reached. The 1- and 2-year OS rates were 97.1% and 94.4%, respectively, and the corresponding RFS rates were 68.9% and 54.4%, respectively.Conclusion. First-line combination of TACE, lenvatinib, and anti-PD-1 antibodies provides a better chance of conversion therapy in patients with initially uHCC. Furthermore, salvage surgery after conversion therapy is effective and safe and has the potential to provide excellent long-term survival benefits.","Wu, JY; Zhang, ZB; Zhou, JY; Ke, JP; Bai, YN; Chen, YF; Wu, JY; Zhou, SQ; Wang, SJ; Zeng, ZX; Li, YN; Qiu, FN; Li, B; Yan, ML",False,does not specify study design as randomized controlled trial,patients with initially unresectable hepatocellular carcinoma (uHCC),"triple therapy with TACE, lenvatinib, and anti-PD-1 antibodies",not specified,overall survival and recurrence-free survival rates,not specified,False,"Although the abstract provides detailed outcomes and intervention descriptions, the study design is not explicitly stated as a randomized controlled trial. The lack of a specified comparison group also disqualifies it from inclusion under the PICOS criteria.",-,-,not specified (agrees with A_C),-,retrospective or observational study implied by lack of randomization details,False,No disagreement between Model A and B,False
89,Predictive factors for transition to conversion therapy in HCC using atezolizumab plus bevacizumab,10.1111/liv.15944,,"Chen, B; Huang, BJ",False,Abstract too short or empty,not applicable,not applicable,not applicable,not applicable,not applicable,False,Abstract too short or empty,-,-,-,-,-,False,Abstract too short or empty,False
