Index,Title,DOI,Abstract,Authors,A_Decision,A_P,A_I,A_C,A_O,A_S,A_Reasoning,B_Decision,B_P,B_I,B_C,B_O,B_S,B_Reasoning,C_Decision,C_Reasoning,Final_Decision
0,Four-year overall survival update from the phase III HIMALAYA study of tremelimumab plus durvalumab in unresectable hepatocellular carcinoma.,10.1016/j.annonc.2024.02.005,"BACKGROUND: In the phase III HIMALAYA study (NCT03298451) in unresectable hepatocellular carcinoma (uHCC), STRIDE (Single Tremelimumab Regular Interval Durvalumab) significantly improved overall survival (OS) versus sorafenib; durvalumab monotherapy was noninferior to sorafenib for OS. Results reported herein are from a 4-year updated OS analysis of HIMALAYA. PATIENTS AND METHODS: Participants with uHCC and no previous systemic treatment were randomized to STRIDE (n = 393), durvalumab (n = 389), or sorafenib (n = 389). The updated data cut-off was 23 January 2023. OS and serious adverse events (AEs) were assessed. Additionally, baseline characteristics and subsequent therapies were analyzed in long-term survivors (≥36 months beyond randomization). RESULTS: For STRIDE, durvalumab, and sorafenib, median [95% confidence interval (CI)] follow-up was 49.12 months (46.95-50.17 months), 48.46 months (46.82-49.81 months), and 47.31 months (45.08-49.15 months), respectively. OS hazard ratio (95% CI) for STRIDE versus sorafenib was 0.78 (0.67-0.92). The 36-month OS rate for STRIDE was 30.7% versus 19.8% for sorafenib. The 48-month OS rate remained higher for STRIDE at 25.2%, versus 15.1% for sorafenib. The long-term OS benefit of STRIDE was observed across clinically relevant subgroups and was further improved in participants who achieved disease control. Long-term survivors with STRIDE (n = 103) included participants across clinically relevant subgroups, and 57.3% (59/103) had no reported subsequent anticancer therapy. No new serious treatment-related AEs occurred with STRIDE from the primary analysis (17.5%; 68/388). Durvalumab maintained OS noninferiority to sorafenib and no late-onset safety signals were identified. CONCLUSIONS: These data represent the longest follow-up to date in phase III studies in uHCC. The unprecedented 3- and 4-year OS rates reinforce the sustained long-term OS benefit of STRIDE versus sorafenib. STRIDE maintained a tolerable yet differentiated safety profile from other current uHCC therapies. Results continue to support the long-term benefits of STRIDE in a diverse population, reflective of uHCC globally.",Sangro B; Chan SL; Kelley RK; Lau G; Kudo M; Sukeepaisarnjaroen W; Yarchoan M; De Toni EN; Furuse J; Kang YK; Galle PR; Rimassa L; Heurgué A; Tam VC; Van Dao T; Thungappa SC; Breder V; Ostapenko Y; Reig M; Makowsky M; Paskow MJ; Gupta C; Kurland JF; Negro A; Abou-Alfa GK,True,patients with unresectable hepatocellular carcinoma,STRIDE (Single Tremelimumab Regular Interval Durvalumab),sorafenib,overall survival,randomized controlled trial,"Matches all PICOS criteria: population with hepatocellular carcinoma, immunotherapy intervention, comparison with standard therapy, outcome of survival, and randomized controlled trial design.",True,-,-,-,-,-,"The analysis is accurate. The study meets all PICOS criteria with a clear population, intervention, comparison, outcome, and randomized controlled trial design.",,,True
1,"Camrelizumab plus rivoceranib versus sorafenib as first-line therapy for unresectable hepatocellular carcinoma (CARES-310): a randomised, open-label, international phase 3 study.",10.1016/S0140-6736(23)00961-3,"BACKGROUND: Immunotherapy with immune checkpoint inhibitors combined with an anti-angiogenic tyrosine-kinase inhibitor (TKI) has been shown to improve overall survival versus anti-angiogenic therapy alone in advanced solid tumours, but not in hepatocellular carcinoma. Therefore, a clinical study was conducted to compare the efficacy and safety of the anti-PD-1 antibody camrelizumab plus the VEGFR2-targeted TKI rivoceranib (also known as apatinib) versus sorafenib as first-line treatment for unresectable hepatocellular carcinoma. METHODS: This randomised, open-label, international phase 3 trial (CARES-310) was done at 95 study sites across 13 countries and regions worldwide. Patients with unresectable or metastatic hepatocellular carcinoma who had not previously received any systemic treatment were randomly assigned (1:1) to receive either camrelizumab 200 mg intravenously every 2 weeks plus rivoceranib 250 mg orally once daily or sorafenib 400 mg orally twice daily. Randomisation was done via a centralised interactive response system. The primary endpoints were progression-free survival, as assessed by the blinded independent review committee per Response Evaluation Criteria in Solid Tumours version 1.1, and overall survival in the intention-to-treat population. Safety was assessed in all patients who received at least one dose of the study drugs. We report the findings from the prespecified primary analysis for progression-free survival and interim analysis for overall survival. This study is registered with ClinicalTrials.gov (NCT03764293). FINDINGS: Between June 28, 2019, and March 24, 2021, 543 patients were randomly assigned to the camrelizumab-rivoceranib (n=272) or sorafenib (n=271) group. At the primary analysis for progression-free survival (May 10, 2021), median follow-up was 7·8 months (IQR 4·1-10·6). Median progression-free survival was significantly improved with camrelizumab-rivoceranib versus sorafenib (5·6 months [95% CI 5·5-6·3] vs 3·7 months [2·8-3·7]; hazard ratio [HR] 0·52 [95% CI 0·41-0·65]; one-sided p<0·0001). At the interim analysis for overall survival (Feb 8, 2022), median follow-up was 14·5 months (IQR 9·1-18·7). Median overall survival was significantly extended with camrelizumab-rivoceranib versus sorafenib (22·1 months [95% CI 19·1-27·2] vs 15·2 months [13·0-18·5]; HR 0·62 [95% CI 0·49-0·80]; one-sided p<0·0001). The most common grade 3 or 4 treatment-related adverse events were hypertension (102 [38%] of 272 patients in the camrelizumab-rivoceranib group vs 40 [15%] of 269 patients in the sorafenib group), palmar-plantar erythrodysaesthesia syndrome (33 [12%] vs 41 [15%]), increased aspartate aminotransferase (45 [17%] vs 14 [5%]), and increased alanine aminotransferase (35 [13%] vs eight [3%]). Treatment-related serious adverse events were reported in 66 (24%) patients in the camrelizumab-rivoceranib group and 16 (6%) in the sorafenib group. Treatment-related death occurred in two patients: one patient in the camrelizumab-rivoceranib group (ie, multiple organ dysfunction syndrome) and one patient in the sorafenib group (ie, respiratory failure and circulatory collapse). INTERPRETATION: Camrelizumab plus rivoceranib showed a statistically significant and clinically meaningful benefit in progression-free survival and overall survival compared with sorafenib for patients with unresectable hepatocellular carcinoma, presenting as a new and effective first-line treatment option for this population. FUNDING: Jiangsu Hengrui Pharmaceuticals and Elevar Therapeutics.",Qin S; Chan SL; Gu S; Bai Y; Ren Z; Lin X; Chen Z; Jia W; Jin Y; Guo Y; Hu X; Meng Z; Liang J; Cheng Y; Xiong J; Ren H; Yang F; Li W; Chen Y; Zeng Y; Sultanbaev A; Pazgan-Simon M; Pisetska M; Melisi D; Ponomarenko D; Osypchuk Y; Sinielnikov I; Yang TS; Liang X; Chen C; Wang L; Cheng AL; Kaseb A; Vogel A,True,patients with unresectable or metastatic hepatocellular carcinoma,camrelizumab plus rivoceranib,sorafenib,progression-free survival and overall survival,randomized controlled trial,"Matches all PICOS criteria: population with hepatocellular carcinoma, targeted therapy and immunotherapy intervention, comparison with standard therapy, outcome of survival, and randomized controlled trial design.",True,-,-,-,-,-,"The analysis is accurate. The study meets all PICOS criteria with a clear population, intervention, comparison, outcome, and randomized controlled trial design.",,,True
2,"Nivolumab in patients with advanced hepatocellular carcinoma (CheckMate 040): an open-label, non-comparative, phase 1/2 dose escalation and expansion trial.",10.1016/S0140-6736(17)31046-2,"BACKGROUND: For patients with advanced hepatocellular carcinoma, sorafenib is the only approved drug worldwide, and outcomes remain poor. We aimed to assess the safety and efficacy of nivolumab, a programmed cell death protein-1 (PD-1) immune checkpoint inhibitor, in patients with advanced hepatocellular carcinoma with or without chronic viral hepatitis. METHODS: We did a phase 1/2, open-label, non-comparative, dose escalation and expansion trial (CheckMate 040) of nivolumab in adults (≥18 years) with histologically confirmed advanced hepatocellular carcinoma with or without hepatitis C or B (HCV or HBV) infection. Previous sorafenib treatment was allowed. A dose-escalation phase was conducted at seven hospitals or academic centres in four countries or territories (USA, Spain, Hong Kong, and Singapore) and a dose-expansion phase was conducted at an additional 39 sites in 11 countries (Canada, UK, Germany, Italy, Japan, South Korea, Taiwan). At screening, eligible patients had Child-Pugh scores of 7 or less (Child-Pugh A or B7) for the dose-escalation phase and 6 or less (Child-Pugh A) for the dose-expansion phase, and an Eastern Cooperative Oncology Group performance status of 1 or less. Patients with HBV infection had to be receiving effective antiviral therapy (viral load <100 IU/mL); antiviral therapy was not required for patients with HCV infection. We excluded patients previously treated with an agent targeting T-cell costimulation or checkpoint pathways. Patients received intravenous nivolumab 0·1-10 mg/kg every 2 weeks in the dose-escalation phase (3+3 design). Nivolumab 3 mg/kg was given every 2 weeks in the dose-expansion phase to patients in four cohorts: sorafenib untreated or intolerant without viral hepatitis, sorafenib progressor without viral hepatitis, HCV infected, and HBV infected. Primary endpoints were safety and tolerability for the escalation phase and objective response rate (Response Evaluation Criteria In Solid Tumors version 1.1) for the expansion phase. This study is registered with ClinicalTrials.gov, number NCT01658878. FINDINGS: Between Nov 26, 2012, and Aug 8, 2016, 262 eligible patients were treated (48 patients in the dose-escalation phase and 214 in the dose-expansion phase). 202 (77%) of 262 patients have completed treatment and follow-up is ongoing. During dose escalation, nivolumab showed a manageable safety profile, including acceptable tolerability. In this phase, 46 (96%) of 48 patients discontinued treatment, 42 (88%) due to disease progression. Incidence of treatment-related adverse events did not seem to be associated with dose and no maximum tolerated dose was reached. 12 (25%) of 48 patients had grade 3/4 treatment-related adverse events. Three (6%) patients had treatment-related serious adverse events (pemphigoid, adrenal insufficiency, liver disorder). 30 (63%) of 48 patients in the dose-escalation phase died (not determined to be related to nivolumab therapy). Nivolumab 3 mg/kg was chosen for dose expansion. The objective response rate was 20% (95% CI 15-26) in patients treated with nivolumab 3 mg/kg in the dose-expansion phase and 15% (95% CI 6-28) in the dose-escalation phase. INTERPRETATION: Nivolumab had a manageable safety profile and no new signals were observed in patients with advanced hepatocellular carcinoma. Durable objective responses show the potential of nivolumab for treatment of advanced hepatocellular carcinoma. FUNDING: Bristol-Myers Squibb.",El-Khoueiry AB; Sangro B; Yau T; Crocenzi TS; Kudo M; Hsu C; Kim TY; Choo SP; Trojan J; Welling TH Rd; Meyer T; Kang YK; Yeo W; Chopra A; Anderson J; Dela Cruz C; Lang L; Neely J; Tang H; Dastani HB; Melero I,False,patients with advanced hepatocellular carcinoma,nivolumab,not specified,safety and objective response rate,phase 1/2 trial,Does not match all PICOS criteria: lacks a specified comparison group and the study design is not a randomized controlled trial.,False,-,-,-,-,-,"The analysis is correct. The study lacks a specified comparison group and is not a randomized controlled trial, which disqualifies it from meeting the PICOS criteria.",,,False
3,"Safety and antitumour activity of cadonilimab, an anti-PD-1/CTLA-4 bispecific antibody, for patients with advanced solid tumours (COMPASSION-03): a multicentre, open-label, phase 1b/2 trial.",10.1016/S1470-2045(23)00411-4,"BACKGROUND: Immune checkpoint inhibitors targeting PD-1 or CTLA-4 individually have shown substantial clinical benefits in the treatment of malignancies. We aimed to assess the safety and antitumour activity of cadonilimab monotherapy, a bispecific PD-1/CTLA-4 antibody, in patients with advanced solid tumours. METHODS: This multicentre, open-label, phase 1b/2 trial was conducted across 30 hospitals in China. Patients aged 18 years or older with histologically or cytologically confirmed, unresectable advanced solid tumours, unsuccessful completion of at least one previous systemic therapy, and an Eastern Cooperative Oncology Group performance status of 0 or 1 were eligible for inclusion. Patients who had previously received anti-PD-1, anti-PD-L1, or anti-CTLA-4 treatment were not eligible for inclusion. In the dose escalation phase of phase 1b, patients received intravenous cadonilimab at 6 mg/kg and 10 mg/kg every 2 weeks. In the dose expansion phase of phase 1b, cadonilimab at 6 mg/kg and a fixed dose of 450 mg were given intravenously every 2 weeks. In phase 2, cadonilimab at 6 mg/kg was administered intravenously every 2 weeks in three cohorts: patients with cervical cancer, oesophageal squamous cell carcinoma, and hepatocellular carcinoma. The primary endpoints were the safety of cadonilimab in phase 1b and objective response rate in phase 2, based on the Response Evaluation Criteria in Solid Tumors (RECIST), version 1.1. The safety analysis was done in all patients who received at least one dose of cadonilimab. Antitumour activity was assessed in the full analysis set for the cervical cancer cohort, and in all patients with measurable disease at baseline and who received at least one dose of cadonilimab in the oesophageal squamous cell carcinoma and hepatocellular carcinoma cohorts. The study is registered on ClinicalTrial.gov, NCT03852251, and closed to new participants; follow-up has been completed. FINDINGS: Between Jan 18, 2019, and Jan 8, 2021, 240 patients (83 [43 male and 40 female] in phase 1b and 157 in phase 2) were enrolled. Phase 2 enrolled 111 female patients with cervical cancer, 22 patients with oesophageal squamous cell carcinoma (15 male and seven female), and 24 patients with hepatocellular carcinoma (17 male and seven female). During dose escalation, no dose-limiting toxicities occurred. Grade 3-4 treatment-related adverse events occurred in 67 (28%) of 240 patients; the most frequent grade 3 or worse treatment-related adverse events were anaemia (seven [3%]), increased lipase (four [2%]), decreased bodyweight (three [1%]), decreased appetite (four [2%]), decreased neutrophil count (three [1%]), and infusion-related reaction (two [1%]). 17 (7%) patients discontinued treatment due to treatment-related adverse events. 54 (23%) of 240 patients reported serious treatment-related adverse events, including five patients who died (one due to myocardial infarction; cause unknown for four). In phase 2, in the cervical cancer cohort, with a median follow-up of 14·6 months (IQR 13·1-17·5), the objective response rate was 32·3% (32 of 99; 95% CI 23·3-42·5). In the oesophageal squamous cell carcinoma cohort, with a median follow-up of 17·9 months (IQR 4·0-15·1), the objective response rate was 18·2% (four of 22; 95% CI 5·2-40·3). In the hepatocellular carcinoma cohort, with a median follow-up of 19·6 months (IQR 8·7-19·8), the objective response rate was 16·7% (four of 24; 95% CI 4·7-37·4). INTERPRETATION: Cadonilimab showed an encouraging tumour response rate, with a manageable safety profile, suggesting the potential of cadonilimab for the treatment of advanced solid tumours. FUNDING: Akeso Biopharma. TRANSLATION: For the Chinese translation of the abstract see Supplementary Materials section.",Gao X; Xu N; Li Z; Shen L; Ji K; Zheng Z; Liu D; Lou H; Bai L; Liu T; Li Y; Li Y; Fan Q; Feng M; Zhong H; Huang Y; Lou G; Wang J; Lin X; Chen Y; An R; Li C; Zhou Q; Huang X; Guo Z; Wang S; Li G; Fei J; Zhu L; Zhu H; Li X; Li F; Liao S; Min Q; Tang L; Shan F; Gong J; Gao Y; Zhou J; Lu Z; Li X; Li J; Ren H; Liu X; Yang H; Li W; Song W; Wang ZM; Li B; Xia M; Wu X; Ji J,False,patients with advanced solid tumours,cadonilimab,not specified,objective response rate,phase 1b/2 trial,"Does not match all PICOS criteria: population not exclusively hepatocellular carcinoma, lacks a specified comparison group, and the study design is not a randomized controlled trial.",False,-,-,-,-,-,"The analysis is correct. The study population is not exclusively hepatocellular carcinoma, lacks a specified comparison group, and is not a randomized controlled trial.",,,False
4,Immune signatures of checkpoint inhibitor-induced autoimmunity-A focus on neurotoxicity.,10.1093/neuonc/noad198,"BACKGROUND: Neurologic immune-related adverse events (irAE-n) are rare but severe toxicities of immune checkpoint inhibitor (ICI) treatment. To overcome diagnostic and therapeutic challenges, a better mechanistic understanding of irAE-n is paramount. METHODS: In this observational cohort study, we collected serum and peripheral blood samples from 34 consecutive cancer patients with irAE-n (during acute illness) and 49 cancer control patients without irAE-n (pre- and on-ICI treatment, n = 44 without high-grade irAEs, n = 5 with high-grade nonneurologic irAEs). Patients received either anti-programmed cell death protein (PD)-1 or anti-PD ligand-1 monotherapy or anti-PD-1/anti-cytotoxic T-lymphocyte-associated protein-4 combination therapy. Most common cancers were melanoma, lung cancer, and hepatocellular carcinoma. Peripheral blood immune profiling was performed using 48-marker single-cell mass cytometry and a multiplex cytokine assay. RESULTS: During acute illness, patients with irAE-n presented higher frequencies of cluster of differentiation (CD)8+ effector memory type (EM-)1 and central memory (CM) T cells compared to controls without irAEs. Multiorgan immunotoxicities (neurologic + nonneurologic) were associated with higher CD8+ EM1 T cell counts. While there were no B cell changes in the overall cohort, we detected a marked decrease of IgD- CD11c+ CD21low and IgD- CD24+ CD21high B cells in a subgroup of patients with autoantibody-positive irAE-n. We further identified signatures indicative of enhanced chemotaxis and inflammation in irAE-n patients and discovered C-X-C motif chemokine ligand (CXCL)10 as a promising marker to diagnose high-grade immunotoxicities such as irAE-n. CONCLUSIONS: We demonstrate profound and partly subgroup-specific immune cell dysregulation in irAE-n patients, which may guide future biomarker development and targeted treatment approaches. Society for Neuro-Oncology. All rights reserved. For permissions, please e-mail: journals.permissions@oup.com.",Müller-Jensen L; Schulz AR; Mei HE; Mohr R; Ulrich C; Knape P; Frost N; Frischbutter S; Kunkel D; Schinke C; Ginesta Roque L; Maierhof SK; Nickel FT; Heinzerling L; Endres M; Boehmerle W; Huehnchen P; Knauss S,False,cancer patients with neurologic immune-related adverse events,immune checkpoint inhibitor treatment,not specified,immune cell dysregulation,observational cohort study,"Does not match all PICOS criteria: population not exclusively hepatocellular carcinoma, lacks a specified comparison group, outcome not survival or response rate, and the study design is not a randomized controlled trial.",False,-,-,-,-,-,"The analysis is correct. The study population is not exclusively hepatocellular carcinoma, lacks a specified comparison group, and the outcome is not survival or response rate.",,,False
5,Regorafenib plus nivolumab in unresectable hepatocellular carcinoma: the phase 2 RENOBATE trial.,10.1038/s41591-024-02824-y,"Regorafenib has anti-tumor activity in patients with unresectable hepatocellular carcinoma (uHCC) with potential immunomodulatory effects, suggesting that its combination with immune checkpoint inhibitor may have clinically meaningful benefits in patients with uHCC. The multicenter, single-arm, phase 2 RENOBATE trial tested regorafenib-nivolumab as front-line treatment for uHCC. Forty-two patients received nivolumab 480 mg every 4 weeks and regorafenib 80 mg daily (3-weeks-on/1-week-off schedule). The primary endpoint was the investigator-assessed objective response rate (ORR) per Response Evaluation Criteria in Solid Tumors (RECIST) version 1.1. The secondary endpoints included safety, progression-free survival (PFS) and overall survival (OS). ORR per RECIST version 1.1 was 31.0%, meeting the primary endpoint. The most common adverse events were palmar-plantar erythrodysesthesia syndrome (38.1%), alopecia (26.2%) and skin rash (23.8%). Median PFS was 7.38 months. The 1-year OS rate was 80.5%, and the median OS was not reached. Exploratory single-cell RNA sequencing analyses of peripheral blood mononuclear cells showed that long-term responders exhibited T cell receptor repertoire diversification, enrichment of genes representing immunotherapy responsiveness in MKI67(+) proliferating CD8(+) T cells and a higher probability of M1-directed monocyte polarization. Our data support further clinical development of the regorafenib-nivolumab combination as front-line treatment for uHCC and provide preliminary insights on immune biomarkers of response. ClinicalTrials.gov identifier: NCT04310709 .",Kim HD; Jung S; Lim HY; Ryoo BY; Ryu MH; Chuah S; Chon HJ; Kang B; Hong JY; Lee HC; Moon DB; Kim KH; Kim TW; Tai D; Chew V; Lee JS; Finn RS; Koh JY; Yoo C,False,patients with unresectable hepatocellular carcinoma,regorafenib-nivolumab,not specified,"objective response rate, progression-free survival, and overall survival",single-arm phase 2 trial,Does not match all PICOS criteria: lacks a specified comparison group and the study design is not a randomized controlled trial.,False,-,-,-,-,-,The analysis is correct. The study lacks a specified comparison group and is not a randomized controlled trial.,,,False
6,Single-cell immune signature for detecting early-stage HCC and early assessing anti-PD-1 immunotherapy efficacy.,10.1136/jitc-2021-003133,"BACKGROUND: The early diagnosis of hepatocellular carcinoma (HCC) can greatly improve patients' 5-year survival rate, and the early efficacy assessment is important for oncologists to harness the anti-programmed cell death protein 1 (PD-1) immunotherapy in patients with advanced HCC. The lack of effective predicting biomarkers not only leads to delayed detection of the disease but also results in ineffective immunotherapy and limited clinical survival benefit. METHODS: We exploited the single-cell approach (cytometry by time of flight (CyTOF)) to analyze peripheral blood mononuclear cells from multicohorts of human samples. Immune signatures for different stages of patients with HCC were systematically profiled and statistically compared. Furthermore, the dynamic changes of peripheral immune compositions for both first-line and second-line patients with HCC after anti-PD-1 monotherapy were also evaluated and systematically compared. RESULTS: We identified stage-specific immune signatures for HCC and constructed a logistic AdaBoost-SVM classifier based on these signatures. The classifier provided superior performance in predicting early-stage HCC over the commonly used serum alpha-fetoprotein level. We also revealed the treatment stage-specific immune signatures from peripheral blood and their dynamical changing patterns, all of which were integrated to achieve early discrimination of patients with non-durable benefit for both first-line and second-line anti-PD-1 monotherapies. CONCLUSIONS: Our newly identified single-cell peripheral immune signatures provide promising non-invasive biomarkers for early detection of HCC and early assessment for anti-PD-1 immunotherapy efficacy in patients with advanced HCC. These new findings can potentially facilitate early diagnosis and novel immunotherapy for patients with HCC in future practice and further guide the utility of CyTOF in clinical translation of cancer research. TRIAL REGISTRATION NUMBERS: NCT02576509 and NCT02989922. commercial re-use. See rights and permissions. Published by BMJ.",Shi J; Liu J; Tu X; Li B; Tong Z; Wang T; Zheng Y; Shi H; Zeng X; Chen W; Yin W; Fang W,False,patients with hepatocellular carcinoma,anti-PD-1 immunotherapy,not specified,early detection and efficacy assessment,not specified,"Does not match all PICOS criteria: lacks a specified comparison group, outcome not survival or response rate, and the study design is not specified as a randomized controlled trial.",False,-,-,-,-,-,"The analysis is correct. The study lacks a specified comparison group, the outcome is not survival or response rate, and the study design is not specified as a randomized controlled trial.",,,False
