Index,Title,DOI,Abstract,Authors,A_Decision,A_Reason,A_P,A_I,A_C,A_O,A_S,B_Decision,B_Reason,B_P,B_I,B_C,B_O,B_S,C_Decision,C_Reason,Final_Decision
71,Reassessment of palliative surgery in conversion therapy of previously unresectable hepatocellular carcinoma: Two case reports and review of literature,10.4240/wjgs.v16.i10.3312,"BACKGROUND Most patients with hepatocellular carcinoma (HCC) have lost the opportunity for direct surgery at the time of diagnosis. Transarterial chemoembolization (TACE) combined with immune checkpoint inhibitors or tyrosine kinase inhibitors (TKI) can partially transform some unresectable HCC and improve the prognosis effectively. However, based on the promising prospects of combined targeted and immunotherapy for the effective treatment of HCC, the positive role of palliative surgery in the conversion treatment of advanced HCC urgently needs further intensive re-assessment. CASE SUMMARY In this study, we describe two successful cases of ""conversion therapy for unresectable HCC"" achieved mainly by palliative surgery combined with TACE plus immunotherapy and TKIs. A 48-year-old patient with newly diagnosed HCC, presenting with a 6-cm mass in the segment VII/VIII of the right liver with multiple intrahepatic metastases, could not undergo one-stage radical surgical resection. He underwent palliative surgery with radiofrequency of metastatic lesions and the palliative resection of the primary mass, and received subsequent TACE treatments twice in the early postoperative period (2 weeks and 6 weeks), in addition to targeted and immune combination therapy with sintilimab injection and oral lenvatinib. No evidence of recurrence was observed during the 11-month follow-up period after surgery. The other patient was a 47-year-old patient with massive HCC (18 cm x 15 cm x 4.5 cm) in the left liver with severe cirrhosis. The left portal branch was occluded and a tumor thrombus formed, and the tumor partly involved the middle hepatic vein. The patient underwent palliative surgery of left hemihepatectomy (including resection of the middle hepatic vein) for HCC, followed by three TACE procedures and oral TKIs 2 weeks after surgery. Six months later, the re-examination via computed tomography revealed no tumour activity in the remaining right liver, while magnetic resonance imaging revealed slight local tumor enhancement in the caudate lobe of the liver considered, TACE was performed once again, and during the next follow-up of 10 months did not reveal new intrahepatic lesions or distant metastases. CONCLUSION These cases demonstrate that the addition of palliative surgery to conversion therapy in a selected population with a high tumor burden could benefit patients with initially unresectable HCC.","Zhu, YB; Qin, JY; Zhang, TT; Zhang, WJ; Ling, Q",False,not a randomized controlled trial,patients with unresectable hepatocellular carcinoma,palliative surgery with TACE plus immune checkpoint inhibitors,not specified,improved prognosis,case report,,,,,,,,,,
72,Downstaging of Hepatocellular Carcinoma Before Liver Transplantation: Current Advances in Selection Criteria and Therapeutic Options,10.1016/j.transproceed.2024.05.041,"Liver transplantation (LT) is an ideal therapeutic option for selected patients with hepatocellular carcinoma (HCC). The selection criteria of HCC for LT have evolved in recent decades. Down- staging therapy is a promising strategy for patients with tumor burden beyond transplant criteria to increase the chance of receiving LT and improve posttransplant survival. Downstaging therapy is also a selection tool that refines fi nes the conventional selection criteria based on tumor morphology. Recently, the success of systemic treatment, including immune checkpoint inhibitors, antiangiogenic tyrosine kinase inhibitors, and VEGF inhibitors, in advanced HCC has prompted the discussion regarding the role of systemic therapies for HCC downstaging before transplantation. In this review, we aimed to summarize the current advances in selection criteria and therapeutic options of downstaging therapy for HCC before LT.","Pang, L; Xu, LB; Wu, WR",False,not a randomized controlled trial,patients with hepatocellular carcinoma,systemic therapies including immune checkpoint inhibitors,not specified,not specified,review article,,,,,,,,,,
73,Resection of unresectable hepatocellular carcinoma after conversion therapy with apatinib and camrelizumab: a case report and literature review,10.3389/fonc.2024.1280805,"Hepatocellular carcinoma is a rather common malignant tumor. Most patients with hepatocellular carcinoma receive their diagnosis at an advanced stage, at which surgical resection is no longer appropriate. A growing body of research has demonstrated the value of convention therapy for patients with intermediate-stage hepatocellular carcinoma, while specific application protocols and treatment guidelines are not well developed. Emerging clinical researches suggest that a tyrosine kinase inhibitor in combination with an immune checkpoint inhibitor is a reasonable strategy for unresectable hepatocellular carcinoma. However, there are relatively few reports on the efficacy of apatinib and camrelizumab in the treatment of hepatocellular carcinoma. We were able to successfully remove one patient's hepatocellular carcinoma after 8 cycles of conversion therapy with apatinib (250 mg orally every day) and camrelizumab (200 mg intravenously every 2 weeks). The patient continued to receive the same dose of 16 cycles of apatinib and camrelizumab after hepatectomy. By the time of this study, the patient has completed 18 months of follow-up, and no tumor recurrence or metastasis was found in tumor markers and imaging examinations. Apatinib in combination with camrelizumab is an effective therapy for the treatment of advanced hepatocellular carcinoma, and surgical resection after this conversion therapy may provide patients with long-term oncological benefits. However, this requires more samples to validate the conclusion.","Liu, XL; Li, XZ; Chu, YF; Liu, F; Tian, H",False,not a randomized controlled trial,patients with advanced hepatocellular carcinoma,apatinib and camrelizumab combination therapy,not specified,no tumor recurrence or metastasis,case report,,,,,,,,,,
74,Current Therapeutic Strategies for Hepatocellular Carcinoma in Japan,10.1159/000534304,,"Kudo, M",False,Abstract too short or empty,not applicable,not applicable,not applicable,not applicable,not applicable,False,Abstract too short or empty,-,-,-,-,-,False,Abstract too short or empty,False
75,Neoadjuvant and adjuvant treatment approaches for hepatocellular carcinoma: future outlook,10.21037/cco-20-248,"Hepatocellular carcinoma (HCC) is a highly aggressive and chemotherapy resistant cancer with unique biologic characteristics which makes this disease highly different than other gastrointestinal cancers. The mainstay of curative treatment in HCC is surgical resection, ablation, and transplantation. However, rates of recurrence are high and many patients are not initially candidates for these curative approaches. This paper discusses predictors of recurrence of HCC in patients who have undergone surgical resection and addresses adjuvant therapies aimed at decreasing recurrence risk and improving overall survival (OS) outcomes, including traditional cytotoxic chemotherapies, tyrosine kinase inhibitors (TKIs), and immunotherapy. This article also discusses neoadjuvant strategies aimed at improving recurrence rate and OS as well as downstaging advanced HCC to enable surgical disease, including locoregional therapies, systemic chemotherapy, TKIs, and immune checkpoint inhibitors. Finally, this article addresses potential future directions for both adjuvant and neoadjuvant therapies that may change the treatment paradigm of HCC in the near future.","Sahin, IH; Khalil, L; Millett, R; Kaseb, A",False,does not specify a comparison group or study design,patients with hepatocellular carcinoma,immune checkpoint inhibitors and other therapies,not specified,improving overall survival outcomes,not specified,,,,,,,,,,
76,Neoadjuvant and adjuvant systemic treatment for hepatocellular carcinoma,10.20517/2394-5079.2021.84,"Hepatocellular carcinoma (HCC) is a highly lethal malignancy, and few patients are candidates for curative-intended therapies. The mainstay of curative treatment in HCC is surgical resection, ablation, and transplantation. However, rates of recurrence are high, and there is no established approach to reduce the risk of recurrence and mortality. We discuss the available data and current landscape of (neo)adjuvant therapies aimed at decreasing recurrence risk and improving overall survival, including liver-directed therapies, tyrosine kinase inhibitors, and immunotherapy. Neoadjuvant strategies aimed at downstaging advanced HCC to enable local treatment and minimize the risk of recurrence using novel agents are also a topic of interest in current research. The improvements achieved in the advanced stages with immune-checkpoint inhibitors are priming ongoing trials that address potential future directions for both adjuvant and neoadjuvant strategies that may change the treatment paradigm of HCC in the near future.","Mathias-Machado, MC; da Fonseca, LG",False,does not specify a comparison group or study design,patients with hepatocellular carcinoma,immunotherapy and other therapies,not specified,improving overall survival,not specified,,,,,,,,,,
77,Effect of transcatheter arterial chemoembolization combined with lenvatinib plus anti-PD-1 antibodies in patients with unresectable hepatocellular carcinoma: A treatment with Chinese characteristics,10.5582/bst.2023.01326,"Therapies for patients with unresectable hepatocellular carcinoma (uHCC) are currently popular. Current first -line standard-of-care treatments for uHCC are systematic therapies. However, treatments that combine locoregional therapy with systemic therapy are widely accepted in China and have demonstrated high rates of tumor response and conversion to resection with manageable toxicity. A literature review was performed by searching published literature in PubMed and Web of Science up to December 2023 for relevant articles on the use of triple therapy (transarterial chemoembolization combined with lenvatinib and anti-PD-1 antibodies) in uHCC. This review concentrates on the efficacy and safety of triple therapy with Chinese characteristics in patients with uHCC and describes the outcome of conversion surgery, degree of pathological necrosis, and effect prediction. This article will contribute to a comprehensive understanding of the role of triple therapy with Chinese characteristics in patients with uHCC.","Wu, JY; Wu, JY; Li, SQ; Luo, MC; Zeng, ZX; Li, YA; Fu, YK; Li, H; Liu, DY; Ou, XY; Lin, ZT; Wei, SM; Yan, ML",False,not a randomized controlled trial; lacks comparison and outcome specifics,patients with unresectable hepatocellular carcinoma,triple therapy with anti-PD-1 antibodies,not specified,tumor response and conversion to resection,literature review,,,,,,,,,,
78,Expanding Indications for Liver Transplantation in the Treatment of Hepatocellular Carcinoma,10.3390/curroncol31080355,"Improvements in downstaging therapies have expanded the indications for liver transplantation (LT) for hepatocellular carcinoma (HCC). Patients with more advanced disease are now considered candidates due to advancements in radiation therapy, combination therapies, and immunotherapy. Combination stereotactic body radiation therapy (SBRT) and trans-arterial chemoembolization (TACE) has been shown to be superior to the historic treatment, sorafenib, in patients with macrovascular invasion. These patients are now candidates for LT with stable disease after LRT. Patients with ruptured HCC and prolonged stability have also been shown to have acceptable outcomes. The role of neoadjuvant immunotherapy needs to be further defined and has the potential to further improve tumor control prior to transplant.","Hogen, R; Barry, T; Subramanian, V",False,does not specify a comparison group or study design,patients with hepatocellular carcinoma,neoadjuvant immunotherapy and combination therapies,not specified,tumor control prior to transplant,not specified,,,,,,,,,,
79,Salvage Surgery for Initially Unresectable HCC With PVTT Converted by Locoregional Treatment Plus Tyrosine Kinase Inhibitor and Anti-PD-1 Antibody,10.1093/oncolo/oyae032,"Background This study aimed to compare the survival outcomes of patients with initially unresectable hepatocellular carcinoma (HCC) and portal vein tumor thrombus (PVTT) who underwent or did not undergo salvage surgery followed by a triple combination conversion treatment consisted of locoregional treatment (LRT), tyrosine kinase inhibitors (TKIs), and anti-PD-1 antibodies.Methods The data from 93 consecutive patients with initially unresectable HCC and PVTT across 4 medical centers were retrospectively reviewed. They were converted successfully by the triple combination treatment and underwent or did not undergo salvage resection. The baseline characteristics, conversion schemes, conversion treatment-related adverse events (CTRAEs), overall survival (OS), and progression-free survival (PFS) of the salvage surgery and non-surgery groups were compared. Multivariate Cox regression analysis was performed to identify independent risk factors for OS and PFS. Additionally, subgroup survival analysis was conducted by stratification of degree of tumor response and type of PVTT.Results Of the 93 patients, 44 underwent salvage surgery, and 49 did not undergo salvage surgery. The OS and PFS of the salvage surgery and non-surgery groups were not significantly different (P = .370 and .334, respectively). The incidence and severity of CTRAEs of the 2 groups were also comparable. Subgroup analyses revealed that for patients with complete response (CR) or types III-IV PVTT, there was a trend toward better survival in patients who did not undergo salvage surgery. Multivariate analysis showed that baseline alpha-fetoprotein and best tumor response per mRECIST criteria were independent prognostic factors for OS and PFS.Conclusions For patients with initially unresectable HCC and PVTT who were successfully converted by the triple combination therapy, salvage liver resection may not be necessary, especially for the patients with CR or types III-IV PVTT. This article compares survival outcomes of patients with initially unresectable hepatocellular carcinoma and portal vein tumor thrombus who did or did not undergo salvage surgery followed by a triple combination conversion treatment consisting of locoregional treatment, tyrosine kinase inhibitors, and anti-PD-1 antibodies.","Wang, L; Feng, JK; Lu, CD; Wu, JY; Zhou, B; Wang, K; Wei, XB; Liang, C; Zhou, HK; Shi, J; Guo, WX; Lau, WY; Yan, ML; Cheng, SQ",False,not a randomized controlled trial; lacks proper study design,patients with initially unresectable hepatocellular carcinoma and portal vein tumor thrombus,triple combination treatment including anti-PD-1 antibodies,salvage surgery vs. no salvage surgery,overall survival and progression-free survival,retrospective review,,,,,,,,,,
80,"Editorial: Predictive Factors and Survival Outcome of Conversion Therapy for Unresectable Hepatocellular Carcinoma Patients Receiving Atezolizumab and Bevacizumab: Comparative Analysis of Conversion, Partial Response and Complete Response Patients",10.1111/apt.18296,,"Gorgulho, J; von Felden, J",False,Abstract too short or empty,not applicable,not applicable,not applicable,not applicable,not applicable,False,Abstract too short or empty,-,-,-,-,-,False,Abstract too short or empty,False
81,Comparison of survival benefit between salvage surgery after conversion therapy versus surgery alone for hepatocellular carcinoma with portal vein tumor thrombosis: a propensity score analysis,10.1016/j.hpb.2023.03.004,"Background: Salvage surgery after conversion therapy with a combination of tyrosine kinase inhibitor and anti-programmed death-1 antibody has shown improved survival benefits in patients with hepato-cellular carcinoma (HCC) with portal vein tumor thrombosis (PVTT). We aimed to compare the survival benefits in a retrospective cohort of patients with HCC with PVTT who underwent salvage surgery after conversion therapy and surgery alone. Methods: From January 2015 to October 2021, we selected patients diagnosed with HCC with PVTT who underwent liver resection at Chinese PLA General Hospital. The primary endpoint in the comparison of survival benefits between conversion therapy and surgery-alone groups was recurrence-free survival. Propensity score matching was applied to reduce any potential bias in the study. Results: The 6-, 12-, and 24-month recurrence-free survival rates in the conversion and surgery alone groups were 80.3% vs 36.5%, 65.4% vs 29.4%, and 56% vs 21%, respectively. On multivariable Cox regression analyses, conversion therapy significantly reduced HCC-related mortality and HCC recur-rence rates compared with surgery alone. Conclusions: For patients with HCC with PVTT, surgery after conversion therapy is in relationship with increased survival in comparison with surgery alone.","Cao, YB; Tang, HW; Hu, BY; Zhang, WW; Wan, T; Han, J; Jiao, TY; Li, JF; Li, XR; Yang, ZY; Liu, Z; Hu, MG; Duan, WD; Li, CG; Zhao, ZM; Lu, SC",False,does not meet study design criterion; not a randomized controlled trial,patients with hepatocellular carcinoma and portal vein tumor thrombosis,conversion therapy with tyrosine kinase inhibitor and anti-PD-1 antibody,surgery alone,recurrence-free survival rates,retrospective cohort study,,,,,,,,,,
82,Recent Advances in Liver Transplantation for Hepatocellular Carcinoma,10.1007/s11864-024-01247-8,"Liver transplantation for hepatocellular carcinoma (HCC) remains an evolving field. Major challenges HCC transplant patients face today include liver organ donor shortages and the need for both better pre-transplant bridging/downstaging therapies and post-transplant HCC recurrence treatment options. The advent of immunotherapy and the demonstrated efficacy of immune checkpoint inhibitors in multiple solid tumors including advanced/unresectable HCC hold promise in expanding both the neoadjuvant and adjuvant HCC transplant treatment regimen, though caution is needed with these immune modulating agents leading up to and following transplant. New options for pre-transplant HCC management will expand access to this curative option as well as ensure patients have adequate control of their HCC prior to transplant to maximize the utility of a liver donor. Machine perfusion has been an active area of investigation in recent years and could expand the organ donor pool, helping address current liver donor shortages. Finally, additional HCC biomarkers such as AFP-L3 and DCP have shown promise in improving risk stratification of HCC patients. Together, these three recent advancements will likely alter HCC transplant guidelines in the coming years.","Li, PJ; Shah, S; Mehta, N",False,lacks comparison and outcome details; not a randomized controlled trial,patients with hepatocellular carcinoma,immune checkpoint inhibitors,not specified,not specified,not specified,,,,,,,,,,
83,Successful Liver Transplantation of Recurrent Fibrolamellar Carcinoma following Clinical and Pathologic Complete Response to Triple Immunochemotherapy: A Case Report,10.1159/000524872,"Introduction: Fibrolamellar carcinoma (FLC) is a rare liver cancer that predominantly affects younger patients without a history of liver disease. Surgical resection is the cornerstone of therapy and represents the best potentially curative treatment option. Modest objective responses with cytotoxic chemotherapy alone or combined with immune checkpoint inhibitors (ICIs) have been reported; however, there are no established systemic therapy regimens for unresectable or metastatic FLC. Case Presentation: We report a case of a 23-year-old woman with FLC who presented with a 11.5 x 8.3 cm left liver mass and subsequently underwent resection as initial therapy. Molecular analysis of her surgical tissue revealed a DNAJB1-PRKACA fusion gene. The patient developed biopsy-proven recurrent FLC with multiple liver lesions but without any distant metastatic disease only 3 months after initial resection. In light of emerging data, the patient was treated with a novel triple therapy regimen including 5-fluorouracil (5-FU), interferon (IFN) alfa-2b, and nivolumab. Partial radiographic response was achieved after 4 treatments and complete response was achieved after 12 cycles with the combination. The patient received 2 more doses of 5-FU/IFN alfa-2b without nivolumab and underwent orthotopic liver transplantation (OLT) 6 months after the last dose of ICI. Pathological examination of the explanted liver remarkably confirmed pathologic complete response. She remains recurrence-free and is on active surveillance. Discussion/Conclusion: For patients with unresectable/recurrent FLC with no distant disease, the combination of 5-FU, IFN alfa-2b, and nivolumab could be an effective systemic therapy option. The use of this chemoimmunotherapy regimen to downstage FLC prior to OLT may be worth investigating further. (C) 2022 S. Karger AG, Basel","Kang, S; Magliocca, J; Sellers, M; Roccaro, G; Zheng, W; Pectasides, M; Draper, A; Guadagno, J; El-Rayes, B; Akce, M",False,not a randomized controlled trial; population not specifically HCC,23-year-old woman with fibrolamellar carcinoma,"combination of 5-FU, IFN alfa-2b, and nivolumab",not specified,partial and complete response rates,case report,,,,,,,,,,
84,"Editorial: Predictive Factors and Survival Outcome of Conversion Therapy for Unresectable Hepatocellular Carcinoma Patients Receiving Atezolizumab and Bevacizumab: Comparative Analysis of Conversion, Partial Response and Complete Response Patients. Authors' Reply",10.1111/apt.18319,,"Hatanaka, T; Kakizaki, S; Hiraoka, A; Tada, T; Kumada, T",False,Abstract too short or empty,not applicable,not applicable,not applicable,not applicable,not applicable,False,Abstract too short or empty,-,-,-,-,-,False,Abstract too short or empty,False
85,"Perioperative safety, oncologic outcome, and risk factors of salvage liver resection for initially unresectable hepatocellular carcinoma converted by transarterial chemoembolization plus tyrosine kinase inhibitor and anti-PD-1 antibody: a retrospective multicenter study of 83 patients",10.1007/s12072-023-10561-6,"BackgroundTo assess the perioperative safety, oncological outcomes, and determinants influencing the oncological outcomes of salvage liver resection for initially unresectable hepatocellular carcinoma (HCC) rendered resectable through transarterial chemoembolization (TACE) combined with tyrosine kinase inhibitors (TKIs) and anti-PD-1 antibodies (& alpha;-PD-1).MethodsWe retrospectively reviewed data from 83 consecutive patients across six tertiary hospitals who underwent salvage liver resection for initially unresectable HCC following conversion by TACE combined with TKIs and & alpha;-PD-1, emphasizing perioperative and oncological outcomes. Multivariate Cox regression analysis was employed to discern independent risk factors for postoperative recurrence-free survival (RFS).ResultsThe median operative duration was 200 min, with a median blood loss of 400 ml. Intraoperative blood transfusions were necessitated for 27 patients. The overall perioperative complication rate was 48.2%, with a major complication rate of 16.9%. One patient died during the perioperative period due to postoperative liver failure. During the median follow-up period of 15.1 months, 24 patients experienced recurrence, with early and intrahepatic recurrence being the most common. Seven patients died during follow-up. Median RFS was 25.4 months, with 1- and 2-year RFS rates of 68.2% and 61.8%, respectively. Median overall survival was not reached, with 1- and 2-year overall survival rates of 92.2% and 87.3%, respectively. Multivariate Cox regression analysis revealed that pathological complete response (pCR) and intraoperative blood transfusion served as independent prognostic determinants for postoperative RFS.ConclusionsOur study provides preliminary evidence suggesting that salvage liver resection may be an effective and feasible treatment option for patients with unresectable HCC who achieve resectability after conversion therapy with TACE, TKIs, and & alpha;-PD-1. The perioperative safety of salvage liver resection for these patients was manageable and acceptable. However, further research, particularly prospective comparative studies, is needed to better evaluate the potential benefits of salvage liver resection in this patient population.","Lin, KY; Lin, ZW; Chen, QJ; Luo, LP; Zhang, JX; Chen, JH; Wang, K; Tai, S; Zhang, ZB; Wang, SF; Zhang, JY; You, WY; Wang, B; You, PH; Lin, KC; Yang, T; Zeng, YY",False,does not include a comparison group or randomized controlled trial design,patients with unresectable hepatocellular carcinoma,"salvage liver resection after TACE, TKIs, and anti-PD-1",not specified,recurrence-free survival and overall survival rates,retrospective review,,,,,,,,,,
