Index,Title,DOI,Abstract,Authors,A_Decision,A_P,A_I,A_C,A_O,A_S,A_Reasoning,B_Decision,B_P,B_I,B_C,B_O,B_S,B_Reasoning,C_Decision,C_Reasoning,Final_Decision
22,The phosphatidylserine targeting antibody bavituximab plus pembrolizumab in unresectable hepatocellular carcinoma: a phase 2 trial.,10.1038/s41467-024-46542-y,"Immune checkpoint inhibitors targeting PD-1/L1 have modest efficacy in hepatocellular carcinoma as single agents. Targeting membranous phosphatidylserine may induce pro-inflammatory and -immune stimulating effects that enhance immunotherapy activity. This hypothesis was tested in a single-arm phase 2 trial evaluating frontline bavituximab, a phosphatidylserine targeting antibody, plus pembrolizumab (anti-PD-1) in patients with unresectable hepatocellular carcinoma (NCT03519997). The primary endpoint was investigator-assessed objective response rate among evaluable patients, and secondary end points included progression-free survival, incidence of adverse events, overall survival, and duration of response. Among 28 evaluable patients, the confirmed response rate was 32.1%, which met the pre-specified endpoint, and the median progression-free survival was 6.3 months (95% CI, 1.3-11.3 months). Treatment related-adverse events of any grade occurred in 45.7% of patients, with grade 3 or greater adverse events in 14.3% of patients. Adverse events of any cause were observed in 33 patients (94.3%), with grade 3 or greater adverse events in 11 patients (31.4%). Prespecified exploratory analyses of baseline tumor specimens showed that a depletion of B cells, and the presence of fibrotic tissue and expression of immune checkpoints in stroma was associated with tumor response. These results suggest that targeting phosphatidylserine may lead to synergistic effects with PD-1 blockade without increasing toxicity rates, and future studies on this therapeutic strategy may be guided by biomarkers characterizing the pre-treatment tumor microenvironment.",Hsiehchen D; Beg MS; Kainthla R; Lohrey J; Kazmi SM; Khosama L; Maxwell MC; Kline H; Katz C; Hassan A; Kubota N; Siglinsky E; Pillai AK; Youssoufian H; Mockbee C; Culm K; Uhlik M; Benjamin L; Brekken RA; Ahn C; Singal AG; Zhu H; Hoshida Y; Yopp AC,False,patients with unresectable hepatocellular carcinoma,bavituximab plus pembrolizumab,not specified,"objective response rate, progression-free survival, overall survival, duration of response",single-arm phase 2 trial,Lacks comparison group and is not a randomized controlled trial.,False,-,-,-,-,-,"The study lacks a comparison group and is not a randomized controlled trial. It is a single-arm phase 2 trial, which does not meet the PICOS criteria for this review.",,,False
23,"Efficacy and safety of atezolizumab/bevacizumab in patients with HCC after prior systemic therapy: A global, observational study.",10.1097/HC9.0000000000000302,"BACKGROUND: Since the introduction of the combination treatment of anti-programmed death-ligand 1 antibody atezolizumab and anti-VEGF antibody bevacizumab (AB), median overall survival in HCC has drastically improved. However, evidence on the efficacy and safety of the novel treatment standard in patients with prior exposure to systemic treatment is scarce. The aim of this global, multicenter, observational study was to evaluate the efficacy and safety of AB in patients after previous systemic therapy. METHODS: We screened our global, multicenter, prospectively maintained registry database for patients who received any systemic therapy before AB. The primary end point was overall survival; secondary end points were time-to-progression, progression-free survival, objective response rate, and safety (rate and severity of adverse events). RESULTS: Among 493 patients who received AB for unresectable HCC, 61 patients received prior systemic therapy and were included in this analysis. The median age of the study population was 66 years, with 91.8% males. Predominant risk factors for HCC were viral hepatitis (59%) and alcohol (23%). Overall survival for AB was 16.2 (95% CI, 14.5-17.9) months, time-to-progression and progression-free survival were 4.1 (95% CI, 1.5-6.6) and 3.1 (95% CI, 1.1-5.1) months, respectively. The objective response rate was 38.2% (7.3% with complete and 30.9% with partial response). Overall survival was not influenced by treatment line (2nd vs. >2nd) or previous systemic treatment modality (tyrosine kinase inhibitors vs. immune checkpoint inhibitors). Treatment-related adverse events of all grades according to Common Terminology Criteria for Adverse Events were documented in 42.6% of patients, with only 13.1% of grade ≥3, including one death. CONCLUSION: In this observational study, AB emerges as a safe and efficacious treatment option in patients with HCC previously treated with other systemic therapy. behalf of the American Association for the Study of Liver Diseases.",Joerg V; Scheiner B; D Alessio A; Fulgenzi CAM; Schönlein M; Kocheise L; Lohse AW; Huber S; Wege H; Kaseb A; Wang Y; Mathew A; Kuang A; Muzaffar M; Abugabal YI; Chamseddine S; Phen S; Cheon J; Lee PC; Balcar L; Krall A; Ang C; Wu L; Saeed A; Huang YH; Bengsch B; Rimassa L; Weinmann A; Stauber R; Korolewicz J; Pinter M; Singal AG; Chon HJ; Pinato DJ; Schulze K; von Felden J,False,patients with unresectable HCC previously treated with systemic therapy,atezolizumab plus bevacizumab,not specified,"overall survival, time-to-progression, progression-free survival, objective response rate",observational study,Lacks comparison group and is not a randomized controlled trial.,False,-,-,-,-,-,"The study lacks a comparison group and is an observational study, not a randomized controlled trial. It does not meet the PICOS criteria for this review.",,,False
24,"Lenvatinib, sintilimab plus transarterial chemoembolization for advanced stage hepatocellular carcinoma: A phase II study.",10.1111/liv.15831,"BACKGROUND & AIMS: Our retrospective study has suggested encouraging outcomes of lenvatinib combined with PD-1 inhibitor and transarterial chemoembolization (TACE) on advanced hepatocellular carcinoma (HCC). This phase II trial was conducted to prospectively investigate the efficacy and safety of lenvatinib, sintilimab (a PD-1 inhibitor) plus TACE (Len-Sin-TACE) in patients with advanced stage HCC. METHODS: This was a single-arm phase II trial. Patients with BCLC stage C HCC were recruited. They received lenvatinib (bodyweight ≥60 kg, 12 mg; bodyweight <60 kg, 8 mg) orally once daily, sintilimab (200 mg) intravenously once every 3 weeks, and on demand TACE. The primary endpoint was progression-free survival (PFS) per mRECIST. RESULTS: Thirty patients were enrolled. The primary endpoint was met with a median PFS of 8.0 (95% confidence interval [CI]: 6.1-9.8) months per mRECIST, which was the same as that per RECIST 1.1. The objective response rate was 60.0% per mRECIST and 30.0% per RECIST 1.1. The disease control rate was 86.7% per mRECIST/RECIST 1.1. The median duration of response was 7.4 (95% CI: 6.6-8.2) months per mRECIST (n = 18) and 4.3 (95% CI: 4.0-4.6) months per RECIST 1.1 (n = 9). The median overall survival was 18.4 (95% CI: 14.5-22.3) months. Treatment-related adverse events (TRAEs) occurred in 28 patients (93.3%) and grade 3 TRAEs were observed in 12 patients (40.0%). There were no grade 4/5 TRAEs. CONCLUSIONS: Len-Sin-TACE showed promising antitumour activities with a manageable safety profile in patients with advanced stage HCC. The preliminary results need to be further evaluated with phase III randomized trials.",Cai M; Huang W; Liang W; Guo Y; Liang L; Lin L; Xie L; Zhou J; Chen Y; Cao B; Wu J; Zhu K,False,patients with advanced stage HCC,"lenvatinib, sintilimab plus TACE",not specified,"progression-free survival, objective response rate, disease control rate, overall survival",single-arm phase II trial,Lacks comparison group and is not a randomized controlled trial.,False,-,-,-,-,-,"The study lacks a comparison group and is a single-arm phase 2 trial, which does not meet the PICOS criteria for this review.",,,False
25,Radiation Therapy With Combination Therapy of Immune Checkpoint Inhibitors and Antiangiogenic Therapy for Hepatocellular Carcinoma.,10.1016/j.ijrobp.2023.07.001,"PURPOSE: Immune checkpoint inhibitors (ICIs) combined with antiangiogenic therapy have limited efficacy in treating advanced hepatocellular carcinoma (HCC). The synergistic effect of systemic therapy and radiation therapy (RT) might resolve this problem. We aimed to investigate the effect of RT on the treatment outcomes of ICIs and antiangiogenic combination therapy in patients with advanced-stage HCC. METHODS AND MATERIALS: This retrospective observational study analyzed the medical records of 194 patients with Barcelona Clinic Liver Cancer stage C HCC who were admitted to our center from August 2018 to June 2022 and received ICIs combined with antiangiogenic therapy as the first-line treatment. Patients who were administered RT for tumor thrombus or symptomatic metastases within 8 weeks of the commencement of combination therapy were allocated to the RT group, whereas those who did not receive RT were assigned to the non-radiation therapy (NRT) group. Propensity score matching was used to mitigate selection bias. The primary endpoints were progression-free survival (PFS) and overall survival (OS). The secondary endpoints included objective response rate, disease control rate (DCR), local PFS, out-of-field PFS, and treatment-related adverse events. RESULTS: A total of 76 patients diagnosed with advanced-stage HCC and treated with ICIs and antiangiogenic therapy were included in the study, with 33 patients in the RT group and 43 patients in the non-RT group. After propensity score matching, 29 matched patient pairs were generated. The median follow-up was 15.5 months, and the RT sites were mainly located on the tumor thrombus (55.2%) and extrahepatic metastatic lesions (48.3%). The median PFS was 8.3 months (95% CI, 5.4-11.3) in the RT group and 4.2 months (95% CI, 3.4-5.0) in the NRT group (P < .001). The median OS was not reached in the RT group and was 9.7 months (95% CI, 4.1-15.3) in the NRT group (P = .002). The objective response rate was 75.9% (95% CI, 56.5-89.7) in the RT group and 24.1% (95% CI, 10.3-43.5) in the NRT group (P < .001). The DCR was 100% in the RT group and 75.9% (95% CI, 56.5-89.7) in the NRT group (P = .005). The median local PFS and out-of-field PFS were 13.2 months (95% CI, 6.3-20.1) and 10.8 months (95% CI, 7.0-14.7), respectively. RT was an independent prognostic factor for PFS (hazard ratio = 0.33; 95% CI, 0.17-0.64; P < .001) and OS (hazard ratio = 0.28; 95% CI, 0.11-0.68; P = .005), respectively. The rates of any grade treatment-related adverse events were similar between the 2 groups. CONCLUSIONS: In comparison to the combination of ICIs and antiangiogenic therapy, the inclusion of RT has been observed to improve the DCR and survival outcomes in patients with advanced-stage HCC. The safety profile of this triple therapy was satisfactory.",Ning C; Zhang X; Wang Y; Yang X; Yang X; Chao J; Xun Z; Xue J; Wang Y; Sun H; Li Y; Zhang N; Zhu C; Hou X; Sang X; Zhao H,False,patients with advanced-stage HCC,ICIs combined with antiangiogenic therapy,RT group vs. non-RT group,"progression-free survival, overall survival, objective response rate, disease control rate",retrospective observational study,Study design is not a randomized controlled trial.,False,-,-,-,-,-,"The study design is a retrospective observational study, not a randomized controlled trial. It does not meet the PICOS criteria for this review.",,,False
26,"Nivolumab after selective internal radiation therapy for the treatment of hepatocellular carcinoma: a phase 2, single-arm study.",10.1136/jitc-2022-005457,"PURPOSE: To evaluate the safety and efficacy of selective internal radiation therapy (SIRT) in combination with a PD-1 inhibitor in patients with unresectable hepatocellular carcinoma (uHCC) and liver-only disease ineligible for chemoembolization. PATIENTS AND METHODS: NASIR-HCC is a single-arm, multicenter, open-label, phase 2 trial that recruited from 2017 to 2019 patients who were naïve to immunotherapy and had tumors in the BCLC B2 substage (single or multiple tumors beyond the up-to-7 rule), or unilobar tumors with segmental or lobar portal vein invasion (PVI); no extrahepatic spread; and preserved liver function. Patients received SIRT followed 3 weeks later by nivolumab (240 mg every 2 weeks) for up to 24 doses or until disease progression or unacceptable toxicity. Safety was the primary endpoint. Secondary objectives included objective response rate (ORR), time to progression (TTP), and overall survival (OS). RESULTS: 42 patients received SIRT (31 BCLC-B2, 11 with PVI) and were followed for a median of 22.2 months. 27 patients discontinued and 1 never received Nivolumab. 41 patients had any-grade adverse events (AE) and 21 had serious AEs (SAE). Treatment-related AEs and SAEs grade 3-4 occurred in 8 and 5 patients, respectively. Using RECIST 1.1 criteria, ORR reported by investigators was 41.5% (95% CI 26.3% to 57.9%). Four patients were downstaged to partial hepatectomy. Median TTP was 8.8 months (95% CI 7.0 to 10.5) and median OS was 20.9 months (95% CI 17.7 to 24.1). CONCLUSIONS: The combination of SIRT and nivolumab has shown an acceptable safety profile and signs of antitumor activity in the treatment of patients with uHCC that were fit for SIRT. TRIAL REGISTRATION NUMBER: NCT03380130. commercial re-use. See rights and permissions. Published by BMJ.",de la Torre-Aláez M; Matilla A; Varela M; Iñarrairaegui M; Reig M; Lledó JL; Arenas JI; Lorente S; Testillano M; Márquez L; Da Fonseca L; Argemí J; Gómez-Martin C; Rodriguez-Fraile M; Bilbao JI; Sangro B,False,patients with unresectable hepatocellular carcinoma and liver-only disease,SIRT followed by nivolumab,not specified,"objective response rate, time to progression, overall survival","single-arm, multicenter, open-label, phase 2 trial",Lacks comparison group and is not a randomized controlled trial.,False,-,-,-,-,-,"The study lacks a comparison group and is a single-arm, multicenter, open-label, phase 2 trial, which does not meet the PICOS criteria for this review.",,,False
27,SAFFRON-104: a phase Ib/II study of sitravatinib alone or with tislelizumab in advanced hepatocellular carcinoma and gastric cancer/gastroesophageal junction cancer.,10.1007/s00262-024-03806-2,"BACKGROUND: Sitravatinib is a spectrum-selective tyrosine kinase inhibitor targeting TAM (TYRO3, AXL, MER), VEGFR-2, KIT, and MET. SAFFRON-104 (NCT03941873) was a multicohort phase Ib/II study investigating sitravatinib with/without tislelizumab, an anti-programmed cell death protein 1 (PD-1) antibody, in patients with advanced hepatocellular carcinoma (HCC) or gastric cancer/gastroesophageal junction cancer (GC/GEJC). METHODS: Eligible patients had histologically/cytologically confirmed advanced HCC or GC/GEJC. Phase I determined the recommended phase II dose (RP2D) of sitravatinib with/without tislelizumab. Phase II evaluated sitravatinib monotherapy in patients with pretreated HCC, and sitravatinib plus tislelizumab in anti-PD-(L)1-naïve or -treated HCC and anti-PD-(L)1-naïve GC/GEJC. Primary endpoints were safety/tolerability (phase I) and objective response rate (ORR) (phase II). RESULTS: At data cutoff (March 31, 2023), 111 patients were enrolled; 102 were efficacy-evaluable (median study follow-up 9.1 months [range: 0.7-36.9]). The RP2D of sitravatinib was determined as 120 mg orally once daily. In patients receiving sitravatinib monotherapy and sitravatinib in combination with tislelizumab, grade ≥ 3 treatment-related adverse events occurred in 14 (51.9%) and 42 (50.0%) patients, respectively. The ORR was 25% (95% confidence interval [CI]: 8.7-49.1) in patients with pretreated HCC receiving sitravatinib monotherapy. In patients receiving sitravatinib with tislelizumab, the ORR was 11.5% (95% CI 2.4-30.2) with anti-PD-(L)1-naïve HCC, 9.5% (95% CI 1.2-30.4) with anti-PD-(L)1-treated HCC, and 16.1% (95% CI 5.5-33.7) in patients with anti-PD-(L)1-naïve GC/GEJC. CONCLUSIONS: Sitravatinib with/without tislelizumab was generally well tolerated and showed preliminary antitumor activity in patients with advanced HCC and GC/GEJC.",Li J; Bai Y; Chen Z; Ying J; Guo Y; Fang W; Zhang F; Xiong J; Zhang T; Meng Z; Zhang J; Ren Z; Hao C; Chen Y; Lin X; Pan H; Zhou F; Li X; Yu F; Zhang J; Zhang Z; Qin S,False,patients with advanced HCC or GC/GEJC,sitravatinib with/without tislelizumab,not specified,objective response rate,multicohort phase Ib/II study,Lacks comparison group and is not a randomized controlled trial.,False,-,-,-,-,-,"The study lacks a comparison group and is a multicohort phase Ib/II study, which does not meet the PICOS criteria for this review.",,,False
28,Conversion surgery for initially unresectable hepatocellular carcinoma using lenvatinib combined with TACE plus PD-1 inhibitor: A real-world observational study.,10.1016/j.dld.2023.11.027,"BACKGROUND: Conversion therapy for initially unresectable hepatocellular carcinoma (iuHCC) using lenvatinib combined with transcatheter arterial chemoembolization (TACE) plus a PD-1 inhibitor (LTP) has achieved promising results. However, further comparative research is necessary to evaluate the effectiveness and safety of conversion surgery (CS) for iuHCC. METHODS: Data for 32 consecutive patients with iuHCC receiving CS and 419 consecutive patients with resectable HCC receiving initial surgery (IS) between November 2019 and September 2022 were collected retrospectively. After propensity score matching (PSM), 65 patients were selected. RESULTS: Before matching, the CS group had longer EFS (not reached vs. 12.9 months, P < 0.001) and similar OS (not reached vs. not reached, P = 0.510) compared with the IS group. Similar results for EFS (P = 0.001) and OS (P = 0.190) were obtained after matching. The multivariable Cox model (HR = 0.231, 95% CI: 0.105-0.504; P < 0.001) and subgroup analyses confirmed that CS could improve EFS. The CS group had significantly lower incidence of microvascular invasion (MVI) than the IS group (3.1% vs. 50.4%, P < 0.001). Moreover, the two groups had similar safety profiles. CONCLUSIONS: CS is effective and safe for patients with iuHCC receiving LTP. LTP has the potential to reduce risk factors for postoperative recurrence, especially MVI, which may influence surgical decision-making. Elsevier Ltd. All rights reserved.",Li X; Wang X; Bai T; Chen J; Lu S; Wei T; Tang Z; Zhao G; Lu H; Li L; Wu F,False,patients with initially unresectable hepatocellular carcinoma,lenvatinib combined with TACE plus a PD-1 inhibitor,conversion surgery vs. initial surgery,"event-free survival, overall survival",retrospective study,Study design is not a randomized controlled trial.,False,-,-,-,-,-,"The study design is a retrospective study, not a randomized controlled trial. It does not meet the PICOS criteria for this review.",,,False
29,A first-in-human phase 1/2 study of FGF401 and combination of FGF401 with spartalizumab in patients with hepatocellular carcinoma or biomarker-selected solid tumors.,10.1186/s13046-022-02383-5,"BACKGROUND: Deregulation of FGF19-FGFR4 signaling is found in several cancers, including hepatocellular carcinoma (HCC), nominating it for therapeutic targeting. FGF401 is a potent, selective FGFR4 inhibitor with antitumor activity in preclinical models. This study was designed to determine the recommended phase 2 dose (RP2D), characterize PK/PD, and evaluate the safety and efficacy of FGF401 alone and combined with the anti-PD-1 antibody, spartalizumab. METHODS: Patients with HCC or other FGFR4/KLB expressing tumors were enrolled. Dose-escalation was guided by a Bayesian model. Phase 2 dose-expansion enrolled patients with HCC from Asian countries (group1), non-Asian countries (group2), and patients with other solid tumors expressing FGFR4 and KLB (group3). FGF401 and spartalizumab combination was evaluated in patients with HCC. RESULTS: Seventy-four patients were treated in the phase I with single-agent FGF401 at 50 to 150 mg. FGF401 displayed favorable PK characteristics and no food effect when dosed with low-fat meals. The RP2D was established as 120 mg qd. Six of 70 patients experienced grade 3 dose-limiting toxicities: increase in transaminases (n = 4) or blood bilirubin (n = 2). In phase 2, 30 patients in group 1, 36 in group 2, and 20 in group 3 received FGF401. In total, 8 patients experienced objective responses (1 CR, 7 PR; 4 each in phase I and phase II, respectively). Frequent adverse events (AEs) were diarrhea (73.8%), increased AST (47.5%), and ALT (43.8%). Increase in levels of C4, total bile acid, and circulating FGF19, confirmed effective FGFR4 inhibition. Twelve patients received FGF401 plus spartalizumab. RP2D was established as FGF401 120 mg qd and spartalizumab 300 mg Q3W; 2 patients reported PR. CONCLUSIONS: At biologically active doses, FGF401 alone or combined with spartalizumab was safe in patients with FGFR4/KLB-positive tumors including HCC. Preliminary clinical efficacy was observed. Further clinical evaluation of FGF401 using a refined biomarker strategy is warranted. TRIAL REGISTRATION: NCT02325739 .",Chan SL; Schuler M; Kang YK; Yen CJ; Edeline J; Choo SP; Lin CC; Okusaka T; Weiss KH; Macarulla T; Cattan S; Blanc JF; Lee KH; Maur M; Pant S; Kudo M; Assenat E; Zhu AX; Yau T; Lim HY; Bruix J; Geier A; Guillén-Ponce C; Fasolo A; Finn RS; Fan J; Vogel A; Qin S; Riester M; Katsanou V; Chaudhari M; Kakizume T; Gu Y; Porta DG; Myers A; Delord JP,False,patients with HCC or other FGFR4/KLB expressing tumors,FGF401 alone and combined with spartalizumab,not specified,objective responses,phase I/II study,Lacks comparison group and is not a randomized controlled trial.,False,-,-,-,-,-,"The study lacks a comparison group and is a phase I/II study, which does not meet the PICOS criteria for this review.",,,False
