Index,Title,DOI,Abstract,Authors,A_Decision,A_Reason,A_P,A_I,A_C,A_O,A_S,B_Decision,B_Reason,B_P,B_I,B_C,B_O,B_S,C_Decision,C_Reason,Final_Decision
39,Recent updates in the use of pharmacological therapies for downstaging in patients with hepatocellular carcinoma,10.1080/14656566.2023.2229728,"IntroductionHepatocellular carcinoma (HCC) is the most frequent primary liver cancer, but only 20-30% of patients benefit from potentially curative treatments such as liver resection or transplantation. This article reviews conventional treatments and recent progress in pharmacotherapy for advanced HCC, with a focus on downstaging unresectable tumors to resectable status.Areas coveredIn this article, conventional treatments and recent progress in pharmacotherapy for advanced HCC, aiming at downstaging from unresectable to resectable status, are reviewed. Future prospectives of combination therapies using immune checkpoint inhibitors were also introduced by reviewing recent clinical trials, paying attention to the objective response rate as its potential of downstaging treatments.Expert opinionThe newly developed pharmacological therapies showed higher responses. Although various tumor statuses in advanced HCC hamper detailed analysis of successful conversion rate, the novel combined immunotherapies are expected to provide more opportunities for subsequent curative surgery for initially unresectable advanced HCC. The conversion treatment strategies for unresectable HCC should be separately discussed for 'technically resectable but oncologically unfavorable' HCC and metastatic or invasive HCC beyond curative surgical treatments. The optimal downstaging treatment strategy for advanced HCC is awaited. Elucidation of preoperatively available factors that predict successful downstaging will allow the tailoring of promising initial treatments leading to conversion surgery.","Takamoto, T; Maruki, Y; Kondo, S",False,not a study and lacks original research data,not specified,combination therapies using immune checkpoint inhibitors,not specified,downstaging unresectable tumors,review article,False,"This is a review article summarizing existing literature rather than presenting original research data, making it ineligible under the PICOS framework. Model A's decision aligns with this reasoning.",-,-,-,-,-,False,No disagreement between Model A and B,False
40,Two cases of hepatocellular carcinoma successfully treated by carbon ion radiotherapy after atezolizumab plus bevacizumab treatment,10.1007/s12328-023-01768-z,"We herein report two cases of huge hepatocellular carcinoma (HCC) that were successfully treated by carbon ion radiotherapy after atezolizumab plus bevacizumab treatment. Case 1, an 84-year-old man, was diagnosed with HCC (maximum diameter: 11 cm) with portal invasion and presented HCC rupture. After obtaining hemostasis with transcatheter embolization, three cycles of atezolizumab-bevacizumab therapy were administered, and marked shrinkage of the HCC was confirmed. However, he developed jaundice, liver damage and cerebral subcortical hemorrhage. Thus, atezolizumab-bevacizumab therapy was discontinued. Total bilirubin, transaminase levels, and physical activity improved well with prednisolone, an antihypertensive agent, and rehabilitation. Thus, treatment with carbon ion radiotherapy (CIRT) was added, and the treatment effect at 4 months after CIRT was judged as a complete response (CR) according to the modified response evaluation criteria in solid tumors (mRECIST). Case 2, a 68-year-old man, was diagnosed with HCC (maximum diameter: 14 cm). Hepatic resection was difficult because the residual liver volume after treatment would be insufficient. Five cycles of atezolizumab-bevacizumab therapy were performed, and marked shrinkage of the HCC to a maximum diameter of 9 cm was confirmed. The treatment was converted to CIRT, and atezolizumab-bevacizumab therapy resumed one month after CIRT. The treatment effect at 3 months after CIRT was judged as CR according to mRECIST. Although conversion therapy after atezolizumab-bevacizumab therapy, including surgery and radiofrequency ablation, have been reported, CIRT may be a promising new tool for conversion therapy for HCC.","Takakusagi, S; Tanaka, H; Naganuma, A; Kakizaki, S; Shibuya, K; Ohno, T; Takagi, H; Uraoka, T",False,not a randomized controlled trial and lacks comparison group,patients with hepatocellular carcinoma,atezolizumab plus bevacizumab therapy,not specified,treatment response and adverse effects,case report,False,"The study is a case report focusing on two individual patients treated with atezolizumab plus bevacizumab followed by carbon ion radiotherapy. It lacks a comparison group and randomization, which are essential for inclusion under the PICOS criteria. Additionally, the outcomes reported are limited to individual cases rather than systematic survival or response rate data applicable to a broader population.",-,-,-,-,-,False,No disagreement between Model A and B,False
41,"Hepatectomy After Conversion Therapy with Hepatic Arterial Infusion Chemotherapy, Tyrosine Kinase Inhibitors and Anti-PD-1 Antibodies for Initially Unresectable Hepatocellular Carcinoma",10.2147/JHC.S432062,"Background: Most patients with hepatocellular carcinoma (HCC) are not candidates for liver resection. We investigated the clinicopathological characteristics and prognosis of patients with initially unresectable HCC who underwent hepatectomy after conversion therapy with hepatic arterial infusion chemotherapy (HAIC), tyrosine kinase inhibitors (TKIs), and anti-PD-1 antibodies. Materials and Methods: Patients with initially unresectable HCC who received HAIC combined with TKIs and anti-PD-1 antibodies followed by hepatectomy between December 2020 and December 2022, were retrospectively analyzed. Patient characteristics, tumor characteristics, treatment efficacy, perioperative characteristics, pathological characteristics, and survival outcomes were summarized and analyzed. Results: 67 patients were enrolled in this study. Patients were treated with 3 sessions (range:2-6 sessions) of combination therapy and were performed with hepatectomy in 4 months (range:1.4-17.8 months) after the initiation of the combination therapy. The median size of tumor shrinkage was 4.7 cm (range:0.9-11.7 cm). A pathological complete response (pCR) was achieved in 34.3% of the patients (n = 23). The median recurrence-free survival (RFS) was 19.3 months and the median overall survival (OS) was 28.7 months. Patients who achieved pCR had a better RFS (P = 0.004) and those without microscopic vascular invasion (MVI) had a better prognosis (RFS, P = 0.011; OS, P = 0.023). Multivariable logistic analysis revealed that the tumor number was associated with pCR. Conclusion: Hepatectomy after conversion therapy with HAIC, TKIs, and anti-PD-1 antibodies is a feasible treatment strategy for patients with unresectable HCC. This treatment strategy is associated with a promising prognosis.","Yu, BR; Zhang, N; Feng, Y; Zhang, YF; Zhang, T; Wang, L",False,not a randomized controlled trial and lacks comparison group,patients with initially unresectable hepatocellular carcinoma,"hepatectomy after conversion therapy with HAIC, TKIs, and anti-PD-1 antibodies",not specified,survival outcomes,retrospective analysis,False,"This is a retrospective analysis of patients receiving hepatectomy after conversion therapy with HAIC, TKIs, and anti-PD-1 antibodies. While it reports survival outcomes such as recurrence-free survival and overall survival, it does not include a randomized controlled design or a defined comparison group. The lack of a comparator makes it unsuitable for inclusion under the PICOS framework.",-,-,-,-,-,False,No disagreement between Model A and B,False
42,Changing the Treatment Paradigm for Hepatocellular Carcinoma Using Atezolizumab plus Bevacizumab Combination Therapy,10.3390/cancers13215475,"Atezolizumab plus bevacizumab combination therapy was approved worldwide for use in 2020. A 30% objective response rate with 8% complete response (CR) was achieved in a phase 3 IMbrave150 trial. Here, the change in the treatment strategy for hepatocellular carcinoma (HCC) using atezolizumab plus bevacizumab combination therapy is reviewed. The phase 3 IMbrave150 clinical trial was successful because of the direct antitumor effect of bevacizumab, which shifted the suppressive immune microenvironment to a responsive immune microenvironment, in addition to its synergistic effects when combined with atezolizumab. The analysis of CR cases was effective in patients with poor conditions, particularly tumor invasion in the main portal trunk (Vp4), making the combination therapy a breakthrough for HCC treatment. The response rate of the combination therapy was 44% against intermediate-stage HCC. Such a strong tumor-reduction effect paves the way for curative conversion (ABC conversion) therapy and, therefore, treatment strategies for intermediate-stage HCC may undergo a significant shift in the future. As these treatment strategies are effective in maintaining liver function, even in elderly patients, the transition frequency to second-line treatments could also be improved. These strategies may be effective against nonalcoholic steatohepatitis-related hepatocellular carcinoma and WNT/beta-catenin mutations to a certain degree.","Kudo, M",False,not a randomized controlled trial and lacks a defined comparison group,patients with hepatocellular carcinoma,atezolizumab plus bevacizumab combination therapy,not specified,objective response rate,review of a clinical trial,False,"This article reviews the IMbrave150 trial but does not present original data from a randomized controlled trial. Instead, it summarizes findings from a previously conducted phase 3 trial without providing new evidence or a direct comparison group within the current study. As such, it fails to meet the PICOS criteria despite discussing response rates and treatment strategies.",-,-,-,-,-,False,No disagreement between Model A and B,False
43,Criteria for identifying potentially resectable patients with initially oncologically unresectable hepatocellular carcinoma before treatment with lenvatinib plus an anti-PD-1 antibody,10.3389/fimmu.2022.1016736,"BackgroundConversion therapy is feasible in patients with oncologically unresectable hepatocellular carcinoma (HCC). However, it is challenging to prospectively identify patients who are more likely to achieve successful conversion before initiating systemic therapy, either alone or combined with locoregional therapy. MethodsCriteria for identifying potentially resectable patients with initially oncologically unresectable HCC before treatment with lenvatinib plus an anti-PD-1 antibody were proposed based on real-world evidence. Multivariate Firth logistic regression was used to validate the proposed criteria in a retrospective cohort of consecutive patients with advanced HCC, who received combination therapy with lenvatinib plus an anti-PD-1 antibody between September 2018 and September 2021. ResultsThe proposed criteria were as follows: (1) Eastern Cooperative Oncology Group performance status of 0 or 1; (2) Child-Pugh class A; (3) intrahepatic tumors confined to one lobe (left, right, or middle lobe), or present in one lobe alongside a single tumor with diameter <= 5 cm or up to three tumors each with diameter <= 3 cm in the remaining lobes, with R0 resection achievable by hemihepatectomy, alone or combined with locoregional therapy to the remaining lobes during surgery; and (4) no portal vein tumor thrombus involving the contralateral liver lobe or reaching the superior mesenteric vein, no hepatic vein tumor thrombus involving more than two major hepatic vein branches on the tumor side, and no tumor thrombus of the inferior vena cava reaching the atrium. Firth logistic regression confirmed the criteria were an independent predictor of surgery following conversion therapy with lenvatinib plus an anti-PD-1 antibody. ConclusionsThis study proposed and validated criteria for identifying patients with initially oncologically unresectable HCC who are potentially resectable when treated with combination therapy with lenvatinib plus an anti-PD-1 antibody. The proposed criteria could help standardize conversion therapy studies in advanced HCC.","Xu, B; Zhu, XD; Shen, YH; Zhu, JJ; Liu, J; Li, ML; Tang, PW; Zhou, J; Fan, J; Sun, HC; Huang, C",False,not a randomized controlled trial and lacks direct comparison,patients with initially unresectable hepatocellular carcinoma,lenvatinib plus anti-PD-1 antibody,not specified,criteria for resectability and survival outcomes,retrospective cohort study,False,"The study proposes and validates criteria for identifying resectable patients using lenvatinib plus an anti-PD-1 antibody in a retrospective cohort. However, it lacks a randomized controlled trial design and does not include a defined comparison group. While it discusses resectability and survival outcomes, these do not fulfill the PICOS requirements due to the absence of randomization and comparative analysis.",-,-,-,-,-,False,No disagreement between Model A and B,False
44,"Surgical Conversion for Initially Unresectable Locally Advanced Hepatocellular Carcinoma Using a Triple Combination of Angiogenesis Inhibitors, Anti-PD-1 Antibodies, and Hepatic Arterial Infusion Chemotherapy: A Retrospective Study",10.3389/fonc.2021.729764,"BackgroundRecent research has shown that selected patients with initially unresectable hepatocellular carcinoma (HCC) are able to achieve conversion to resectable disease through systemic or local therapy. Combination regimens comprised of drugs with different mechanisms of action have shown better outcomes than single-drug or single-approach-based treatments; however, to date, combination regimens investigated as part of conversion therapy strategies have been two drug combinations with reported issues of relatively low surgical conversion and objective response rates. In this study, we investigated the efficacy and safety of triple combination therapy with angiogenesis inhibitors, programmed death-1 inhibitors and hepatic arterial infusion chemotherapy for surgical conversion of advanced HCC. MethodsThis was a single-center, retrospective, single-arm study of patients with unresectable HCC who received at least one cycle of triple combination therapy with an oral anti-angiogenic drug, programmed death-1 inhibitors and hepatic arterial infusion chemotherapy between August 2019 and August 2020. Endpoints included the overall response rate (ORR), surgical conversion rate, time to response and safety. Treatment response was assessed using the modified Response Evaluation Criteria in Solid Tumors (mRECIST) and RECIST v1.1. ResultsIn total, 34 patients were included in this study, of whom 25 completed treatment evaluation. The best ORR was 96.0% (24/25); 48.0% (n = 12) had a complete response, 48.0% (n = 12) had a partial response, and 4.0% (n = 1) had stable disease. The median time to response was 50.5 (95% CI, 31.02-64.00) days and the surgical conversion rate was 60% (15/25). Of the 25 patients, 56.0% (n = 14) received surgical resection and 28.0% (n = 7) had a pathologic complete response. Toxic side effects were manageable. ConclusionA triple combination therapy regimen of angiogenesis inhibitors, programmed death-1 inhibitors and hepatic arterial infusion chemotherapy showed significant therapeutic effect with an extremely high surgical conversion rate in patients with initially unresectable HCC.","Zhang, JL; Zhang, XH; Mu, H; Yu, G; Xing, WE; Wang, L; Zhang, T",False,not a randomized controlled trial and lacks comparison group,patients with initially unresectable hepatocellular carcinoma,"triple combination therapy with angiogenesis inhibitors, PD-1 inhibitors, and HAIC",not specified,surgical conversion rates and response rates,single-arm study,False,"This single-arm study evaluates triple combination therapy for surgical conversion in unresectable HCC. Despite reporting high response and conversion rates, it lacks a randomized controlled trial design and a comparison group. The absence of a comparator and non-randomized nature exclude it from meeting the PICOS criteria.",-,-,-,-,-,False,No disagreement between Model A and B,False
45,"Conversion therapy for advanced hepatocellular carcinoma in the era of precision medicine: Current status, challenges and opportunities",10.1111/cas.16194,"Hepatocellular carcinoma (HCC), the most prevalent malignancy of the digestive tract, is characterized by a high mortality rate and poor prognosis, primarily due to its initial diagnosis at an advanced stage that precludes any surgical intervention. Recent advancements in systemic therapies have significantly improved oncological outcomes for intermediate and advanced-stage HCC, and the combination of locoregional and systemic therapies further facilitates tumor downstaging and increases the likelihood of surgical resectability for initially unresectable cases following conversion therapies. This shift toward high conversion rates with novel, multimodal treatment approaches has become a principal pathway for prolonged survival in patients with advanced HCC. However, the field of conversion therapy for HCC is marked by controversies, including the selection of potential surgical candidates, formulation of conversion therapy regimens, determination of optimal surgical timing, and application of adjuvant therapy post-surgery. Addressing these challenges and refining clinical protocols and research in HCC conversion therapy is essential for setting the groundwork for future advancements in treatment strategies and clinical research. This narrative review comprehensively summarizes the current strategies and clinical experiences in conversion therapy for advanced-stage HCC, emphasizing the unresolved issues and the path forward in the context of precision medicine. This work not only provides a comprehensive overview of the evolving landscape of treatment modalities for conversion therapy but also paves the way for future studies and innovations in this field. Setting a foundation for future research and advancements in HCC treatment, aligning with the emerging paradigm of precision medicine; addressing the need for a holistic approach in managing advanced-stage HCC, and advocating for a balance between aggressive treatment and quality of life considerations.image","Wang, MD; Xu, XJ; Wang, KC; Diao, YK; Xu, JH; Gu, LH; Yao, LQ; Li, C; Lv, GY; Yang, T",False,"Does not meet PICOS criteria; no relevant information on intervention, comparison, outcome, or study design.",not specified,not specified,not specified,not specified,not specified,False,"The abstract discusses conversion therapy strategies for advanced hepatocellular carcinoma but does not specify any interventions, comparisons, or outcomes related to immune checkpoint inhibitors or survival/response rates. It is a narrative review without focus on RCTs, making it unsuitable for inclusion.",-,-,-,-,-,False,No disagreement between Model A and B,False
46,Neoadjuvant atezolizumab plus bevacizumab prior liver transplantation for hepatocellular carcinoma,10.1016/j.jhepr.2024.101246,"Background & Aims: The combination of atezolizumab and bevacizumab offers a novel approach to immunomodulation, showing efficacy as a primary treatment in advanced hepatocellular carcinoma (HCC). Concerns about graft safety and rejection have limited its exploration in the neoadjuvant setting of liver transplantation (LT). In this study, we investigate the clinical efficacy and the safety profile of pre-transplant administration of atezolizumab and bevacizumab for HCC. Methods: Herein, we performed a prospective assessment of 17 patients with HCC treated with neoadjuvant preoperative atezolizumab and bevacizumab prior to LT for HCC, obtained from December 2020 and December 2023 at seven Western transplant centers. Results: Among the 17 patients with HCC included in the study, 16 (94.1%) had a tumor burden outside of Milan criteria. Neoadjuvant locoregional therapies along with the administration of atezolizumab plus bevacizumab (median: 5 months; discontinued at least 4 weeks prior to LT) led to an objective response rate of 94% (complete response: 59%), downstaging to within Milan criteria (82%) and a pathological response at explant examination of 88%. Grade 3-4 treatment-related adverse events accounted for 17.6% of cases and were manageable. During the 25-month median follow-up period, two cases of mild (rejection activity index <= 4), biopsy-proven rejection were reported but no instances of severe allograft rejection or graft loss were reported. The 1-year and 3-year post-LT survival rates were 94.2% and 88.2%, respectively. Conclusions: This study highlights the favorable oncological and survival outcomes associated with atezolizumab and bevacizumab treatment in the pre-LT setting. This immune-based combination was safe in terms of treatment-related adverse events, and absence of severe post-transplant rejection or graft loss. These preliminary results could pave the way for expanding transplant eligibility criteria in patients at more advanced HCC stages. (c) 2024 The Authors. Published by Elsevier B.V. on behalf of European Association for the Study of the Liver (EASL). This is an open access articleunder the CC BY-NC-ND license.","Tabrizian, P; Marino, R; Bhoori, S; Zeitlhoefler, M; Mehta, N; Banz, V; Gruttadauria, S; Iavarone, M; Mazzarelli, C; Simonotti, N; Yao, FC; Mazzaferro, V; Llovet, JM",False,No comparison group specified; does not fit the PICOS criteria fully.,patients with advanced hepatocellular carcinoma,atezolizumab and bevacizumab treatment,not specified,1-year and 3-year post-LT survival rates,prospective study,False,"While the abstract specifies patients with HCC and describes an intervention (atezolizumab and bevacizumab), it lacks a comparison group as required by PICOS criteria. The study design is prospective but not randomized, which disqualifies it from inclusion.",-,-,no comparison group is mentioned; the study evaluates only one treatment arm,-,prospective observational study rather than an RCT,False,No disagreement between Model A and B,False
47,"Pretransplant use of immune checkpoint inhibitors for hepatocellular carcinoma: A multicenter, retrospective cohort study",10.1016/j.ajt.2024.04.007,"Immune checkpoint inhibitors (ICIs) as a downstaging or bridging therapy for liver transplantation (LT) in hepatocellular carcinoma patients are rapidly increasing. However, the evidence about the feasibility and safety of pre-LT ICI therapy is limited and controversial. To this end, a multicenter, retrospective cohort study was conducted in 11 Chinese centers. The results showed that 83 recipients received pre-LT ICI therapy during the study period. The median post- LT follow-up was 8.1 (interquartile range 3.3-14.6) months. During the short follow-up, 23 (27.7%) recipients developed allograft rejection, and 7 of them (30.4%) were diagnosed by liver biopsy. Multivariate logistics regression analysis showed that the time interval between the last administration of ICI therapy and LT (TLAT) >= 30 days was an independent protective factor for allograft rejection (odds ratio = 0.096, 95% confidence interval 0.026-0.357; P <.001). Multivariate Cox analysis showed that allograft rejection was an independent risk factor for overall survival (hazard ratio = 9.960, 95% confidence interval 1.006-98.610; P =.043). We conclude that patients who receive a pre-LT ICI therapy with a TLAT shorter than 30 days have a much higher risk of allograft rejection than those with a TLAT longer than 30 days. The presence of rejection episodes might be associated with higher post-LT mortality.","Guo, ZY; Liu, Y; Ling, Q; Xu, LB; Wang, TL; Zhu, JX; Lin, YM; Lu, XJ; Qu, W; Zhang, F; Zhu, ZJ; Zhang, J; Jia, ZH; Zeng, P; Wang, WJ; Sun, Q; Luo, QJ; Hu, ZM; Zheng, ZY; Jia, YB; Li, J; Zheng, YJ; Wang, MC; Wang, SP; Han, ZM; Yu, S; Li, CJ; Zhang, SH; Xiong, J; Deng, FW; Liu, Y; Chen, HW; Wang, YF; Li, L; Liang, WJ; Schlegel, A; Nashan, B; Liu, C; Zheng, SS; He, XS",False,No specific comparison to a control or placebo group; does not meet PICOS criteria.,patients receiving pre-LT ICI therapy,pre-LT immune checkpoint inhibitors therapy,not specified,post-LT mortality,multicenter retrospective cohort study,False,"The abstract focuses on pre-LT ICI therapy and provides survival data, but it lacks a direct comparison group such as placebo or non-ICI treatments. Additionally, the study design is retrospective, failing to meet the RCT requirement.",-,-,no direct comparison group specified; the analysis compares TLAT intervals within the same cohort,-,"multicenter retrospective cohort study, not an RCT",False,No disagreement between Model A and B,False
