index,P,I,C,O,S,matches_criteria,reasoning
124,HCC patients,computed tomography (CT)-based conventional radiomics and deep-learning convolutional neural networks (CNN),not specified,overall survival (OS),retrospective study,False,"Intervention is not immunotherapy or targeted therapy, and study design is not a randomized controlled trial."
125,HBV-related HCC patients after curative liver resection,TDF therapy,ETV therapy,tumor recurrence and overall survival,randomized controlled trial,False,Intervention is not immunotherapy or targeted therapy.
126,US adults ages ≥ 21 years,alcohol warning messages,control topic (recycling or reselling products),perceived message effectiveness and reactance,online within-subjects experiment,False,"Population is not hepatocellular carcinoma patients, and intervention is not related to the specified criteria."
127,patients with unresectable HCC,Tislelizumab,Sorafenib,cost-effectiveness and quality-adjusted life-years (QALYs),partitioned survival model (PSM),False,"Outcome is not survival or response rate, and study design is not a randomized controlled trial."
128,HCC and fibrolamellar carcinoma (FLC) patients,liver resection,not specified,overall survival (OS),retrospective analysis,False,"Intervention is not immunotherapy or targeted therapy, and study design is not a randomized controlled trial."
129,HBV-compensated cirrhosis patients with small/medium EV,carvedilol plus NUC,NUC alone,progression rate of EV and liver-related events,randomized controlled trial,False,"Population is not specifically hepatocellular carcinoma patients, and outcome is not survival or response rate."
130,patients with hepatocellular carcinoma undergoing liver resection,administration of dexamethasone before clamping the hilar pedicle,placebo,"postoperative liver function, inflammatory response, and perioperative outcomes","randomized, dual-arm, parallel-group, double-blinded trial",False,"Population and study design match, but intervention and outcome do not match the target criteria."
131,patients with dual-phenotype hepatocellular carcinoma and non-DPHCC,clinical and radiomics models based on contrast-enhanced MRI,not specified,diagnostic performance of MRI radiomics models,retrospective,False,"Population does not match, and study design is not a randomized controlled trial."
132,patients with unresectable hepatocellular carcinoma,TACE combined with envafolimab and lenvatinib,not specified,"objective response rate, disease control rate, progression-free survival",not specified,False,"Population matches, but intervention, comparison, and study design do not match the target criteria."
133,patients with advanced liver cancer,novel antisense oligonucleotide drug targeting human IGF-1R,not specified,tolerability and safety of the drug,dose-escalation trial,False,"Population matches, but intervention, comparison, outcome, and study design do not match the target criteria."
134,patients with nonoperable locally advanced hepatocellular carcinoma,(90)Y-loaded glass microspheres with personalized dosimetry,standard dosimetry,overall survival,"phase II study, randomized",True,All PICOS elements match the target criteria.
135,patients with liver-confined hepatocellular carcinoma,TACE plus pembrolizumab,not specified,"safety, progression-free survival, overall survival",not specified,False,"Population and intervention partially match, but comparison, outcome, and study design do not match the target criteria."
136,patients with intermediate-stage hepatocellular carcinoma,NAC and DEXA combination,placebo,prevention of PES and liver decompensation after cTACE,"prospective, randomized",False,"Population and study design match, but intervention and outcome do not match the target criteria."
137,patients with HCC with extrahepatic metastasis,apatinib with hepatic arterial infusion chemotherapy,not specified,"objective response rate, progress-free survival, overall survival",phase II trial,False,"Population matches, but intervention, comparison, and study design do not match the target criteria."
138,patients with cirrhosis and HCC,TARE with (131)I-lipiodol,TACE,"objective tumor response, survival",prospective clinical trials,False,"Population and comparison match, but intervention, outcome, and study design do not match the target criteria."
139,patients with hepatocellular carcinoma,not specified,not specified,overall survival according to sex,retrospective,False,"Population matches, but intervention, comparison, outcome, and study design do not match the target criteria."
110,patients with hepatocellular carcinoma,intraperitoneal anti-PD-1 antibody,not specified,"safety, objective response rate, ascites control rate, overall survival",phase Ib study,False,"Population and intervention match, but no comparison to standard therapy or placebo, and study design is not a randomized controlled trial."
111,patients with advanced hepatocellular carcinoma,pembrolizumab plus Y90 radioembolization,not specified,"progression-free survival, time to progression, objective response rate, overall survival","open-label, single-arm multicenter pilot study",False,"Population and intervention match, but no comparison to standard therapy or placebo, and study design is not a randomized controlled trial."
112,not specified,not specified,not specified,relationship between gut microbiota and gastrointestinal disorders,observational research using Mendelian randomization,False,Does not match any of the target PICOS criteria.
113,patients with unresectable hepatocellular carcinoma,sintilimab plus IBI305 and HAIC,not specified,"objective response rate, overall survival, event-free survival",clinical trial,False,"Population and intervention match, but no comparison to standard therapy or placebo, and study design is not specified as a randomized controlled trial."
114,patients with initially unresectable hepatocellular carcinoma,lenvatinib combined with TACE plus PD-1 inhibitor,initial surgery,"event-free survival, overall survival",retrospective study with propensity score matching,False,"Population and intervention match, comparison is to initial surgery not standard therapy or placebo, and study design is not a randomized controlled trial."
115,Chinese young adults at risk of NAFLD,"educational interventions (pamphlet, video)",no intervention,awareness and knowledge of NAFLD,randomized controlled trial,False,"Population does not match, intervention is not immunotherapy or targeted therapy, and outcomes are not survival or response rate."
116,postmenopausal women,dietary patterns,not specified,"incident liver cancer, chronic liver disease mortality",prospective cohort analysis,False,"Population does not match, intervention is not immunotherapy or targeted therapy, and study design is not a randomized controlled trial."
117,HCC patients with negative AFP and PIVKA-II,not specified,HCC patients with at least 1 positive AFP or PIVKA-II,risk factors for AFP and PIVKA-II negativity,retrospective study,False,"Population partially matches, but intervention is not specified, and study design is not a randomized controlled trial."
118,systemic treatment-naive patients with unresectable hepatocellular carcinoma,tislelizumab plus lenvatinib,not specified,"objective response rate, disease control rate, progression-free survival, overall survival","multicenter, single-arm, phase 2 study",False,"Population and intervention match, but no comparison to standard therapy or placebo, and study design is not a randomized controlled trial."
119,patients with hepatocellular carcinoma undergoing LDLT,not specified,not specified,"disease-free survival, overall survival",retrospective observational single-center study,False,"Population partially matches, but intervention is not specified, and study design is not a randomized controlled trial."
90,patients with cirrhosis,hepatocellular carcinoma screening outreach,not specified,financial harms and burden,multicenter pragmatic randomized clinical trial,False,Population does not specifically target hepatocellular carcinoma patients. Intervention and outcomes do not match the target criteria.
91,patients with oligometastatic hepatocellular carcinoma,stereotactic ablative radiotherapy (SABR),not specified,"overall survival, progression-free survival, local progression, objective response rate, disease control rate, toxicities, quality of life",prospective study,False,"Population matches, but intervention is not immunotherapy or targeted therapy, and there is no comparison to standard therapy or placebo."
92,patients with HBV-positive recurrent HCC post-liver transplant,mRNA electroporated HBV-specific TCR T cells,not specified,"safety, tolerability, anti-tumor efficacy",phase I clinical trial,False,"Population matches, but intervention is not standard immunotherapy or targeted therapy, and there is no comparison to standard therapy or placebo."
93,HCC patients undergoing hepatectomies,not specified,HCC patients with or without autoimmune diseases,"overall survival, liver-specific survival, disease-free survival",retrospective study,False,"Population matches, but intervention is not specified, and study design is not a randomized controlled trial."
94,people with NASH and type 2 diabetes,MPC inhibitor MSDC-0602K,placebo,"BCAA concentrations, BCKDH phosphorylation","randomized, placebo-controlled Phase IIB clinical trial",False,"Population does not match, and outcomes are not related to survival or response rate in hepatocellular carcinoma."
95,patients with advanced stage HCC,"lenvatinib, sintilimab plus TACE",not specified,"progression-free survival, overall survival, objective response rate, disease control rate",single-arm phase II trial,False,"Population and intervention match, but there is no comparison to standard therapy or placebo, and study design is not a randomized controlled trial."
96,BCLC-C hepatocellular carcinoma patients,palliative stereotactic body radiation therapy (SBRT),not specified,"local control, overall survival, adverse events",observational retrospective study,False,"Population matches, but intervention is not immunotherapy or targeted therapy, and study design is not a randomized controlled trial."
97,patients with advanced ESCC and HCC,AL2846 (TKI) with anti-PD-L1 antibody (TQB2450),not specified,"overall response rate, progression-free survival, overall survival, disease control rate",phase 1b study,False,"Population matches, but intervention is not standard immunotherapy or targeted therapy, and study design is not a randomized controlled trial."
98,patients with multifocal stage 2 HCC,liver transplantation or partial hepatectomy,liver transplantation vs. partial hepatectomy,overall survival,propensity score-based observational study,False,"Population matches, but interventions are surgical and not immunotherapy or targeted therapy, and study design is not a randomized controlled trial."
99,patients with untreated advanced HCC,anlotinib alone or combined with S-1,anlotinib vs. anlotinib+S-1,"objective response rate, disease control rate, progression-free survival, overall survival",randomized study,False,"Population matches, but intervention is not standard immunotherapy or targeted therapy, and study design is not a randomized controlled trial."
150,patients with HCC recurrence post-surgery,sequential therapy with ropeginterferon alfa-2b and nivolumab,not specified,"safety, tolerability, and inhibitory activity",Phase I clinical trial,False,"Population and intervention match, but no comparison to standard therapy or placebo, and outcomes do not include survival or response rate."
151,HBV-related HCC patients post-surgery,TDF switch therapy,ETV maintenance,3-year recurrence free survival and overall survival,"randomized, open-label, phase III trial",True,"Matches all PICOS criteria: population, intervention, comparison, outcome, and study design."
152,"patients with advanced solid tumors, including HCC",SAR'459 ± cemiplimab,not specified,"safety, pharmacokinetics, pharmacodynamics, and antitumor activity",phase I/Ib study,False,Population includes HCC but not exclusively; no comparison to standard therapy or placebo; outcomes do not include survival or response rate.
153,patients with advanced HCC,doxorubicin plus sorafenib vs. sorafenib,sorafenib,overall survival and progression-free survival,randomized phase III trial,True,"Matches all PICOS criteria: population, intervention, comparison, outcome, and study design."
154,HCC patients undergoing hepatectomy,prophylactic dexamethasone,control group,perioperative outcomes,randomized controlled trial,False,"Population and study design match, but intervention is not immunotherapy or targeted therapy, and outcomes do not include survival or response rate."
155,HCC patients post-narrow-margin hepatectomy,radiotherapy vs. TACE,TACE,overall survival and progression-free survival,prospective randomized study,False,"Population and outcomes match, but interventions are not immunotherapy or targeted therapy."
156,inpatients with cirrhosis,not specified,not specified,death and receipt of liver transplant,prospective observational cohort study,False,Population does not specifically include HCC patients; no intervention or comparison specified.
157,MVI-negative HCC patients,Gd-EOB-DTPA MRI,not specified,recurrence-free survival,retrospective study,False,"Population matches, but intervention is diagnostic, not therapeutic, and no comparison to standard therapy or placebo."
158,postoperative liver cancer patients,Home to Hospital to Home nutrition management program,general nutritional method,nutrition-related indicators and complications,randomized controlled trial,False,"Population includes liver cancer but not specifically HCC; intervention is nutritional, not immunotherapy or targeted therapy."
159,patients with unresectable HCC,atezolizumab plus bevacizumab,not specified,progression-free survival and overall survival,prospective observational study,False,"Population and intervention match, but no comparison to standard therapy or placebo, and study design is not a randomized controlled trial."
140,patients with unresectable hepatocellular carcinoma,DEB-TACE with doxorubicin-loaded CalliSpheres microspheres,cTACE with doxorubicin-lipiodol emulsion,"clinical response rate, overall survival, progression-free survival",randomized controlled trial,True,"Matches all PICOS criteria: population with HCC, intervention and comparison are specified, outcomes include survival and response rate, study design is RCT."
141,patients with HCC and Vp4 PVTT,irradiation stent placement plus TACE,sorafenib plus TACE,"overall survival, hepatic function, time to symptomatic progression",multicenter randomized controlled trial,True,"Matches all PICOS criteria: population with HCC, intervention and comparison are specified, outcomes include survival, study design is RCT."
142,HCC patients with high relapse risks after surgery,postoperative adjuvant anti-PD-1 antibody,no PD-1 treatment after hepatectomy,"overall survival, recurrence-free survival",prospective observational study,False,Does not match study design criteria: not an RCT.
143,CHB patients with intermediate to high risk of HCC,IFN add-on NAs therapy,NAs monotherapy,"HCC incidence, HBsAg loss",multi-center randomized controlled trial,False,"Population does not match: patients are with CHB, not HCC."
144,patients with suspected malignant liver lesions,[(18)F]FAPI-04 PET/CT scanning,[(18)F]FDG PET/CT scanning,"sensitivity, specificity, accuracy of each tracer",not specified,False,Population and outcomes do not match: not focused on HCC patients or survival/response rate.
145,elderly patients with unresectable HCC,sorafenib or lenvatinib,not specified,"progression-free survival, overall survival",retrospective observational study,False,Does not match study design criteria: not an RCT.
146,patients with HCC or metastatic colorectal cancer,SIRT with (90)Y resin microspheres,not specified,"overall response rate, overall survival","multicenter, single-arm, prospective, observational study",False,Does not match study design criteria: not an RCT.
147,patients with early-stage HCC,machine learning model for treatment recommendations,not specified,survival rates,not specified,False,"Intervention and study design do not match: not focused on immunotherapy or targeted therapy, not an RCT."
148,patients who achieved HBsAg seroclearance following peg-IFN-α-based treatments,peg-IFN-α-based therapy,not specified,HBsAg recurrence,"prospective, multicenter, observational study",False,Population and outcomes do not match: not focused on HCC patients or survival/response rate.
149,patients with impaired liver function or tumors not amenable to thermal ablation,SBRT with dose optimization,conventional SBRT,"local control, toxicity",phase II clinical trial,False,Population and outcomes do not match: not focused on HCC patients or survival/response rate.
160,"patients with single huge, resectable hepatocellular carcinoma","neoadjuvant therapy with TACE, camrelizumab, and apatinib",surgery alone,recurrence-free survival at 1 year,"multi-center, open-label randomized phase 3 trial",True,matches all target PICOS criteria
161,patients with hepatocellular carcinoma eligible for TACE,TACE-DEB,SBRT,"time to progression, local control, overall survival, response rate",multicenter randomized trial,False,intervention and comparison do not match target criteria
162,patients with HBV-related HCC within Milan criteria and clinically significant PHT,partial hepatectomy,interventional treatment using ablation with or without pre-ablation TACE,"overall survival, recurrence-free survival",open-label randomized clinical trial,False,intervention and comparison do not match target criteria
163,cancer patients with chronic hepatitis B undergoing chemotherapy,24-week vs. 48-week TDF prophylaxis,not specified,cumulative incidence of virological and clinical relapse,"phase IV, prospective randomized trial",False,population and intervention do not match target criteria
164,treatment-naive patients with advanced hepatocellular carcinoma,toripalimab plus bevacizumab,not specified,"objective response rate, progression-free survival, overall survival","phase II, multicenter, prospective, single-arm study",False,comparison and study design do not match target criteria
165,patients with resectable single and small hepatitis B virus-related HCC predicted to have high risks of MVI,neoadjuvant intensity modulated radiation therapy,upfront surgery,"disease-free survival, overall survival",randomized trial,False,intervention does not match target criteria
166,CHB patients with histologically confirmed advanced liver fibrosis/early cirrhosis,ETV plus RG,ETV alone,"fibrosis regression, inflammation remission, risk of HCC",randomized and blindly allocated trial,False,population and intervention do not match target criteria
167,HCC patients who underwent hepatectomy,postoperative adjuvant transarterial chemoembolization,no PA-TACE,"disease-free survival, overall survival",retrospective analysis,False,study design does not match target criteria
168,patients with advanced solid tumors and BRCA1/2 mutations,talazoparib,not specified,"disease control, objective response, progression-free survival, overall survival",phase II basket trial,False,population and intervention do not match target criteria
169,individuals at high risk for hepatocellular carcinoma,mHealth-based intervention program,usual health education,"knowledge of LC prevention, screening intentions","two-arm, single-blind randomized controlled trial",False,population and intervention do not match target criteria
180,patients with cirrhosis and chronic hepatitis B,telehealth consultations,standard consultations,HCC surveillance uptake,retrospective observational study,False,"Population does not specifically mention hepatocellular carcinoma, intervention is not immunotherapy or targeted therapy, and study design is not a randomized controlled trial."
181,patients with NAFLD,probiotic supplementation,standard treatment,NAFLD fibrosis score,randomized controlled trial,False,"Population is not specifically patients with hepatocellular carcinoma, and intervention is not immunotherapy or targeted therapy."
182,compensated cirrhosis patients with LS≥25 kPa,carvedilol therapy,placebo,incidences of decompensated events and liver-related death,"randomized, double-blind, placebo-controlled trial",False,"Population is not specifically patients with hepatocellular carcinoma, and intervention is not immunotherapy or targeted therapy."
183,patients with hepatocellular carcinoma,laparoscopic major hepatectomy,open major hepatectomy,2-year recurrence-free survival,randomized trial,False,"Intervention is surgical, not immunotherapy or targeted therapy."
184,patients with metastatic NSCLC,new systemic treatments,control arm,"QoL, PFS, and OS",randomized controlled trials,False,Population is not patients with hepatocellular carcinoma.
185,patients with HCC and cirrhosis,not specified,not specified,rehabilitation nursing impact,not specified,False,"Intervention, comparison, and study design are not specified, and the focus is not on survival or response rate."
186,patients with liver cirrhosis,state-of-the-art tests for early HCC detection,not specified,early HCC detection,"prospective, longitudinal, diagnostic, prognostic study",False,"Population is not specifically patients with hepatocellular carcinoma, and intervention is not immunotherapy or targeted therapy."
187,patients with CHB-associated liver fibrosis,hydronidone plus entecavir,placebo plus entecavir,fibrosis improvement,"randomized, double-blind, placebo-controlled trial",False,"Population is not specifically patients with hepatocellular carcinoma, and intervention is not immunotherapy or targeted therapy."
188,patients with HCC treated with TACE,CEUS Nonradiation TRA LI-RADS,not specified,diagnostic performance for viable tumors,retrospective observational study,False,"Intervention is diagnostic, not immunotherapy or targeted therapy, and study design is not a randomized controlled trial."
189,patients with liver tumours,TARE with Yttrium-90 resin microspheres,not specified,adverse events,prospective observational study,False,"Population is not specifically patients with hepatocellular carcinoma, and study design is not a randomized controlled trial."
210,chickens infected with Salmonella enterica,puerarin treatment,control group and S. enterica group,"liver metabolism, inflammation, oxidative damage, and hepatocellular carcinoma biomarkers",randomized controlled trial,False,Population does not match (not hepatocellular carcinoma patients).
211,patients with acromegaly,not specified,patients without acromegaly,cancer incidence,"observational, retrospective study",False,Population and intervention do not match the target criteria.
212,obese cirrhotic patients with and without HCC,spectroscopic methods,not specified,diagnostic accuracy for HCC,not specified,False,Intervention and comparison do not match the target criteria.
213,cirrhotic patients with non-symptomatic portal vein thrombosis,warfarin anticoagulation therapy,untreated group,"recanalization probability, bleeding events, mortality, ascites aggravation",randomized controlled trial,False,Population does not match (not hepatocellular carcinoma patients).
214,patients with asymptomatic synchronous unresectable colorectal liver-limited metastases,pre-PTR chemotherapy,upfront PTR,"progression-free survival, overall survival, tumour response, disease control rate, liver metastases resection rate, surgical complications, chemotherapy toxicity",randomized controlled trial,False,Population does not match (not hepatocellular carcinoma patients).
215,liver cancer patients undergoing laparoscopic hepatectomy,continuous lidocaine infusion,not specified,pharmacokinetics characteristics and safety,not specified,False,Intervention and comparison do not match the target criteria.
216,liver kidney transplant recipients,not specified,not specified,"prevalence of incidental HCC or iCC, patient, kidney, and liver graft survival","observational, retrospective study",False,Population and intervention do not match the target criteria.
217,patients with chronic liver disease in Sweden,not specified,not specified,"incidence, prevalence, and mortality","register-based, nationwide observational study",False,Population and intervention do not match the target criteria.
218,"population in Ma'anshan, China",not specified,not specified,cancer incidence and trends,not specified,False,Population and intervention do not match the target criteria.
219,COVID-19 patients with chronic liver diseases,not specified,not specified,risk factors for unfavourable outcome,retrospective observational study,False,Population and intervention do not match the target criteria.
170,HCV-infected patients with hepatocellular carcinoma,sofosbuvir/velpatasvir or glecaprevir/pibrentasvir,not specified,sustained virological response and safety,observational study,False,"Population and intervention partially match, but no comparison to standard therapy or placebo, and study design is not a randomized controlled trial."
171,patients with HCC of BCLC stage A exceeding the Milan criteria or BCLC stage B,sintilimab plus DEB-TACE,not specified,"progression-free survival, objective response rate, pathologic response rate, and safety","prospective, phase II study",False,"Population and intervention match, but no comparison to standard therapy or placebo, and study design is not a randomized controlled trial."
172,HCC patients with PVTT,DEB-TACE,cTACE,"progression-free survival, overall survival, and incidence of adverse events",randomized controlled trial,True,"Population, intervention, comparison, outcome, and study design all match the target criteria."
