index,P,I,C,O,S,matches_criteria,reasoning
302,patients with intermediate-stage hepatocellular carcinoma,lenvatinib and transcatheter arterial chemoembolisation,not specified,"resection rate, overall survival","single-arm, prospective clinical trial",False,Comparison and study design do not match target criteria.
303,patients with standard chemotherapy refractory mismatch repair proficient metastatic colorectal cancer,pexastimogene devacirepvec plus durvalumab with and without tremelimumab,not specified,"progression-free survival, overall survival",phase I/II trial,False,Population and study design do not match target criteria.
304,hepatitis B surface antigen-positive adults,anti-HBV therapy,not specified,"HBV treatment initiation, major adverse liver outcomes",multicenter longitudinal cohort study,False,Population and intervention do not match target criteria.
305,patients with hepatocellular carcinoma resistance to lenvatinib,lenvatinib plus gefitinib,not specified,"progression-free survival, overall survival","single-arm, open-label, exploratory study",False,Comparison and study design do not match target criteria.
306,chronic hepatitis C patients who achieved SVR with SOF-based treatment,sofosbuvir or ledipasvir/sofosbuvir,not specified,HCC occurrence,"prospective, multicenter observational study",False,Population and intervention do not match target criteria.
307,patients undergoing routine ERCP procedures,endoscopic optical light scattering technique,not specified,detection of malignant transformation,pilot in vivo double-blind prospective study,False,Population and intervention do not match target criteria.
308,hepatocellular carcinoma patients,transvascular antitumor interventional therapy,not specified,"disease control rate, progression-free survival",single-center observational case-control study,False,Intervention and study design do not match target criteria.
309,chronic hepatitis C patients who reached SVR after DAA treatment,direct-acting antivirals,not specified,"long-term prognosis, clinical outcomes","single-center, retrospective, observational study",False,Population and intervention do not match target criteria.
310,patients with advanced unresectable hepatocellular carcinoma,transarterial radioembolization,standard therapy,survival outcomes,randomized controlled trial simulation,False,"Intervention is not immunotherapy or targeted therapy, and study design is a simulation, not a direct RCT."
311,patients with NAFLD,not specified,not specified,prevalence of hepatocellular carcinoma,retrospective study,False,"Population does not specifically have hepatocellular carcinoma, and study design is not an RCT."
312,patients with metastatic colorectal cancer to the liver,transarterial chemoembolization with HepaSphere Microspheres,not specified,"overall survival, progression-free survival",prospective study,False,"Population does not have hepatocellular carcinoma, and study design is not an RCT."
313,patients with hepatocellular carcinoma smaller than 2 cm,surgical resection,not specified,"recurrence-free survival, overall survival",retrospective observational study,False,"Intervention is not immunotherapy or targeted therapy, and study design is not an RCT."
314,patients with cirrhosis and hepatocellular carcinoma,abstinence from alcohol,non-alcohol-related cirrhosis,"access to curative treatment, 5-year survival",prospective study,False,"Intervention is not immunotherapy or targeted therapy, and study design is not an RCT."
315,patients with hepatocellular carcinoma,decision support intervention,control group,"treatment knowledge, decisional conflict",randomized controlled trial,False,Intervention is not immunotherapy or targeted therapy.
316,patients with chronic HBV infection,VIR-2218 with or without pegylated interferon-alpha-2a,not specified,"HBsAg seroclearance, adverse events","open-label, phase 2 study",False,"Population does not have hepatocellular carcinoma, and study design is not an RCT."
317,patients with small hepatocellular carcinoma,radiofrequency ablation with a novel approach,not specified,"local tumor progression, intrahepatic remote recurrence",prospective study,False,"Intervention is not immunotherapy or targeted therapy, and study design is not an RCT."
318,patients with hepatocellular carcinoma,not specified,not specified,microvascular invasion prediction,retrospective study,False,"Intervention and comparison not specified, and study design is not an RCT."
319,patients with hepatocellular carcinoma,systemic treatment with sorafenib,not specified,progression of non-hypervascular hepatobiliary phase hypointense lesions,analysis within the SORAMIC trial,False,"Intervention is not immunotherapy or targeted therapy, and study design is not an RCT."
280,stage I and II HCC patients,liver resection,not specified,recurrence outcome,retrospective review,False,"Does not match target criteria: intervention is not immunotherapy or targeted therapy, no comparison specified, outcome is not survival or response rate, study design is not randomized controlled trial."
281,patients with cirrhosis,mailed outreach plus patient navigation for HCC screening,usual care with visit-based screening,screening process completion,multicentre pragmatic randomised clinical trial,False,"Does not match target criteria: population is not specifically HCC patients, intervention is not immunotherapy or targeted therapy, outcome is not survival or response rate."
282,patients diagnosed with hypothyroidism,not specified,not specified,frequency of cancer,"observational, retrospective study",False,"Does not match target criteria: population is not HCC patients, no intervention or comparison specified, outcome is not survival or response rate, study design is not randomized controlled trial."
283,patients with HCC,systemic and locoregional therapies,not specified,impact of AEs on QoL,analysis of data from the SARAH randomized controlled trial,False,"Does not match target criteria: intervention is not specifically immunotherapy or targeted therapy, no comparison specified, outcome is not survival or response rate."
284,patients with recurrent HCC,RFA in combination with toripalimab (anti-PD-1),RFA alone,recurrence free survival,not specified,True,"Matches target criteria: population is HCC patients, intervention includes immunotherapy, comparison is standard therapy, outcome is survival, though study design is not explicitly stated as randomized controlled trial."
285,patients with primary liver cancer,not specified,not specified,diagnostic and prognostic biomarker evaluation,observational study,False,"Does not match target criteria: no intervention or comparison specified, outcome is not survival or response rate, study design is not randomized controlled trial."
286,CNLC-IIIb stage HCC patients,hepatectomy in combination with apatinib and camrelizumab,not specified,patient mortality,multicentre phase II trial with single-arm,False,"Does not match target criteria: no comparison specified, study design is not randomized controlled trial."
287,Japanese NAFLD patients,not specified,not specified,liver-related events,observational study,False,"Does not match target criteria: population is not HCC patients, no intervention or comparison specified, outcome is not survival or response rate, study design is not randomized controlled trial."
288,liver cancer patients undergoing hepatectomy,not specified,not specified,severe postoperative pleural effusion,retrospective observational study,False,"Does not match target criteria: no intervention or comparison specified, outcome is not survival or response rate, study design is not randomized controlled trial."
289,outpatients at an academic tertiary care centre,not specified,not specified,sensitivity and specificity of SLE classification criteria,prospective and retrospective observational cohort study,False,"Does not match target criteria: population is not HCC patients, no intervention or comparison specified, outcome is not survival or response rate, study design is not randomized controlled trial."
250,patients with hepatocellular carcinoma (HCC) with severe pain,Transcutaneous electrical acupoint stimulation (TEAS),control group,"Numerical Rating Scale (NRS) score, Brief Pain Inventory scores, analgesic dose, frequency of opioid-induced gastrointestinal side effects, Karnofsky Performance Status (KPS), Quality of Life Scale - Liver Cancer (QOL-LC), and Brief Fatigue Inventory (BFI) scores",randomized controlled trial,False,"Population matches, but intervention is not immunotherapy or targeted therapy, and outcomes do not include survival or response rate."
251,"patients with advanced hepatocellular carcinoma (HCC), Child-Pugh A and B",Low-energy electromagnetic fields (EMFs) exposure,standard care,"safety, hemodynamic variability patterns, health-related quality of life (HRQoL), overall survival (OS), and objective response rate (ORR)",single-site feasibility trial,False,"Population matches, but intervention is not immunotherapy or targeted therapy, and study design is not a randomized controlled trial."
252,HCC patients who had curative resection,not specified,not specified,serum levels of PIVKA-II and AFP,"multicenter, retrospective, and observational study",False,"Population matches, but intervention, comparison, and outcomes do not match the target criteria, and study design is not a randomized controlled trial."
253,HCC patients undergoing hepatectomy,2D-SWE assessing LS and spleen area (SPA),not specified,prediction of posthepatectomy liver failure (PHLF),multicenter observational study,False,"Population matches, but intervention, comparison, and outcomes do not match the target criteria, and study design is not a randomized controlled trial."
254,patients with hepatocarcinoma,sorafenib,not specified,"overall survival, time to progression, and response using RECIST criteria",observational retrospective study,False,"Population matches, but intervention is not immunotherapy or targeted therapy, comparison is not specified, and study design is not a randomized controlled trial."
255,patients with advanced HCC in whom previous ICI therapy has failed,"stereotactic body RT (SBRT), sintilimab and IBI305",not specified,"objective response rate (ORR), disease control rate, progression-free survival, overall survival and safety","open-label, single-arm, single-centre, phase 2 trial",True,"Population, intervention, and outcomes match the target criteria, but comparison is not specified and study design is not a randomized controlled trial."
256,not specified,Therapeutic Assistance and Decision algorithms for hepatobiliary tumor Boards (ADBoard),conventional MDM,"concordance of recommendations, completeness of patient information, explainability of tumor board protocols",randomized to either MDM with ADBoard or conventional MDM,False,"Population not specified, intervention does not match, and outcomes do not include survival or response rate."
257,unresectable HCC patients,hepatic arterial infusion chemotherapy (HAIC),not specified,"therapeutic response, Progression-free survival (PFS)",retrospective study,False,"Population matches, but intervention is not immunotherapy or targeted therapy, comparison is not specified, and study design is not a randomized controlled trial."
258,patients with ulcerative colitis (UC),ritlecitinib,placebo,modified clinical remission and endoscopic improvement,phase 2b trial,False,"Population does not match, and study design is not a randomized controlled trial."
259,patients with centrally located hepatocellular carcinoma,augmented reality navigation (ARN) and fluorescence imaging,non-ARN-FI group,perioperative outcomes and disease-free survival,post hoc analysis of an original nonrandomized clinical trial,False,"Population matches, but intervention does not match, and study design is not a randomized controlled trial."
320,patients with hepatocellular carcinoma,pre-TACE 3D CT angiography,DSA,detection of HCC feeding vessels,prospective study,False,Intervention and outcome do not match target criteria.
321,"patients with liver, lung, and kidney tumors",high-power microwave ablation,not specified,"technical success, safety, and effectiveness",retrospective observational study,False,"Population and intervention partially match, but comparison and outcome do not match target criteria."
322,UICC7 Stage IIIA and IIIB potentially resectable HCC patients,preoperative chemotherapy,upfront resection,overall survival rate,phase II clinical trial,False,"Intervention and outcome partially match, but population and study design do not fully match target criteria."
323,patients undergoing elective resection for HCC,hepatic resection,not specified,90-day mortality,retrospective study,False,"Population and outcome partially match, but intervention and comparison do not match target criteria."
324,Chinese chronic liver disease and severe thrombocytopenia patients,lusutrombopag,placebo,platelet count increase and safety,"double-blind, parallel-group phase 3 study",False,Population and intervention do not match target criteria.
325,unresectable hepatocellular carcinoma patients,atezolizumab plus bevacizumab,not specified,therapeutic efficacy and progression-free survival,retrospective observational study,False,"Population and intervention partially match, but comparison and study design do not match target criteria."
326,adult patients with solid tumors treated with cisplatin,cisplatin-based systematic chemotherapy,not specified,incidence and risk factors for CIA and long-term renal dysfunction,"retrospective, single-center, observational, longitudinal follow-up study",False,Population and intervention do not match target criteria.
327,patients with hepatocellular carcinoma,COVID-19 vaccination,not specified,infection-free survival,"prospective, multicenter, observational cohort study",False,"Population and outcome partially match, but intervention and comparison do not match target criteria."
328,patients with small- and medium-sized HCC,microwave ablation and radiofrequency ablation,not specified,therapeutic response and clinical outcome,prospective trial,False,"Population and intervention partially match, but comparison and outcome do not match target criteria."
329,patients diagnosed with HRS undergoing liver transplant,terlipressin,"non-HRS, non-hepatocellular carcinoma cirrhotic indications",post-transplant renal function and survival,"retrospective, observational study",False,Population and intervention do not match target criteria.
340,patients with NASH,"vitamin E, statins, metformin",not specified,diagnosis and management of NAFLD and NASH,cross-sectional observational study,False,Population does not match; intervention and outcome do not match target criteria; study design is not a randomized controlled trial.
341,patients with hepatocellular carcinoma after hepatitis B cirrhosis,prolonging hepatic hilum occlusion time using IPM combined with CLCVP,standard occlusion time,"operation time, postoperative parameters",randomized controlled trial,False,Population matches; intervention and comparison partially match; outcome does not match target criteria; study design matches.
342,patients treated with DAAs,DAAs treatment,not specified,incidence of EVs and HCC,observational study,False,Population does not match; intervention and outcome do not match target criteria; study design is not a randomized controlled trial.
343,subjects with suspected HCC,IOP Injection as MRI contrast agent,not specified,safety and clinical validity of IOP Injection,prospective study,False,Population matches; intervention and outcome do not match target criteria; study design is not a randomized controlled trial.
344,patients with unresectable HCC after TACE failure,iNKT cell infusion,TAE therapy without iNKT cell infusion,"PFS, OS, ORR, DCR, QoL",randomized controlled trial,True,"Population, intervention, comparison, outcome, and study design all match target criteria."
345,patients with cirrhotic HCV,sofosbuvir plus daclatasvir with ribavirin,sofosbuvir with ribavirin,sustained virological response,not specified,False,Population does not match; intervention and comparison partially match; outcome does not match target criteria; study design not specified.
346,HCC patients,disulfidptosis-related signature,not specified,"prognostic prediction, immune microenvironment",not specified,False,Population matches; intervention and outcome do not match target criteria; study design not specified.
347,cirrhotic patients,not specified,not specified,clinical characteristics of PVT,retrospective analysis,False,"Population does not match; intervention, comparison, and outcome do not match target criteria; study design is not a randomized controlled trial."
348,healthy participants,Rencofilstat,fasted vs high-fat conditions,pharmacokinetics of RCF,"phase 1, randomized, open-label study",False,Population does not match; intervention and comparison partially match; outcome does not match target criteria; study design is not a randomized controlled trial for HCC.
349,persons with chronic hepatitis B and hepatic steatosis,aerobic exercise training,no intervention,"fat fraction of the liver, hepatokine secretion, lipid- and glucose metabolism","randomized, controlled, clinical intervention trial",False,Population does not match; intervention and comparison partially match; outcome does not match target criteria; study design matches but not for HCC.
350,patients with unresectable hepatocellular carcinoma,nofazinlimab plus lenvatinib,not specified,objective responses and safety profile,"phase 1a/1b, open-label, multicenter, dose-escalation/expansion trial",False,"Population and intervention match, but comparison and study design do not meet the target criteria."
351,elderly patients with hepatocellular carcinoma,lenvatinib,younger group (<80 years old),"adverse events, administration period, dose intensity, objective response, and progression-free survival",retrospective evaluation,False,"Population and intervention match, but comparison and study design do not meet the target criteria."
352,patients with hepatocellular carcinoma undergoing transarterial chemoembolization,clinical decision support system,handbook only,"patient-centered caring attitude, pain management barrier identification, and comfort care competence",randomized controlled trial,False,"Population and study design match, but intervention and outcome do not meet the target criteria."
353,participants at risk for hepatocellular carcinoma,reduced amount of iodinated contrast medium,standard liver CT,image quality and lesion conspicuity,randomized controlled trial,False,"Population and study design match, but intervention and outcome do not meet the target criteria."
354,patients undergoing hepatectomy by laparotomy,inspiratory muscle training,conventional physical therapy,strength of the respiratory muscles and incidence of postoperative pulmonary complications,"prospective, randomized, clinical trial",False,"Population and study design match, but intervention and outcome do not meet the target criteria."
355,patients with hepatocellular carcinoma treated with immune checkpoint inhibitors,"continuation of ICI, treatment switching to TKIs, cessation of anticancer therapy",not specified,post-progression survival,retrospective observational study,False,"Population and intervention match, but comparison and study design do not meet the target criteria."
356,patients with various cancers including hepatocellular carcinoma,not specified,not specified,USP7 expression and its correlation with clinical outcomes,retrospective observational study combined with bioinformatics analysis,False,"Population, intervention, comparison, and outcome do not meet the target criteria."
357,patients diagnosed with chronic hepatitis B,not specified,not specified,"epidemiology, clinical, and economic outcomes",retrospective observational study,False,"Population, intervention, comparison, and outcome do not meet the target criteria."
358,BCLC stage B or C hepatocellular carcinoma patients,atezolizumab and bevacizumab,viral vs non-viral infection,efficacy and safety,retrospective cohort study,False,"Population and intervention match, but comparison and study design do not meet the target criteria."
359,young and middle-aged male patients with hepatocellular carcinoma,not specified,not specified,overall survival,retrospective analysis using SEER database,False,"Population and outcome match, but intervention and comparison do not meet the target criteria."
370,58 HBV-related HCC patients,expression profile of SUMO and NF-κB genes,not specified,association with clinical outcome of HCC,observational study,False,"Population matches, but intervention, comparison, outcome, and study design do not meet target criteria."
371,dogs with nonresectable hepatic carcinoma,drug-eluting bead transarterial-chemoembolization (DEB-TACE),not specified,predict median survival time,"prospective, single-arm clinical trial",False,"Population does not match, and study design is not a randomized controlled trial."
372,"35 patients with chronic liver disease, cirrhosis, or current HCC",MRI features for risk stratification,not specified,predict hypervascular transformation,retrospective observational cohort study,False,"Population matches, but intervention, comparison, outcome, and study design do not meet target criteria."
373,316 patients with HCC,contrast-enhanced ultrasound (CEUS),not specified,sonomorphological and histopathological features associated with lack of APHE,prospective multi-center real-life setting,False,"Population matches, but intervention, comparison, outcome, and study design do not meet target criteria."
374,"1,935 patients with newly diagnosed multiple myeloma",not specified,not specified,clinical characteristics and prognosis,retrospective analysis,False,"Population does not match, and intervention, comparison, outcome, and study design do not meet target criteria."
375,439 patients with extreme hyperbilirubinemia,not specified,not specified,30-day mortality,retrospective observational cohort study,False,"Population does not match, and intervention, comparison, outcome, and study design do not meet target criteria."
376,789 consecutive patients who underwent surgery for HCC,not specified,not specified,clinical characteristics and surgical outcomes,retrospective analysis,False,"Population matches, but intervention, comparison, outcome, and study design do not meet target criteria."
377,321 patients with advanced chronic liver disease caused by HCV,direct-acting antivirals (DAAs),not specified,development of liver-related events after SVR,"observational, retrospective study",False,"Population does not match, and study design is not a randomized controlled trial."
378,"188,770 individuals with an alcohol-related hospital presentation",not specified,not specified,all-cause and cause-specific mortality,observational study,False,"Population does not match, and intervention, comparison, outcome, and study design do not meet target criteria."
379,127 patients undergoing elective liver cancer resection and splenectomy,US transducer-guided radial artery puncture technology with guide marks,conventional US transducer-guided radial artery puncture technology,success rate of radial artery cannulation,parallel-group trial,False,"Population does not match, and outcome does not meet target criteria."
330,patients with beyond-the-Milan criteria HCC,combination TACE and RFA therapy,TACE monotherapy,"1-month tumour response, progression-free survival, overall response rate, number of treatments until CR, overall survival, and change in liver function",randomized controlled trial,False,"Population and intervention match, but the comparison is not standard therapy or placebo, and outcomes include more than survival or response rate."
331,advanced PHC patients,TACE combined with radioactive iodine implantation therapy,TACE alone,"tumor lesion length, clinical effect, serum AFP, CT perfusion parameters, survival time",randomized controlled trial,False,"Population and intervention match, but the comparison is not standard therapy or placebo, and outcomes include more than survival or response rate."
332,patients with hepatocellular carcinoma,diffusion-weighted imaging with apparent diffusion coefficient map,not specified,predictive performance of imaging in predicting proliferation rate,single-center retrospective study,False,"Population matches, but intervention is not immunotherapy or targeted therapy, no comparison specified, outcome not survival or response rate, and study design is not a randomized controlled trial."
333,cirrhotic patients with HCC,gadoxetic acid-enhanced MRI,contrast-enhanced Computed Tomography,diagnostic performance for HCC detection and liver transplant eligibility assessment,"prospective, single-institution study",False,"Population matches, but intervention is not immunotherapy or targeted therapy, outcome not survival or response rate, and study design is not a randomized controlled trial."
334,patients with hepatocellular carcinoma,carbon ion radiotherapy,not specified,"maximum tolerated dose, overall survival, local progression-free survival, progression-free survival",dose escalation study,False,"Population matches, but intervention is not immunotherapy or targeted therapy, no comparison specified, outcome includes more than survival or response rate, and study design is not a randomized controlled trial."
335,patients with HCC undergoing narrow-margin hepatectomy,postoperative radiotherapy,narrow-margin hepatectomy alone,"overall survival, disease-free survival, recurrence rates",two-arm cohort study,False,"Population matches, but intervention is not immunotherapy or targeted therapy, outcome includes more than survival or response rate, and study design is not a randomized controlled trial."
