index,P,I,C,O,S,matches_criteria,reasoning
0,patients with high-risk surgically resected or ablated hepatocellular carcinoma,atezolizumab plus bevacizumab,active surveillance,recurrence-free survival,randomized controlled trial,True,matches all target PICOS criteria
1,patients with advanced biliary tract cancer,pembrolizumab plus gemcitabine and cisplatin,placebo plus gemcitabine and cisplatin,overall survival,randomized controlled trial,False,population does not match target criteria
2,patients with unresectable hepatocellular carcinoma,STRIDE (Single Tremelimumab Regular Interval Durvalumab),sorafenib,overall survival,randomized controlled trial,True,matches all target PICOS criteria
3,patients with unresectable or metastatic hepatocellular carcinoma,camrelizumab plus rivoceranib,sorafenib,progression-free survival and overall survival,randomized controlled trial,True,matches all target PICOS criteria
4,HCC patients in BCLC stage C,camrelizumab and apatinib with HAIC-FOLFOX,not specified,objective response rate,not specified,False,comparison and study design not specified
5,patients with unresectable hepatocellular carcinoma,tislelizumab,sorafenib tosylate,overall survival,randomized controlled trial,True,matches all target PICOS criteria
6,not specified,not specified,not specified,liver disease risk,observational study,False,does not match target PICOS criteria
7,patients with unresectable hepatocellular carcinoma,tremelimumab in combination with durvalumab,not specified,overall survival,not specified,False,comparison and study design not specified
8,patients with unresectable hepatocellular carcinoma,lenvatinib plus pembrolizumab,lenvatinib plus placebo,overall survival and progression-free survival,randomized controlled trial,True,matches all target PICOS criteria
9,adults with MASLD without cirrhosis,low-dose aspirin,placebo,hepatic fat content,randomized controlled trial,False,population does not match target criteria
60,patients with hepatocellular carcinoma,palliative care intervention,standard of care,symptom improvement,randomized controlled trial,False,"Intervention is palliative care, not immunotherapy or targeted therapy."
61,people with HIV,antiretroviral therapy,not specified,cause-specific mortality,observational cohort study,False,Population is not hepatocellular carcinoma patients; study design is not RCT.
62,patients with hepatocellular carcinoma,liver resection,not specified,overall survival,retrospective study,False,"Intervention is surgical, not immunotherapy or targeted therapy; study design is not RCT."
63,patients with hepatocellular carcinoma,contrast-enhanced US,CE MRI or CT,detection of residual viable HCC,prospective multicenter trial,False,"Intervention is diagnostic, not therapeutic; study design is not RCT."
64,patients with hepatocellular carcinoma,hepatectomy,not specified,postoperative complications and long-term outcomes,retrospective study,False,"Intervention is surgical, not immunotherapy or targeted therapy; study design is not RCT."
65,patients with recurrent intermediate-stage HCC,SOR-TACE,TACE alone,overall survival,randomized clinical trial,True,Matches all target PICOS criteria.
66,patients with advanced hepatocellular carcinoma,nivolumab plus ipilimumab,not specified,overall survival and response rate,randomized controlled trial,True,Matches all target PICOS criteria.
67,patients with advanced HCC and extrahepatic metastasis,FOLFOX4-ATRA,FOLFOX4-placebo,overall survival,"randomized, double-blind, placebo-controlled study",False,"Intervention is chemotherapy, not immunotherapy or targeted therapy."
68,patients with early-stage resectable HCC,neoadjuvant PD-1 blockade plus SBRT,not specified,tumor response and safety,phase 1b trial,False,"Study design is phase 1b trial, not RCT."
69,patients with hepatocellular carcinoma,not specified,not specified,prognosis and survival,prospective cohort study,False,Intervention not specified; study design is not RCT.
10,patients with small hepatocellular carcinoma,laparoscopic liver resection,radiofrequency ablation,overall survival and recurrence-free survival,randomized controlled trial,False,Intervention and comparison do not match the target criteria of immunotherapy or targeted therapy versus standard therapy or placebo.
11,patients with advanced hepatocellular carcinoma,Lenvatinib combined with transarterial chemoembolization,Lenvatinib monotherapy,overall survival,randomized controlled trial,False,Intervention and comparison do not match the target criteria of immunotherapy or targeted therapy versus standard therapy or placebo.
12,patients at risk of hepatocellular carcinoma,not specified,not specified,prediction of HCC development,observational study,False,"Does not meet the target criteria for intervention, comparison, outcome, or study design."
13,patients with autoimmune hepatitis,not specified,not specified,risk of hepatocellular carcinoma,retrospective observational study,False,"Does not meet the target criteria for intervention, comparison, outcome, or study design."
14,HCC patients with microvascular invasion,postoperative adjuvant hepatic arterial infusion chemotherapy,routine follow-up,disease-free survival,randomized controlled trial,False,Intervention and comparison do not match the target criteria of immunotherapy or targeted therapy versus standard therapy or placebo.
15,patients with advanced solid tumours,cadonilimab monotherapy,not specified,objective response rate,phase 1b/2 trial,False,Population and outcome do not match the target criteria.
16,patients with unresectable HCC,Lenvatinib plus anti-PD-1 antibodies,not specified,conversion success rate,single-arm phase II study,False,Comparison and study design do not match the target criteria.
17,patients with locally advanced HCC,TACE and stereotactic body radiotherapy followed by avelumab,not specified,proportion of patients amenable to curative treatment,single-arm phase 2 trial,False,Comparison and study design do not match the target criteria.
18,patients with advanced HCC,pembrolizumab,placebo,overall survival,double-blind phase III trial,True,"Meets all target criteria: population, intervention, comparison, outcome, and study design."
19,patients with HCC,Atezolizumab plus bevacizumab,not specified,progression-free survival and overall survival,real-world setting analysis,False,Comparison and study design do not match the target criteria.
40,patients with hepatocellular carcinoma,not specified,not specified,overall and progression-free survival,retrospective observational study,False,Intervention and comparison not specified; study design does not match
41,patients with unresectable hepatocellular carcinoma,"STRIDE regimen, durvalumab",sorafenib,patient-reported outcomes including quality of life,randomized controlled trial,True,Matches all PICOS criteria
42,patients with hepatocellular carcinoma,not specified,not specified,overall and cancer-specific survival,retrospective study,False,Intervention and comparison not specified; study design does not match
43,patients with surgically treated hepatocellular carcinoma,not specified,not specified,early relapse and survival,retrospective analysis,False,Intervention and comparison not specified; study design does not match
44,HCC patients undergoing hepatic resection,virtual reality education program,conventional explanation processes,anxiety and knowledge about liver resection,randomized controlled trial,False,Population and intervention do not match target criteria
45,HCC patients with Child-Pugh score 5 undergoing liver resection,not specified,not specified,post-hepatectomy liver failure,retrospective study,False,Intervention and comparison not specified; study design does not match
46,adult patients with unresectable hepatocellular carcinoma,tremelimumab in combination with durvalumab,sorafenib,overall survival,randomized controlled trial,True,Matches all PICOS criteria
47,patients with advanced or unresectable hepatocellular carcinoma,SBRT followed by nivolumab alone or plus ipilimumab,not specified,"overall survival, progression-free survival",multicenter phase 1 randomized trial,False,Comparison not specified
48,HCC patients exceeding the Milan criteria,neoadjuvant pembrolizumab plus lenvatinib,control group,recurrence-free survival after liver transplantation,"prospective, randomized, open-label, pilot study",False,Population does not match target criteria
49,patients with unresectable hepatocellular carcinoma,stereotactic body radiotherapy,not specified,"progression-free survival, overall survival",phase 2 nonrandomized controlled trial,False,Comparison not specified; study design does not match
20,patients with advanced hepatocellular carcinoma,sitravatinib with/without tislelizumab,not specified,objective response rate,phase Ib/II study,False,"No comparison to standard therapy or placebo specified; study design is phase Ib/II, not randomized controlled trial"
21,patients with advanced HCC previously treated with a multityrosine kinase inhibitor,DNA plasmid PTCV plus pembrolizumab,not specified,objective response rate,"single-arm, open-label, phase 1/2 study",False,"No comparison to standard therapy or placebo specified; study design is single-arm, not randomized controlled trial"
22,people living with HBV and T2DM,not specified,not specified,burden of liver cancer,observational study,False,"Population does not match; no intervention, comparison, or randomized controlled trial design specified"
23,patients with HCC with MVI,adjuvant sintilimab,active surveillance,recurrence-free survival,"randomized, controlled, phase 2 trial",True,"Matches all PICOS criteria: population, intervention, comparison, outcome, and study design"
24,cancer patients with irAE-n,not specified,not specified,immune cell dysregulation,observational cohort study,False,"Population does not match; no intervention, comparison, or randomized controlled trial design specified"
25,patients with localized early HCC,radiation therapy,not specified,local control and adverse events,not specified,False,No comparison to standard therapy or placebo specified; study design not specified
26,patients with unresectable hepatocellular carcinoma,regorafenib-nivolumab,not specified,objective response rate,"single-arm, phase 2 trial",False,"No comparison to standard therapy or placebo specified; study design is single-arm, not randomized controlled trial"
27,patients with hepatocellular carcinoma or liver metastases,single-fraction radiotherapy,best supportive care,improvement in hepatic pain,"randomized, controlled, phase 3 trial",True,"Matches all PICOS criteria: population, intervention, comparison, outcome, and study design"
28,patients with T2D and concomitant NAFLD,"SGLT2 inhibitors, thiazolidinediones, DPP-4 inhibitors, or sulfonylureas",not specified,NAFLD regression and liver-related outcomes,retrospective nonrandomized interventional cohort study,False,Population does not match; no comparison to standard therapy or placebo specified; study design is not randomized controlled trial
29,liver cirrhosis patients,not specified,not specified,identification of non-invasive biomarkers,prospective study,False,"Population does not match; no intervention, comparison, or randomized controlled trial design specified"
30,patients with hepatocellular carcinoma,endoscopic variceal ligation or propranolol,endoscopic variceal ligation vs propranolol,overall survival and variceal bleeding,randomized controlled trial,False,intervention does not match immunotherapy or targeted therapy
31,patients with mild-to-moderate Covid-19,simnotrelvir plus ritonavir,simnotrelvir plus ritonavir vs placebo,time to sustained resolution of symptoms,randomized controlled trial,False,population does not match hepatocellular carcinoma
32,patients with locally advanced unresectable HCC,Y90-radioembolization and durvalumab,not specified,"time to progression, overall survival, progression-free survival, objective response rate",phase I/IIa pilot trial,True,matches all PICOS criteria
33,patients with unresectable HCC,lenvatinib vs atezolizumab plus bevacizumab,lenvatinib vs atezolizumab plus bevacizumab,overall survival,retrospective multi-centre study,False,study design does not match randomized controlled trial
34,patients with advanced hepatocellular carcinoma,nivolumab plus cabozantinib with or without ipilimumab,nivolumab plus cabozantinib vs nivolumab plus cabozantinib with ipilimumab,"objective response rate, duration of response, progression-free survival, overall survival",phase I/II study,True,matches all PICOS criteria
35,patients with unresectable HCC,UCPVax vaccine with atezolizumab and bevacizumab,not specified,objective response rate,multicenter randomized phase II study,False,comparison not specified
36,patients with advanced hepatocellular carcinoma,nivolumab monotherapy,not specified,"objective response rate, overall survival",phase I/II study,False,comparison not specified
37,patients with HCC refractory to prior ICI-based treatment,cabozantinib,not specified,"progression-free survival, overall survival",phase II clinical trial,False,comparison not specified
38,patients with recurrent or oligometastatic HCC,SBRT plus sintilimab,not specified,"progression-free survival, overall survival",clinical trial,False,comparison not specified
39,"patients with hepatocellular carcinoma in Ceará, Brazil","liver transplantation, transarterial chemoembolization",not specified,"hepatocellular carcinoma recurrence, treatment outcomes",retrospective observational study,False,study design does not match randomized controlled trial
70,postmenopausal women,diabetes risk reduction diet,not specified,liver cancer incidence and chronic liver disease mortality,observational study,False,Population does not match; intervention and comparison do not match target criteria; study design is not a randomized controlled trial.
71,patients with advanced intrahepatic cholangiocarcinoma,"toripalimab, lenvatinib, and GEMOX",not specified,"objective response rate, overall survival, progression-free survival","phase-III, multicenter, double-blinded, randomized study",False,Population does not match; intervention partially matches but not specific to hepatocellular carcinoma; study design matches.
72,HCC patients,TACE and HAIC,not specified,impact on liver function,not specified,False,Population matches; intervention does not match target criteria; outcome and study design do not match.
73,patients with HCC,DEB-TACE,not specified,acute liver function deterioration,not specified,False,Population matches; intervention does not match target criteria; outcome and study design do not match.
74,patients with advanced HCC,atezolizumab/bevacizumab,not specified,organ-specific responses,"retrospective, multicenter, observational study",False,Population matches; intervention matches; outcome and study design do not match.
75,patients with HCC,atezolizumab and bevacizumab with tiragolumab or placebo,placebo,clinical benefit,"randomized, double-blind, placebo-controlled Phase III study",True,"Population, intervention, comparison, outcome, and study design match target criteria."
76,patients with advanced HCC,SIRT/Sorafenib treatment,sorafenib,overall survival,subanalysis of the SORAMIC trial,False,Population matches; intervention and comparison partially match; outcome matches; study design does not match.
77,patients with hepatocellular carcinoma with portal vein tumor thrombus,sorafenib plus transarterial chemoembolization,sorafenib alone,recurrence-free survival and overall survival,"phase 3, multicenter, randomized clinical trial",True,"Population, intervention, comparison, outcome, and study design match target criteria."
78,patients with locally advanced or metastatic HCC,BLU-554 combined with CS1001,not specified,objective response rate,Phase Ib/II trial,False,Population matches; intervention matches; comparison not specified; outcome matches; study design partially matches.
79,patients at high risk of HCC,low-contrast-dose CT using dual-energy CT and deep learning-based denoising,standard-contrast-dose CT,HCC conspicuity,"prospective, randomized controlled noninferiority trial",False,Population matches; intervention and comparison do not match target criteria; outcome and study design do not match.
50,patients at stage IV of HCC,development of nomogram models,not specified,cancer-specific survival,retrospective cohort study,False,"Does not match target criteria: no intervention of immunotherapy or targeted therapy, no comparison, not a randomized controlled trial."
51,individuals with unresectable HCC,systemic anti-angiogenic therapy,not specified,overall survival,phase III study,False,"Does not match target criteria: intervention is not immunotherapy or targeted therapy, no comparison, not a randomized controlled trial."
52,outpatient patients with HCC,oral targeted therapy,not specified,nonadherence status,prospective observational study,False,"Does not match target criteria: no comparison, outcome is not survival or response rate, not a randomized controlled trial."
53,patients with previously untreated advanced HCC,cabozantinib plus atezolizumab,sorafenib,overall survival and progression-free survival,"randomized, phase 3 study",True,"Matches target criteria: population, intervention, comparison, outcome, and study design all align with target criteria."
54,patients with HCC,not specified,not specified,diagnosis of liver cirrhosis,not specified,False,"Does not match target criteria: no intervention, no comparison, outcome not related to survival or response rate, study design not specified."
55,"patients with refractory solid tumors, including HCC",navitoclax plus sorafenib,not specified,safety and efficacy,phase 1 study,False,"Does not match target criteria: no comparison, outcome not specifically survival or response rate, not a randomized controlled trial."
56,patients with advanced HCC,cadonilimab plus lenvatinib,not specified,"objective response rate, safety, progression-free survival, overall survival",phase Ib/II study,False,"Does not match target criteria: no comparison, not a randomized controlled trial."
57,patients with advanced HCC with extrahepatic metastasis,FOLFOX chemotherapy plus lenvatinib and toripalimab,not specified,"progression-free survival, overall survival, objective response rate",phase II trial,False,"Does not match target criteria: no comparison, not a randomized controlled trial."
58,patients with HCC,antidepressant use,not specified,overall and cancer-specific mortality,population-based cohort study,False,"Does not match target criteria: intervention not immunotherapy or targeted therapy, no comparison, not a randomized controlled trial."
59,patients with chronic hepatitis B infection or cirrhosis,ultrasound-based vs. biomarker-based screening,not specified,reduction in late-stage HCC,adaptive pragmatic randomized phase IV trial,False,"Does not match target criteria: intervention not related to treatment, no comparison, outcome not survival or response rate."
100,patients with hepatitis B,nurse-led decision counselling programme,usual care,hepatocellular carcinoma screening rate,single-blind randomised controlled trial,False,Population does not match; intervention and outcome do not match target criteria.
101,patients with hepatocellular carcinoma,fostroxacitabine bralpamide,not specified,"safety, preliminary efficacy","open-label, single-arm, phase 1a/1b study",False,Comparison and outcome do not match target criteria; study design is not randomized controlled trial.
102,CHB patients with elevated cholesterol levels,statin therapy,statin non-user,development of HCC,observational data to emulate a target trial,False,Population and intervention do not match; study design is not randomized controlled trial.
103,patients diagnosed with HCC,DEB-TACE using small-size microspheres,not specified,6-month objective response rate,"prospective, single-arm, multicenter study",False,Comparison and outcome do not match; study design is not randomized controlled trial.
104,patients with advanced-stage HCC,ICIs combined with antiangiogenic therapy,non-radiation therapy,"progression-free survival, overall survival",retrospective observational study,False,Study design is not randomized controlled trial.
105,patients with malignant ascites,oncolytic adenovirus H101,not specified,efficacy and safety,phase II trial,False,"Population, intervention, and outcome do not match; study design is not randomized controlled trial."
106,patients with a solitary HCC,SABR,thermal ablation or best standard of care therapy,freedom from local progression,"phase II, prospective, randomised trial",True,Matches all target PICOS criteria.
107,patients with intermediate/advanced HCC,adjuvant immune checkpoint inhibitors,without adjuvant immunotherapy,"recurrence-free survival, overall survival",prospectively-collected multicenter database,False,Study design is not randomized controlled trial.
108,patients with advanced hepatocellular carcinoma,OBP-301,not specified,safety and optimal dosage,phase I dose-escalation trial,False,Comparison and outcome do not match; study design is not randomized controlled trial.
109,patients with HCC,proton beam radiotherapy,transarterial chemoembolization,overall survival,randomized,True,Matches all target PICOS criteria.
80,patients at high-risk for hepatocellular carcinoma,deep-learning-based contrast-boosting algorithm on double-low-dose CT,standard-dose CT,"contrast-to-noise ratio, image quality, lesion detection rate",randomized controlled trial,False,"Population and study design match, but intervention and outcomes do not match the target criteria."
81,patients with large or huge hepatocellular carcinoma,transcatheter arterial chemoembolization with CalliSpheres beads loaded with arsenic trioxide,conventional transcatheter arterial chemoembolization,"progression-free survival, overall survival, treatment response",randomized controlled trial,True,All PICOS elements match the target criteria.
82,patients with hepatocellular carcinoma previously treated with chemoembolization or yttrium-90 resin transarterial radioembolization,yttrium-90 resin transarterial radioembolization,chemoembolization,"overall survival, best response, toxicities",prospective observational study,False,"Population and outcomes match, but intervention and study design do not match the target criteria."
83,individuals attending a health center in Cameroon,not specified,not specified,association between anti-HCV positivity and liver impairment,facility-based observational study,False,Population and study design do not match the target criteria.
84,patients with hepatocellular carcinoma with portal vein tumor thrombus,sintilimab plus bevacizumab combined with radiotherapy,not specified,"objective response rate, overall survival, progression-free survival","open-label, multicenter, single-arm, phase 2 clinical trial",False,"Population and outcomes match, but intervention and study design do not match the target criteria."
85,patients with unresectable hepatocellular carcinoma,bavituximab plus pembrolizumab,not specified,"objective response rate, progression-free survival, overall survival",single-arm phase 2 trial,False,"Population and outcomes match, but intervention and study design do not match the target criteria."
86,patients with histologically proven BCLC-B/C hepatocellular carcinoma without previous systemic therapy,ipilimumab plus atezolizumab/bevacizumab,atezolizumab/bevacizumab,"objective response rate, overall survival, progression-free survival","multicentre, randomised, open-label phase II-III trial",True,All PICOS elements match the target criteria.
87,patients with hepatocellular carcinoma,acyclic retinoid,not specified,"HCC recurrence, long-term HCC prognosis",phase 3 clinical trial,False,"Population and outcomes match, but intervention and study design do not match the target criteria."
88,patients with cirrhosis in a multicenter randomized trial of HCC surveillance outreach,not specified,not specified,psychological harms of HCC surveillance,multicenter randomized trial,False,Population and study design do not match the target criteria.
89,patients undergoing liver transplantation,hypothermic oxygenated machine perfusion,static cold storage,"early allograft dysfunction, graft failure, biliary strictures","multicenter, randomized, open-label, noninferiority trial",False,Population and study design do not match the target criteria.
120,patients with hepatocellular carcinoma,transarterial chemoembolization (TACE),not specified,progression-free survival (PFS) and TACE treatment response,prospective single-center observational study,False,"Intervention is not immunotherapy or targeted therapy, and study design is not a randomized controlled trial."
121,patients with advanced hepatocellular carcinoma,radiotherapy combined with tislelizumab and anlotinib,not specified,overall survival (OS) and progression-free survival (PFS),not specified,False,"Comparison is not specified, and study design is not a randomized controlled trial."
122,Hepatocellular carcinoma patients with macrovascular invasion,perioperative tislelizumab plus intensity modulated radiotherapy (IMRT),not specified,overall response rate (ORR) and overall survival (OS),phase 2 trial,False,"Comparison is not specified, and study design is a phase 2 trial, not a randomized controlled trial."
123,patients with cirrhosis undergoing TIPS,recompensation after TIPS,compensated cirrhosis patients,risk of hepatocellular carcinoma (HCC) and death,observational study,False,"Population is not specifically hepatocellular carcinoma patients, and study design is not a randomized controlled trial."
